--
-- fasttrun_stats — статистика по колонкам, локальная для сессии
-- (через get_relation_stats_hook), без записи в pg_statistic.
--
-- ВАЖНО: собранная статистика переживает commit и живёт до конца сеанса.
-- Транзакционный callback на commit снимает только привязку к счётчикам
-- транзакции, а на abort откатывает изменения этой транзакции. В BEGIN/COMMIT
-- обёрнуты те секции, где важна граница транзакции сама по себе.
--
/*
 * Поколоночный учёт UPDATE работает только там, где библиотека предзагружена:
 * иначе операторы, начавшиеся до её загрузки, остались невидимыми, и учёт
 * выключается на весь сеанс. Набор поднимает предзагрузку для своей базы и
 * переподключается, а в конце возвращает всё как было.
 */
ALTER DATABASE :DBNAME SET session_preload_libraries = 'fasttrun';
\connect -
CREATE EXTENSION fasttrun;
-- Узкая высокоселективная временная таблица с btree-индексом.
-- Без статистики по колонкам планировщик берёт DEFAULT_EQ_SEL=0.005
-- и выбирает Bitmap Heap Scan.  С нашей статистикой (n_distinct ~
-- reltuples, потому что id уникален) eq_sel = 1/N и план становится
-- Index Scan.
CREATE TEMP TABLE t_stats (id int, payload text);
INSERT INTO t_stats SELECT g, 'data_' || g FROM generate_series(1, 100000) g;
CREATE INDEX ON t_stats (id);
-- ----------------------------------------------------------------------
-- 1. auto_collect_stats=off + ручной вызов fasttrun_collect_stats
--    внутри одной транзакции: до сбора — Bitmap Heap Scan, после —
--    Index Scan
-- ----------------------------------------------------------------------
BEGIN;
SET LOCAL fasttrun.auto_collect_stats = off;
SELECT fasttrun_analyze('t_stats');
 fasttrun_analyze 
------------------
 
(1 row)

EXPLAIN (COSTS OFF) SELECT * FROM t_stats WHERE id = 12345;
                QUERY PLAN                 
-------------------------------------------
 Bitmap Heap Scan on t_stats
   Recheck Cond: (id = 12345)
   ->  Bitmap Index Scan on t_stats_id_idx
         Index Cond: (id = 12345)
(4 rows)

SELECT fasttrun_collect_stats('t_stats');
 fasttrun_collect_stats 
------------------------
 
(1 row)

EXPLAIN (COSTS OFF) SELECT * FROM t_stats WHERE id = 12345;
                 QUERY PLAN                 
--------------------------------------------
 Index Scan using t_stats_id_idx on t_stats
   Index Cond: (id = 12345)
(2 rows)

COMMIT;
-- ----------------------------------------------------------------------
-- 2. После COMMIT session-local stats остаются видимыми до DML/DDL.
--    Это ближе к обычному ANALYZE: планы в следующей транзакции не
--    деградируют только из-за границы транзакции.
-- ----------------------------------------------------------------------
EXPLAIN (COSTS OFF) SELECT * FROM t_stats WHERE id = 12345;
                 QUERY PLAN                 
--------------------------------------------
 Index Scan using t_stats_id_idx on t_stats
   Index Cond: (id = 12345)
(2 rows)

-- ----------------------------------------------------------------------
-- 3. auto_collect_stats=on (значение по умолчанию): fasttrun_analyze
--    собирает статистику автоматически на первом полном проходе,
--    отдельный вызов collect_stats не нужен
-- ----------------------------------------------------------------------
BEGIN;
SELECT fasttrun_analyze('t_stats');
 fasttrun_analyze 
------------------
 
(1 row)

EXPLAIN (COSTS OFF) SELECT * FROM t_stats WHERE id = 12345;
                 QUERY PLAN                 
--------------------------------------------
 Index Scan using t_stats_id_idx on t_stats
   Index Cond: (id = 12345)
(2 rows)

COMMIT;
-- ----------------------------------------------------------------------
-- 4. fasttrun.sample_rows=0 отключает сбор даже при auto_collect=on
-- ----------------------------------------------------------------------
BEGIN;
SET LOCAL fasttrun.sample_rows = 0;
SELECT fasttrun_analyze('t_stats');
 fasttrun_analyze 
------------------
 
(1 row)

EXPLAIN (COSTS OFF) SELECT * FROM t_stats WHERE id = 12345;
                 QUERY PLAN                 
--------------------------------------------
 Index Scan using t_stats_id_idx on t_stats
   Index Cond: (id = 12345)
(2 rows)

COMMIT;
-- ----------------------------------------------------------------------
-- 5. Многоколоночная таблица: автосбор статистики для всех колонок
-- ----------------------------------------------------------------------
CREATE TEMP TABLE t_multi (
    id int,
    user_id int,
    flag bool,
    payload text
);
INSERT INTO t_multi
SELECT g, g % 1000, g % 2 = 0, 'd_' || g
FROM generate_series(1, 50000) g;
CREATE INDEX ON t_multi (id);
CREATE INDEX ON t_multi (user_id);
BEGIN;
SELECT fasttrun_analyze('t_multi');
 fasttrun_analyze 
------------------
 
(1 row)

-- Equality по user_id (1000 уникальных значений, ~50 строк на каждое):
-- по умолчанию выбрался бы Bitmap, со статистикой — тоже Bitmap, но
-- более точная оценка стоимости; форма плана может не меняться
EXPLAIN (COSTS OFF) SELECT * FROM t_multi WHERE id = 12345;
                 QUERY PLAN                 
--------------------------------------------
 Index Scan using t_multi_id_idx on t_multi
   Index Cond: (id = 12345)
(2 rows)

EXPLAIN (COSTS OFF) SELECT * FROM t_multi WHERE user_id = 42;
                   QUERY PLAN                   
------------------------------------------------
 Bitmap Heap Scan on t_multi
   Recheck Cond: (user_id = 42)
   ->  Bitmap Index Scan on t_multi_user_id_idx
         Index Cond: (user_id = 42)
(4 rows)

COMMIT;
-- ----------------------------------------------------------------------
-- 6. Молчаливое игнорирование отсутствующей таблицы — функция
--    ничего не делает, ошибки нет
-- ----------------------------------------------------------------------
SELECT fasttrun_collect_stats('nonexistent_temp_xyz');
 fasttrun_collect_stats 
------------------------
 
(1 row)

-- ----------------------------------------------------------------------
-- 7. Ошибка на обычной (не временной) таблице
-- ----------------------------------------------------------------------
CREATE TABLE t_stats_persist (a int);
INSERT INTO t_stats_persist VALUES (1);
SELECT fasttrun_collect_stats('t_stats_persist');
ERROR:  fasttrun_collect_stats: relation "t_stats_persist" is not a local temporary table
-- Соединение продолжает работать
SELECT 1 AS still_alive;
 still_alive 
-------------
           1
(1 row)

-- ----------------------------------------------------------------------
-- 8. Устаревшая статистика после UPDATE, меняющего распределение.
--    Хук должен заметить, что pgstat-счётчики изменились
--    (tuples_updated), и НЕ отдавать кешированный n_distinct, иначе
--    планировщик оставит план, рассчитанный на старое распределение.
-- ----------------------------------------------------------------------
CREATE TEMP TABLE t_stale (id int, grp int);
INSERT INTO t_stale SELECT g, g FROM generate_series(1, 100000) g;
CREATE INDEX ON t_stale (grp);
BEGIN;
SELECT fasttrun_collect_stats('t_stale');
 fasttrun_collect_stats 
------------------------
 
(1 row)

EXPLAIN (COSTS OFF) SELECT * FROM t_stale WHERE grp = 1;
                 QUERY PLAN                  
---------------------------------------------
 Index Scan using t_stale_grp_idx on t_stale
   Index Cond: (grp = 1)
(2 rows)

UPDATE t_stale SET grp = 1;
EXPLAIN (COSTS OFF) SELECT * FROM t_stale WHERE grp = 1;
                 QUERY PLAN                 
--------------------------------------------
 Bitmap Heap Scan on t_stale
   Recheck Cond: (grp = 1)
   ->  Bitmap Index Scan on t_stale_grp_idx
         Index Cond: (grp = 1)
(4 rows)

COMMIT;
DROP TABLE t_stale;
-- ----------------------------------------------------------------------
-- 8b. После сброса локальной статистики планировщик не должен читать
--     старые значения остальных колонок из pg_statistic.
-- ----------------------------------------------------------------------
CREATE TEMP TABLE t_policy_default (id int, grp int);
INSERT INTO t_policy_default SELECT g, 1 FROM generate_series(1, 10000) g;
ANALYZE t_policy_default;
SELECT fasttruncate('t_policy_default');
 fasttruncate 
--------------
 
(1 row)

INSERT INTO t_policy_default SELECT g, g FROM generate_series(1, 10000) g;
SET fasttrun.auto_collect_stats = off;
SELECT fasttrun_analyze('t_policy_default');
 fasttrun_analyze 
------------------
 
(1 row)

DO $$
DECLARE ln text; est int := NULL;
BEGIN
  FOR ln IN EXPLAIN SELECT * FROM t_policy_default WHERE grp = 1 LOOP
    IF ln ~ 'on t_policy_default' THEN
      est := substring(ln FROM 'rows=(\d+)')::int;
      EXIT;
    END IF;
  END LOOP;
  IF est IS NULL OR est < 20 OR est > 100 THEN
    RAISE EXCEPTION 'stale core stats escaped neutral policy: est=%', est;
  END IF;
END$$;
SELECT 'relation_policy_blocks_core' AS marker;
           marker            
-----------------------------
 relation_policy_blocks_core
(1 row)

RESET fasttrun.auto_collect_stats;
DROP TABLE t_policy_default;
-- ----------------------------------------------------------------------
-- 8c. Скрытая статистика должна безопасно работать и с BRIN.
--     BRIN передаёт хуку неинициализированный VariableStatData, поэтому
--     ветка без локального statsTuple обязана явно вернуть NULL.
-- ----------------------------------------------------------------------
DO $$
DECLARE ln text;
BEGIN
  EXECUTE 'CREATE TEMP TABLE t_brin_hidden_stats (id int, grp int)';
  EXECUTE 'INSERT INTO t_brin_hidden_stats SELECT g, g FROM generate_series(1, 100000) g';
  EXECUTE 'CREATE INDEX ON t_brin_hidden_stats USING brin (grp)';
  EXECUTE 'ANALYZE t_brin_hidden_stats';
  PERFORM fasttruncate('t_brin_hidden_stats');
  EXECUTE 'INSERT INTO t_brin_hidden_stats SELECT g, g FROM generate_series(1, 10000) g';
  PERFORM set_config('enable_seqscan', 'off', true);
  FOR ln IN EXECUTE
      'EXPLAIN (COSTS OFF) SELECT * FROM t_brin_hidden_stats WHERE grp BETWEEN 10 AND 20'
  LOOP
    NULL;
  END LOOP;
END$$;
\echo brin_hidden_stats_safe
brin_hidden_stats_safe
DROP TABLE t_brin_hidden_stats;
-- ----------------------------------------------------------------------
-- 8d. DDL нетронутой таблицы не должен скрывать её ядерную статистику,
--     даже если кэши fasttrun уже созданы для другой таблицы.
-- ----------------------------------------------------------------------
DO $$
DECLARE ln text; est int; stat_count int;
BEGIN
  EXECUTE 'CREATE TEMP TABLE t_unmanaged_ddl_seed (id int)';
  EXECUTE 'INSERT INTO t_unmanaged_ddl_seed SELECT generate_series(1, 100)';
  PERFORM fasttrun_analyze('t_unmanaged_ddl_seed');

  EXECUTE 'CREATE TEMP TABLE t_unmanaged_index (id int, v int)';
  EXECUTE 'INSERT INTO t_unmanaged_index SELECT g, g FROM generate_series(1, 10000) g';
  EXECUTE 'ANALYZE t_unmanaged_index';
  EXECUTE 'CREATE INDEX ON t_unmanaged_index (id)';
  FOR ln IN EXECUTE 'EXPLAIN SELECT * FROM t_unmanaged_index WHERE v = 4242' LOOP
    IF ln ~ 'on t_unmanaged_index' THEN
      est := substring(ln FROM 'rows=(\d+)')::int;
      EXIT;
    END IF;
  END LOOP;
  SELECT count(*) INTO stat_count FROM pg_statistic
   WHERE starelid = 't_unmanaged_index'::regclass;
  IF est IS DISTINCT FROM 1 OR stat_count <> 2 THEN
    RAISE EXCEPTION 'CREATE INDEX hid core stats: est=%, rows=%', est, stat_count;
  END IF;

  EXECUTE 'CREATE TEMP TABLE t_unmanaged_alter (id int, v int)';
  EXECUTE 'INSERT INTO t_unmanaged_alter SELECT g, g FROM generate_series(1, 10000) g';
  EXECUTE 'ANALYZE t_unmanaged_alter';
  EXECUTE 'ALTER TABLE t_unmanaged_alter SET (autovacuum_enabled = false)';
  est := NULL;
  FOR ln IN EXECUTE 'EXPLAIN SELECT * FROM t_unmanaged_alter WHERE v = 4242' LOOP
    IF ln ~ 'on t_unmanaged_alter' THEN
      est := substring(ln FROM 'rows=(\d+)')::int;
      EXIT;
    END IF;
  END LOOP;
  SELECT count(*) INTO stat_count FROM pg_statistic
   WHERE starelid = 't_unmanaged_alter'::regclass;
  IF est IS DISTINCT FROM 1 OR stat_count <> 2 THEN
    RAISE EXCEPTION 'ALTER TABLE hid core stats: est=%, rows=%', est, stat_count;
  END IF;
END$$;
\echo unmanaged_ddl_keeps_core_stats
unmanaged_ddl_keeps_core_stats
DROP TABLE t_unmanaged_ddl_seed;
DROP TABLE t_unmanaged_index;
DROP TABLE t_unmanaged_alter;
-- ----------------------------------------------------------------------
-- 9. fasttruncate должен явно вытеснить кэш статистики по OID таблицы
--    (запасной механизм на случай, когда pgstat недоступен или
--    счётчики сброшены).
-- ----------------------------------------------------------------------
CREATE TEMP TABLE t_trunc_evict (id int);
INSERT INTO t_trunc_evict SELECT generate_series(1, 100000) g;
CREATE INDEX ON t_trunc_evict (id);
BEGIN;
SELECT fasttrun_collect_stats('t_trunc_evict');
 fasttrun_collect_stats 
------------------------
 
(1 row)

EXPLAIN (COSTS OFF) SELECT * FROM t_trunc_evict WHERE id = 12345;
                         QUERY PLAN                          
-------------------------------------------------------------
 Index Only Scan using t_trunc_evict_id_idx on t_trunc_evict
   Index Cond: (id = 12345)
(2 rows)

SELECT fasttruncate('t_trunc_evict');
 fasttruncate 
--------------
 
(1 row)

INSERT INTO t_trunc_evict SELECT generate_series(1, 100) g;
EXPLAIN (COSTS OFF) SELECT * FROM t_trunc_evict WHERE id = 12345;
        QUERY PLAN         
---------------------------
 Seq Scan on t_trunc_evict
   Filter: (id = 12345)
(2 rows)

COMMIT;
DROP TABLE t_trunc_evict;
-- ----------------------------------------------------------------------
-- 10. Самостоятельный fasttrun_collect_stats (без fasttrun_analyze)
--     должен переживать COMMIT в рамках backend'а, если после сбора
--     не было DML.  Это ближе к обычному ANALYZE: план в следующей
--     транзакции не должен внезапно деградировать только из-за COMMIT.
-- ----------------------------------------------------------------------
CREATE TEMP TABLE t_leak (id int);
INSERT INTO t_leak SELECT generate_series(1, 100000) g;
CREATE INDEX ON t_leak (id);
BEGIN;
SELECT fasttrun_collect_stats('t_leak');
 fasttrun_collect_stats 
------------------------
 
(1 row)

EXPLAIN (COSTS OFF) SELECT * FROM t_leak WHERE id = 12345;
                  QUERY PLAN                   
-----------------------------------------------
 Index Only Scan using t_leak_id_idx on t_leak
   Index Cond: (id = 12345)
(2 rows)

COMMIT;
EXPLAIN (COSTS OFF) SELECT * FROM t_leak WHERE id = 12345;
                  QUERY PLAN                   
-----------------------------------------------
 Index Only Scan using t_leak_id_idx on t_leak
   Index Cond: (id = 12345)
(2 rows)

DROP TABLE t_leak;
-- ----------------------------------------------------------------------
-- 11. Автоматический пересбор статистики при значимом DML.
--     Управляется порогом: если доля изменённых строк
--     (insert+update+delete с момента предыдущего сбора, делённая на
--     текущий reltuples) больше fasttrun.stats_refresh_threshold
--     (значение по умолчанию 0.2 = 20%), то очередной fasttrun_analyze
--     запускает пересбор статистики через полный reservoir sample.
--     Это дороже старой блочной выборки, зато совпадает с качеством
--     обычного ANALYZE на физически кластеризованных и sparse heap.
-- ----------------------------------------------------------------------
-- 11a. Значительный UPDATE (churn=1.0) → пересбор → план обновляется
CREATE TEMP TABLE t_refresh (id int, grp int);
INSERT INTO t_refresh SELECT g, g FROM generate_series(1, 100000) g;
CREATE INDEX ON t_refresh (grp);
BEGIN;
SELECT fasttrun_analyze('t_refresh');
 fasttrun_analyze 
------------------
 
(1 row)

EXPLAIN (COSTS OFF) SELECT * FROM t_refresh WHERE grp = 1;
                   QUERY PLAN                    
-------------------------------------------------
 Index Scan using t_refresh_grp_idx on t_refresh
   Index Cond: (grp = 1)
(2 rows)

UPDATE t_refresh SET grp = 1;        -- доля изменений = 1.0 > 0.2 → пересбор
SELECT fasttrun_analyze('t_refresh');
 fasttrun_analyze 
------------------
 
(1 row)

EXPLAIN (COSTS OFF) SELECT * FROM t_refresh WHERE grp = 1;
      QUERY PLAN       
-----------------------
 Seq Scan on t_refresh
   Filter: (grp = 1)
(2 rows)

COMMIT;
-- 11b. Маленький DELETE при пороге 0.2 — 0.009% ниже порога → пересбора
--      нет, но churn в пределах толерантности, поэтому soft freshness
--      отдаёт кешированную стату планировщику (как ядро PG между ANALYZE).
--      После 11a grp=1 — это все строки, так что план остаётся Seq Scan.
BEGIN;
SELECT fasttrun_analyze('t_refresh');
 fasttrun_analyze 
------------------
 
(1 row)

EXPLAIN (COSTS OFF) SELECT * FROM t_refresh WHERE grp = 1;
      QUERY PLAN       
-----------------------
 Seq Scan on t_refresh
   Filter: (grp = 1)
(2 rows)

DELETE FROM t_refresh WHERE id < 10; -- 9 строк из 100000 = 0.009%
SELECT fasttrun_analyze('t_refresh');
 fasttrun_analyze 
------------------
 
(1 row)

EXPLAIN (COSTS OFF) SELECT * FROM t_refresh WHERE grp = 1;
      QUERY PLAN       
-----------------------
 Seq Scan on t_refresh
   Filter: (grp = 1)
(2 rows)

COMMIT;
-- 11c. Порог = 0 принудительно запускает пересбор при любом DML
BEGIN;
SET LOCAL fasttrun.stats_refresh_threshold = 0;
SELECT fasttrun_analyze('t_refresh');
 fasttrun_analyze 
------------------
 
(1 row)

EXPLAIN (COSTS OFF) SELECT * FROM t_refresh WHERE grp = 1;
      QUERY PLAN       
-----------------------
 Seq Scan on t_refresh
   Filter: (grp = 1)
(2 rows)

DELETE FROM t_refresh WHERE id < 20; -- даже 0.018% запускает пересбор
SELECT fasttrun_analyze('t_refresh');
 fasttrun_analyze 
------------------
 
(1 row)

EXPLAIN (COSTS OFF) SELECT * FROM t_refresh WHERE grp = 1;
      QUERY PLAN       
-----------------------
 Seq Scan on t_refresh
   Filter: (grp = 1)
(2 rows)

COMMIT;
-- 11d. Порог = 1.0 отключает пересбор и задаёт максимальную толерантность:
--      стата прячется только когда churn достигает 100%.  Полный UPDATE
--      (100% строк) превышает порог → fallback к defaults.
BEGIN;
SET LOCAL fasttrun.stats_refresh_threshold = 1;
SELECT fasttrun_analyze('t_refresh');
 fasttrun_analyze 
------------------
 
(1 row)

EXPLAIN (COSTS OFF) SELECT * FROM t_refresh WHERE grp = 1;
      QUERY PLAN       
-----------------------
 Seq Scan on t_refresh
   Filter: (grp = 1)
(2 rows)

UPDATE t_refresh SET grp = 999;     -- любой DML → пересбор отключён
SELECT fasttrun_analyze('t_refresh');
 fasttrun_analyze 
------------------
 
(1 row)

EXPLAIN (COSTS OFF) SELECT * FROM t_refresh WHERE grp = 999;
                  QUERY PLAN                  
----------------------------------------------
 Bitmap Heap Scan on t_refresh
   Recheck Cond: (grp = 999)
   ->  Bitmap Index Scan on t_refresh_grp_idx
         Index Cond: (grp = 999)
(4 rows)

COMMIT;
-- 11e. Below-threshold DML внутри savepoint.  После ROLLBACK TO SAVEPOINT
--      counters откатываются к pre-savepoint → стата точно свежая.  Без
--      rollback тот же below-threshold DML остаётся в пределах толерантности
--      → soft freshness продолжает отдавать кешированную стату планировщику.
BEGIN;
SELECT fasttrun_analyze('t_refresh');
 fasttrun_analyze 
------------------
 
(1 row)

SAVEPOINT sp1;
DELETE FROM t_refresh WHERE id < 5;  -- ниже порога
SELECT fasttrun_analyze('t_refresh');
 fasttrun_analyze 
------------------
 
(1 row)

ROLLBACK TO sp1;
-- После отката savepoint хук должен вернуть кешированную статистику
-- (counters откатились к pre-savepoint значениям, collected_* не
-- менялся внутри savepoint → match)
EXPLAIN (COSTS OFF) SELECT * FROM t_refresh WHERE grp = 1;
                   QUERY PLAN                    
-------------------------------------------------
 Index Scan using t_refresh_grp_idx on t_refresh
   Index Cond: (grp = 1)
(2 rows)

-- Теперь тот же DML без savepoint — churn в пределах порога → стата видна
DELETE FROM t_refresh WHERE id < 5;
SELECT fasttrun_analyze('t_refresh');
 fasttrun_analyze 
------------------
 
(1 row)

EXPLAIN (COSTS OFF) SELECT * FROM t_refresh WHERE grp = 1;
                   QUERY PLAN                    
-------------------------------------------------
 Index Scan using t_refresh_grp_idx on t_refresh
   Index Cond: (grp = 1)
(2 rows)

COMMIT;
-- 11f. DML ниже порога внутри savepoint с последующим RELEASE.  RELEASE
--      продвигает pgstat counters в родительский subxact; churn остаётся в
--      пределах толерантности, поэтому soft freshness отдаёт кешированную
--      стату.
--
--      High-cardinality таблица: редкий equality-предикат на кешированной
--      стате даёт Index Scan (на defaults был бы Bitmap).
CREATE TEMP TABLE t_release_stats (id int, grp int);
INSERT INTO t_release_stats SELECT g, g FROM generate_series(1, 100000) g;
CREATE INDEX ON t_release_stats (grp);
BEGIN;
SELECT fasttrun_analyze('t_release_stats');
 fasttrun_analyze 
------------------
 
(1 row)

EXPLAIN (COSTS OFF) SELECT * FROM t_release_stats WHERE grp = 50000;
                         QUERY PLAN                          
-------------------------------------------------------------
 Index Scan using t_release_stats_grp_idx on t_release_stats
   Index Cond: (grp = 50000)
(2 rows)

SAVEPOINT sp_release;
DELETE FROM t_release_stats WHERE id < 10;  -- ниже порога
SELECT fasttrun_analyze('t_release_stats');
 fasttrun_analyze 
------------------
 
(1 row)

RELEASE SAVEPOINT sp_release;
-- Below-threshold churn → soft freshness держит стату → Index Scan.
EXPLAIN (COSTS OFF) SELECT * FROM t_release_stats WHERE grp = 50000;
                         QUERY PLAN                          
-------------------------------------------------------------
 Index Scan using t_release_stats_grp_idx on t_release_stats
   Index Cond: (grp = 50000)
(2 rows)

COMMIT;
DROP TABLE t_release_stats;
-- 11g. Targeted UPDATE концентрирует 10% строк на grp=1 — выше строгого порога
--      для high-cardinality колонки.  Cardinality-aware freshness прячет стату,
--      и planner уходит на defaults (Bitmap), а не строит Index Scan по
--      «редкому» grp=1, который на деле стал частым.  Защита сохраняется и
--      после COMMIT.
CREATE TEMP TABLE t_commit_stale_stats (id int, grp int);
INSERT INTO t_commit_stale_stats SELECT g, g FROM generate_series(1, 100000) g;
CREATE INDEX ON t_commit_stale_stats (grp);
BEGIN;
SELECT fasttrun_analyze('t_commit_stale_stats');
 fasttrun_analyze 
------------------
 
(1 row)

EXPLAIN (COSTS OFF) SELECT * FROM t_commit_stale_stats WHERE grp = 1;
                              QUERY PLAN                               
-----------------------------------------------------------------------
 Index Scan using t_commit_stale_stats_grp_idx on t_commit_stale_stats
   Index Cond: (grp = 1)
(2 rows)

UPDATE t_commit_stale_stats SET grp = 1 WHERE id <= 10000;  -- ниже порога 20%
SELECT fasttrun_analyze('t_commit_stale_stats');
 fasttrun_analyze 
------------------
 
(1 row)

-- Targeted churn выше строгого порога high-card → стата скрыта → defaults.
EXPLAIN (COSTS OFF) SELECT * FROM t_commit_stale_stats WHERE grp = 1;
                       QUERY PLAN                        
---------------------------------------------------------
 Bitmap Heap Scan on t_commit_stale_stats
   Recheck Cond: (grp = 1)
   ->  Bitmap Index Scan on t_commit_stale_stats_grp_idx
         Index Cond: (grp = 1)
(4 rows)

COMMIT;
-- После COMMIT защита сохраняется → план остаётся на defaults.
EXPLAIN (COSTS OFF) SELECT * FROM t_commit_stale_stats WHERE grp = 1;
                       QUERY PLAN                        
---------------------------------------------------------
 Bitmap Heap Scan on t_commit_stale_stats
   Recheck Cond: (grp = 1)
   ->  Bitmap Index Scan on t_commit_stale_stats_grp_idx
         Index Cond: (grp = 1)
(4 rows)

SELECT count(*) = 10000 AS commit_stale_actual_grp1
  FROM t_commit_stale_stats WHERE grp = 1;
 commit_stale_actual_grp1 
--------------------------
 t
(1 row)

DROP TABLE t_commit_stale_stats;
DROP TABLE t_refresh;
-- 11h. Cardinality-aware граница: для high-cardinality (unique) колонки порог
--      толерантности ужесточён (concentrated DML может раздуть «редкое»
--      значение в катастрофический Index Scan).  Мелкий churn ниже строгого
--      порога держит стату видимой (Index Scan), churn выше — прячет её.
CREATE TEMP TABLE t_skew_below (id int, grp int);
INSERT INTO t_skew_below SELECT g, g FROM generate_series(1, 100000) g;
CREATE INDEX ON t_skew_below (grp);
BEGIN;
SELECT fasttrun_analyze('t_skew_below');
 fasttrun_analyze 
------------------
 
(1 row)

DELETE FROM t_skew_below WHERE id <= 3000;    -- 3% ниже строгого high-card порога → видна
EXPLAIN (COSTS OFF) SELECT * FROM t_skew_below WHERE grp = 50000;
                      QUERY PLAN                       
-------------------------------------------------------
 Index Scan using t_skew_below_grp_idx on t_skew_below
   Index Cond: (grp = 50000)
(2 rows)

COMMIT;
DROP TABLE t_skew_below;
CREATE TEMP TABLE t_skew_above (id int, grp int);
INSERT INTO t_skew_above SELECT g, g FROM generate_series(1, 100000) g;
CREATE INDEX ON t_skew_above (grp);
BEGIN;
SELECT fasttrun_analyze('t_skew_above');
 fasttrun_analyze 
------------------
 
(1 row)

DELETE FROM t_skew_above WHERE id <= 10000;   -- 10% выше строгого high-card порога → прячется
EXPLAIN (COSTS OFF) SELECT * FROM t_skew_above WHERE grp = 50000;
                   QUERY PLAN                    
-------------------------------------------------
 Bitmap Heap Scan on t_skew_above
   Recheck Cond: (grp = 50000)
   ->  Bitmap Index Scan on t_skew_above_grp_idx
         Index Cond: (grp = 50000)
(4 rows)

COMMIT;
DROP TABLE t_skew_above;
-- ----------------------------------------------------------------------
-- 12. Порог = 0 не должен запускать пересбор, если доля изменений
--     равна нулю.  Семантика порога: "0 = пересбор при любом DML",
--     а не "при каждом тёплом попадании в кэш".
-- ----------------------------------------------------------------------
CREATE TEMP TABLE t_thr0 (id int, v int);
INSERT INTO t_thr0 SELECT g, g FROM generate_series(1, 10000) g;
CREATE INDEX ON t_thr0 (id);
BEGIN;
SELECT fasttrun_collect_stats('t_thr0');
 fasttrun_collect_stats 
------------------------
 
(1 row)

SET LOCAL fasttrun.stats_refresh_threshold = 0;
EXPLAIN (COSTS OFF) SELECT * FROM t_thr0 WHERE id = 5000;
                QUERY PLAN                
------------------------------------------
 Index Scan using t_thr0_id_idx on t_thr0
   Index Cond: (id = 5000)
(2 rows)

-- Никакого DML → доля изменений = 0 → пересбор не должен сработать,
-- план идентичен
SELECT fasttrun_analyze('t_thr0');
 fasttrun_analyze 
------------------
 
(1 row)

EXPLAIN (COSTS OFF) SELECT * FROM t_thr0 WHERE id = 5000;
                QUERY PLAN                
------------------------------------------
 Index Scan using t_thr0_id_idx on t_thr0
   Index Cond: (id = 5000)
(2 rows)

COMMIT;
DROP TABLE t_thr0;
-- ----------------------------------------------------------------------
-- 13. Кэш статистики, понимающий точки сохранения: ROLLBACK TO
--     SAVEPOINT должен полностью восстановить статистику родительского
--     уровня, а не просто вытеснить её.
-- ----------------------------------------------------------------------
CREATE TEMP TABLE t_sv (id int, grp int);
INSERT INTO t_sv SELECT g, g FROM generate_series(1, 50000) g;
CREATE INDEX ON t_sv (grp);
BEGIN;
-- Порог по умолчанию = 0.2 → массовый UPDATE в подтранзакции
-- пересчитает статистику, что и нужно для проверки отката с
-- восстановлением.
SELECT fasttrun_analyze('t_sv');
 fasttrun_analyze 
------------------
 
(1 row)

-- На уровне родительской транзакции: высокий n_distinct → Index Scan
EXPLAIN (COSTS OFF) SELECT * FROM t_sv WHERE grp = 1;
              QUERY PLAN               
---------------------------------------
 Index Scan using t_sv_grp_idx on t_sv
   Index Cond: (grp = 1)
(2 rows)

SAVEPOINT sp1;
UPDATE t_sv SET grp = 1;
SELECT fasttrun_analyze('t_sv');
 fasttrun_analyze 
------------------
 
(1 row)

-- Внутри подтранзакции: пересбор сработал, n_distinct=1 → Seq Scan
EXPLAIN (COSTS OFF) SELECT * FROM t_sv WHERE grp = 1;
     QUERY PLAN      
---------------------
 Seq Scan on t_sv
   Filter: (grp = 1)
(2 rows)

ROLLBACK TO SAVEPOINT sp1;
-- После отката: статистика восстановлена из стека отмены →
-- снова Index Scan
EXPLAIN (COSTS OFF) SELECT * FROM t_sv WHERE grp = 1;
              QUERY PLAN               
---------------------------------------
 Index Scan using t_sv_grp_idx on t_sv
   Index Cond: (grp = 1)
(2 rows)

COMMIT;
DROP TABLE t_sv;
-- ----------------------------------------------------------------------
-- 14. track_counts=off → нельзя проверить актуальность статистики →
--     не кэшируем, планировщик работает на оценках по умолчанию.
--     Главное: после DML никакая устаревшая статистика не выдаётся.
-- ----------------------------------------------------------------------
CREATE TEMP TABLE t_tc (id int, grp int);
INSERT INTO t_tc SELECT g, g FROM generate_series(1, 10000) g;
CREATE INDEX ON t_tc (grp);
BEGIN;
SET LOCAL track_counts = off;
-- Первый вызов collect поднимет предупреждение WARNING (один раз
-- за сессию) — оно ожидается в diff'e pg_regress как маркер.
SELECT fasttrun_collect_stats('t_tc');
WARNING:  fasttrun: pgstat tracking is unavailable, column statistics will not be cached for this session
DETAIL:  fasttrun_analyze and fasttrun_collect_stats rely on per-backend pgstat counters to validate cached column statistics after DML. With pgstat unavailable (usually because track_counts = off), the planner hook cannot return cached stats and will fall back to default selectivity. Plans for temp tables may silently degrade.
HINT:  Set track_counts = on in postgresql.conf or per session (SET track_counts = on) to re-enable fasttrun column statistics caching.
 fasttrun_collect_stats 
------------------------
 
(1 row)

-- При track_counts=off: возврат к оценкам по умолчанию, не кэшируем
EXPLAIN (COSTS OFF) SELECT * FROM t_tc WHERE grp = 1;
               QUERY PLAN                
-----------------------------------------
 Bitmap Heap Scan on t_tc
   Recheck Cond: (grp = 1)
   ->  Bitmap Index Scan on t_tc_grp_idx
         Index Cond: (grp = 1)
(4 rows)

UPDATE t_tc SET grp = 1;
-- Повторные вызовы collect в этой же сессии — молча, без
-- предупреждения (оно уже было)
SELECT fasttrun_collect_stats('t_tc');
 fasttrun_collect_stats 
------------------------
 
(1 row)

SELECT fasttrun_analyze('t_tc');
 fasttrun_analyze 
------------------
 
(1 row)

-- После UPDATE: всё ещё оценки по умолчанию, никакой устаревшей
-- статистики
EXPLAIN (COSTS OFF) SELECT * FROM t_tc WHERE grp = 1;
               QUERY PLAN                
-----------------------------------------
 Bitmap Heap Scan on t_tc
   Recheck Cond: (grp = 1)
   ->  Bitmap Index Scan on t_tc_grp_idx
         Index Cond: (grp = 1)
(4 rows)

COMMIT;
DROP TABLE t_tc;
-- 14b. DML при временно выключенном track_counts не должен делать старую
--      column stats свежей, если до COMMIT track_counts снова включили.
--      При выключенном pgstat мы не видим counters, поэтому обязаны
--      вытеснить старый stats cache, а не ждать совпадения нулевых counters.
CREATE TEMP TABLE t_tc_toggle (id int, grp int);
INSERT INTO t_tc_toggle SELECT g, g FROM generate_series(1, 100000) g;
CREATE INDEX ON t_tc_toggle (grp);
BEGIN;
SELECT fasttrun_analyze('t_tc_toggle');
 fasttrun_analyze 
------------------
 
(1 row)

EXPLAIN (COSTS OFF) SELECT * FROM t_tc_toggle WHERE grp = 1;
                     QUERY PLAN                      
-----------------------------------------------------
 Index Scan using t_tc_toggle_grp_idx on t_tc_toggle
   Index Cond: (grp = 1)
(2 rows)

SET LOCAL track_counts = off;
UPDATE t_tc_toggle SET grp = 1 WHERE id <= 10000;
SELECT fasttrun_analyze('t_tc_toggle');
 fasttrun_analyze 
------------------
 
(1 row)

SET LOCAL track_counts = on;
COMMIT;
-- После COMMIT planner должен остаться на fallback, а не воскресить
-- старый n_distinct=100000 как свежую статистику.
EXPLAIN (COSTS OFF) SELECT * FROM t_tc_toggle WHERE grp = 1;
                   QUERY PLAN                   
------------------------------------------------
 Bitmap Heap Scan on t_tc_toggle
   Recheck Cond: (grp = 1)
   ->  Bitmap Index Scan on t_tc_toggle_grp_idx
         Index Cond: (grp = 1)
(4 rows)

SELECT count(*) = 10000 AS tc_toggle_actual_grp1
  FROM t_tc_toggle WHERE grp = 1;
 tc_toggle_actual_grp1 
-----------------------
 t
(1 row)

DROP TABLE t_tc_toggle;
-- ----------------------------------------------------------------------
-- 15. Регрессионный тест: пересбор статистики после delta-hit должен
--     оставаться несмещённым и ANALYZE-подобным.
--
--     Раньше refresh path читал только часть heap-блоков.  Даже после
--     исправления early-stop bias это всё равно не было полной parity
--     с ANALYZE для физически упорядоченных или разреженных таблиц.
--
--     Конкретный пример (его и воспроизводим): первые ~3000 строк
--     имеют grp=1, остальные ~50000 строк имеют уникальные grp.
--     После cold scan'а статистика честная, n_distinct высокий.
--     Затем INSERT 20000 строк запускает полный reservoir refresh.
--     Проверяем сам stadistinct, а не точный план: на разных cost model
--     редкий equality может быть как Index Scan, так и Bitmap Heap Scan
--     при одинаково хорошей оценке rows.
-- ----------------------------------------------------------------------
CREATE TEMP TABLE t_bias (id int, grp int);
-- Первые 3000 строк физически лежат в начале файла и все с grp=1
INSERT INTO t_bias SELECT g, 1 FROM generate_series(1, 3000) g;
-- Следующие 50000 строк имеют уникальные значения grp = id
INSERT INTO t_bias SELECT g, g FROM generate_series(3001, 53000) g;
CREATE INDEX ON t_bias (grp);
BEGIN;
SELECT fasttrun_analyze('t_bias');
 fasttrun_analyze 
------------------
 
(1 row)

-- После cold scan'а: n_distinct высокий для редкого grp
SELECT stadistinct < -0.1 AS cold_ndistinct_high
  FROM fasttrun_inspect_stats('t_bias')
 WHERE staattnum = 2;
 cold_ndistinct_high 
---------------------
 t
(1 row)

-- INSERT 20000 строк → доля изменений 20k/73k ≈ 27% > 20% порога →
-- запускается полный reservoir refresh статистики
INSERT INTO t_bias SELECT g, g FROM generate_series(53001, 73000) g;
SELECT fasttrun_analyze('t_bias');
 fasttrun_analyze 
------------------
 
(1 row)

-- После пересбора: n_distinct ВСЁ ЕЩЁ должен быть высоким.
SELECT stadistinct < -0.1 AS refresh_ndistinct_high
  FROM fasttrun_inspect_stats('t_bias')
 WHERE staattnum = 2;
 refresh_ndistinct_high 
------------------------
 t
(1 row)

COMMIT;
DROP TABLE t_bias;
-- ----------------------------------------------------------------------
-- 16. Регрессионный тест: пересбор после массового DELETE до пустой
--     таблицы должен продвигать опорный снимок статистики.
--
--     Раньше путь пересбора в delta-hit ветке вызывал
--     fasttrun_collect_and_store только при sample_count > 0.  После
--     mass DELETE до пустоты sample ничего не находил, baseline не
--     двигался, и каждый последующий fasttrun_analyze заново входил
--     в путь пересбора и заново платил за полный refresh, который
--     снова возвращал ноль строк.
--
--     Тут проверяем строго по структуре, а не по таймингам (тайминги
--     нестабильны на CI): каждый шаг должен соответствовать своей
--     ожидаемой чёткой ветке.  План для grp=1 после mass DELETE
--     ожидаем как Seq Scan на пустой таблице (через дефолты — потому
--     что hook freshness check отвергает старую stats: pgstat
--     счётчики уже не совпадают со снимком от cold scan'а).  Главное:
--     второй и третий fasttrun_analyze не должны падать и должны
--     отдавать тот же self-consistent reltuples=0.
-- ----------------------------------------------------------------------
CREATE TEMP TABLE t_empty_refresh (id int, grp int);
INSERT INTO t_empty_refresh SELECT g, g % 100 FROM generate_series(1, 50000) g;
CREATE INDEX ON t_empty_refresh (grp);
BEGIN;
SELECT fasttrun_analyze('t_empty_refresh');
 fasttrun_analyze 
------------------
 
(1 row)

SELECT reltuples = 50000 AS cold_count
  FROM fasttrun_relstats('t_empty_refresh');
 cold_count 
------------
 t
(1 row)

DELETE FROM t_empty_refresh;            -- table becomes empty
SELECT fasttrun_analyze('t_empty_refresh');
 fasttrun_analyze 
------------------
 
(1 row)

SELECT reltuples = 0 AS empty_after_first
  FROM fasttrun_relstats('t_empty_refresh');
 empty_after_first 
-------------------
 t
(1 row)

SELECT count(*) = 0 AS empty_refresh_stats_evicted
  FROM fasttrun_inspect_stats('t_empty_refresh');
 empty_refresh_stats_evicted 
-----------------------------
 t
(1 row)

-- Второй analyze без DML.  С багом он бы снова входил в refresh path
-- (потому что baseline не продвинулся при первом empty refresh) и
-- снова делал бы полный refresh.  С фиксом — pure delta path, мгновенно.
SELECT fasttrun_analyze('t_empty_refresh');
 fasttrun_analyze 
------------------
 
(1 row)

SELECT reltuples = 0 AS empty_after_second
  FROM fasttrun_relstats('t_empty_refresh');
 empty_after_second 
--------------------
 t
(1 row)

-- Третий — то же самое, для уверенности что baseline стабилен.
SELECT fasttrun_analyze('t_empty_refresh');
 fasttrun_analyze 
------------------
 
(1 row)

SELECT reltuples = 0 AS empty_after_third
  FROM fasttrun_relstats('t_empty_refresh');
 empty_after_third 
-------------------
 t
(1 row)

COMMIT;
DROP TABLE t_empty_refresh;
-- ----------------------------------------------------------------------
-- 17. Регрессионный тест: ROLLBACK TO SAVEPOINT должен откатывать
--     не только сам кэш статистики колонок, но и опорный снимок
--     для пути пересбора (stats baseline) в analyze cache.
--
--     Раньше пересбор внутри подтранзакции продвигал stats baseline
--     до post-DML pgstat счётчиков, а subxact callback его не
--     откатывал.  После ROLLBACK TO SAVEPOINT pgstat счётчики
--     возвращались к pre-DML, а baseline в analyze cache оставался
--     "из будущего", и следующий fasttrun_analyze считал ненулевой
--     churn → лишний refresh-проход.
--
--     Тест в той же форме, что и секция 13, плюс explicit проверка
--     что пост-rollback план идентичен pre-savepoint плану — это
--     косвенно подтверждает что stats baseline тоже откатился (если
--     бы остался "в будущем", refresh бы запустился и план сменился).
-- ----------------------------------------------------------------------
CREATE TEMP TABLE t_sv_baseline (id int, grp int);
INSERT INTO t_sv_baseline SELECT g, g FROM generate_series(1, 50000) g;
CREATE INDEX ON t_sv_baseline (grp);
BEGIN;
SELECT fasttrun_analyze('t_sv_baseline');
 fasttrun_analyze 
------------------
 
(1 row)

EXPLAIN (COSTS OFF) SELECT * FROM t_sv_baseline WHERE grp = 1;
                       QUERY PLAN                        
---------------------------------------------------------
 Index Scan using t_sv_baseline_grp_idx on t_sv_baseline
   Index Cond: (grp = 1)
(2 rows)

SAVEPOINT sp_b;
UPDATE t_sv_baseline SET grp = 1;
SELECT fasttrun_analyze('t_sv_baseline');  -- refresh inside subxact
 fasttrun_analyze 
------------------
 
(1 row)

EXPLAIN (COSTS OFF) SELECT * FROM t_sv_baseline WHERE grp = 1;
        QUERY PLAN         
---------------------------
 Seq Scan on t_sv_baseline
   Filter: (grp = 1)
(2 rows)

ROLLBACK TO SAVEPOINT sp_b;
-- После rollback должна полностью восстановиться pre-savepoint
-- картина: stats cache + baseline в analyze cache.
EXPLAIN (COSTS OFF) SELECT * FROM t_sv_baseline WHERE grp = 1;
                       QUERY PLAN                        
---------------------------------------------------------
 Index Scan using t_sv_baseline_grp_idx on t_sv_baseline
   Index Cond: (grp = 1)
(2 rows)

-- Следующий analyze не должен снова входить в refresh path
-- (с багом он бы пересчитал и оставил план Seq Scan, потому что
-- baseline в analyze cache остался "из будущего" и churn != 0).
SELECT fasttrun_analyze('t_sv_baseline');
 fasttrun_analyze 
------------------
 
(1 row)

EXPLAIN (COSTS OFF) SELECT * FROM t_sv_baseline WHERE grp = 1;
                       QUERY PLAN                        
---------------------------------------------------------
 Index Scan using t_sv_baseline_grp_idx on t_sv_baseline
   Index Cond: (grp = 1)
(2 rows)

COMMIT;
DROP TABLE t_sv_baseline;
-- ----------------------------------------------------------------------
-- 18. Регрессионный тест: explicit fasttrun_collect_stats() должен
--     продвигать опорный снимок stats baseline в analyze cache,
--     если запись там уже есть — иначе следующий маленький DML
--     запустит ненужный пересбор по застаревшему churn.
-- ----------------------------------------------------------------------
CREATE TEMP TABLE t_cs_baseline (id int, grp int);
INSERT INTO t_cs_baseline SELECT g, g FROM generate_series(1, 50000) g;
CREATE INDEX ON t_cs_baseline (grp);
BEGIN;
SELECT fasttrun_analyze('t_cs_baseline');             -- cold scan
 fasttrun_analyze 
------------------
 
(1 row)

UPDATE t_cs_baseline SET grp = grp + 1;               -- big churn
SELECT fasttrun_collect_stats('t_cs_baseline');       -- explicit recollect
 fasttrun_collect_stats 
------------------------
 
(1 row)

DELETE FROM t_cs_baseline WHERE id = 1;               -- one-row tweak
-- Главное: первый analyze после collect_stats + крошечного DML
-- должен идти чистой delta-математикой, а не входить в refresh path.
-- Структурно проверяем через свежий план запроса (он должен совпадать
-- с тем, что был после refresh от UPDATE'a) и через row count.
SELECT fasttrun_analyze('t_cs_baseline');
 fasttrun_analyze 
------------------
 
(1 row)

SELECT reltuples = 49999 AS post_collect_count
  FROM fasttrun_relstats('t_cs_baseline');
 post_collect_count 
--------------------
 t
(1 row)

-- Повторный analyze без DML должен оставаться hot path
SELECT fasttrun_analyze('t_cs_baseline');
 fasttrun_analyze 
------------------
 
(1 row)

SELECT reltuples = 49999 AS post_collect_count_2
  FROM fasttrun_relstats('t_cs_baseline');
 post_collect_count_2 
----------------------
 t
(1 row)

COMMIT;
DROP TABLE t_cs_baseline;
-- ----------------------------------------------------------------------
-- 19. Регрессионный тест: fasttruncate seed-ит analyze cache, чтобы
--     первый fasttrun_analyze() после паттерна
--         fasttruncate -> refill -> fasttrun_analyze
--     шёл по дельта-математике (а не платил за полный cold scan), и
--     при этом ещё и обновлял статистику колонок через полный reservoir
--     refresh.
--
--     Структурные проверки:
--       - после fasttruncate + INSERT + analyze reltuples должно быть
--         равно числу вставленных строк (это обеспечивается delta math
--         от seed-нутого опорного снимка);
--       - план для редкого значения после refill должен быть Index Scan
--         (это значит refresh path сработал и собрал свежую статистику
--         колонок — иначе planner получил бы defaults и выбрал
--         Bitmap/Seq Scan);
--       - повторный analyze без DML — pure delta hot path, тот же
--         reltuples без изменений.
-- ----------------------------------------------------------------------
CREATE TEMP TABLE t_seed_truncate (id int, grp int);
INSERT INTO t_seed_truncate SELECT g, g FROM generate_series(1, 50000) g;
CREATE INDEX ON t_seed_truncate (grp);
BEGIN;
SELECT fasttrun_analyze('t_seed_truncate');           -- cold scan, stats есть
 fasttrun_analyze 
------------------
 
(1 row)

EXPLAIN (COSTS OFF) SELECT * FROM t_seed_truncate WHERE grp = 12345;
                         QUERY PLAN                          
-------------------------------------------------------------
 Index Scan using t_seed_truncate_grp_idx on t_seed_truncate
   Index Cond: (grp = 12345)
(2 rows)

-- Полный цикл: очистка, перезаливка, analyze.  С seed первый analyze
-- здесь идёт через delta-hit для rowcount + полный reservoir refresh
-- для статистики колонок.
SELECT fasttruncate('t_seed_truncate');
 fasttruncate 
--------------
 
(1 row)

INSERT INTO t_seed_truncate SELECT g, g FROM generate_series(1, 50000) g;
SELECT fasttrun_analyze('t_seed_truncate');
 fasttrun_analyze 
------------------
 
(1 row)

SELECT reltuples = 50000 AS reltuples_after_refill
  FROM fasttrun_relstats('t_seed_truncate');
 reltuples_after_refill 
------------------------
 t
(1 row)

-- План должен использовать индекс — refresh собрал свежие stats.
EXPLAIN (COSTS OFF) SELECT * FROM t_seed_truncate WHERE grp = 12345;
                         QUERY PLAN                          
-------------------------------------------------------------
 Index Scan using t_seed_truncate_grp_idx on t_seed_truncate
   Index Cond: (grp = 12345)
(2 rows)

-- Второй analyze без DML — pure delta hot path
SELECT fasttrun_analyze('t_seed_truncate');
 fasttrun_analyze 
------------------
 
(1 row)

SELECT reltuples = 50000 AS reltuples_second
  FROM fasttrun_relstats('t_seed_truncate');
 reltuples_second 
------------------
 t
(1 row)

-- Двойной truncate в той же транзакции тоже должен работать
SELECT fasttruncate('t_seed_truncate');
 fasttruncate 
--------------
 
(1 row)

SELECT fasttruncate('t_seed_truncate');
 fasttruncate 
--------------
 
(1 row)

INSERT INTO t_seed_truncate SELECT g, g FROM generate_series(1, 100) g;
SELECT fasttrun_analyze('t_seed_truncate');
 fasttrun_analyze 
------------------
 
(1 row)

SELECT reltuples = 100 AS reltuples_after_double_truncate
  FROM fasttrun_relstats('t_seed_truncate');
 reltuples_after_double_truncate 
---------------------------------
 t
(1 row)

COMMIT;
DROP TABLE t_seed_truncate;
-- ----------------------------------------------------------------------
-- 20. Регрессионный тест: DDL на той же temp table должен вытеснять
--     stats cache.  pgstat DML counters при ALTER TABLE не меняются, а
--     обычный PostgreSQL удаляет pg_statistic для затронутых колонок.
--     fasttrun не должен отдавать старый pg_statistic-shaped tuple после
--     смены типа / tuple descriptor.
-- ----------------------------------------------------------------------
CREATE TEMP TABLE t_stats_ddl (id int, v int);
INSERT INTO t_stats_ddl SELECT g, g FROM generate_series(1, 10000) g;
BEGIN;
SELECT fasttrun_analyze('t_stats_ddl');
 fasttrun_analyze 
------------------
 
(1 row)

SELECT count(*) = 2 AS ddl_stats_before
  FROM fasttrun_inspect_stats('t_stats_ddl');
 ddl_stats_before 
------------------
 t
(1 row)

ALTER TABLE t_stats_ddl ALTER COLUMN v TYPE text USING v::text;
SELECT count(*) = 0 AS ddl_stats_evicted
  FROM fasttrun_inspect_stats('t_stats_ddl');
 ddl_stats_evicted 
-------------------
 t
(1 row)

COMMIT;
BEGIN;
SELECT fasttrun_analyze('t_stats_ddl');
 fasttrun_analyze 
------------------
 
(1 row)

SELECT count(*) = 2 AS ddl_rollback_stats_before
  FROM fasttrun_inspect_stats('t_stats_ddl');
 ddl_rollback_stats_before 
---------------------------
 t
(1 row)

SAVEPOINT sp_ddl_rollback;
ALTER TABLE t_stats_ddl ADD COLUMN payload text;
SELECT count(*) = 0 AS ddl_rollback_stats_evicted_inside
  FROM fasttrun_inspect_stats('t_stats_ddl');
 ddl_rollback_stats_evicted_inside 
-----------------------------------
 t
(1 row)

ROLLBACK TO SAVEPOINT sp_ddl_rollback;
SELECT count(*) = 2 AS ddl_rollback_stats_restored
  FROM fasttrun_inspect_stats('t_stats_ddl');
 ddl_rollback_stats_restored 
-----------------------------
 t
(1 row)

COMMIT;
DROP TABLE t_stats_ddl;
-- ----------------------------------------------------------------------
-- 20a. CLUSTER на temp table физически переупорядочивает строки (rewrite):
--      correlation в кэше становится ложной при неизменных DML-счётчиках,
--      freshness это не ловит.  Эвикция срабатывает до выполнения; откат
--      в savepoint восстанавливает стату (undo), как у остальных DDL.
-- ----------------------------------------------------------------------
CREATE TEMP TABLE t_stats_cluster (id int, v int);
INSERT INTO t_stats_cluster SELECT g, (g * 17) % 10000 FROM generate_series(1, 10000) g;
CREATE INDEX t_stats_cluster_v_idx ON t_stats_cluster (v);
BEGIN;
SELECT fasttrun_analyze('t_stats_cluster');
 fasttrun_analyze 
------------------
 
(1 row)

SELECT count(*) = 2 AS cluster_stats_before
  FROM fasttrun_inspect_stats('t_stats_cluster');
 cluster_stats_before 
----------------------
 t
(1 row)

CLUSTER t_stats_cluster USING t_stats_cluster_v_idx;
SELECT count(*) = 0 AS cluster_stats_evicted
  FROM fasttrun_inspect_stats('t_stats_cluster');
 cluster_stats_evicted 
-----------------------
 t
(1 row)

COMMIT;
BEGIN;
SELECT fasttrun_analyze('t_stats_cluster');
 fasttrun_analyze 
------------------
 
(1 row)

SELECT count(*) = 2 AS cluster_rollback_stats_before
  FROM fasttrun_inspect_stats('t_stats_cluster');
 cluster_rollback_stats_before 
-------------------------------
 t
(1 row)

SAVEPOINT sp_cluster_rollback;
CLUSTER t_stats_cluster USING t_stats_cluster_v_idx;
SELECT count(*) = 0 AS cluster_rollback_stats_evicted_inside
  FROM fasttrun_inspect_stats('t_stats_cluster');
 cluster_rollback_stats_evicted_inside 
---------------------------------------
 t
(1 row)

ROLLBACK TO SAVEPOINT sp_cluster_rollback;
SELECT count(*) = 2 AS cluster_rollback_stats_restored
  FROM fasttrun_inspect_stats('t_stats_cluster');
 cluster_rollback_stats_restored 
---------------------------------
 t
(1 row)

COMMIT;
DROP TABLE t_stats_cluster;
-- ----------------------------------------------------------------------
-- 21. Регрессионный тест: relstats partial index должны обновляться
--     вместе с fasttrun_analyze.  Обычный ANALYZE обновляет pg_class для
--     index relation; fasttrun должен публиковать тот же planner-visible
--     размер хотя бы в rd_rel и session-local relstats cache.
-- ----------------------------------------------------------------------
CREATE TEMP TABLE t_partial_stats (id int, flag bool);
INSERT INTO t_partial_stats
SELECT g, g <= 100 FROM generate_series(1, 100000) g;
CREATE INDEX t_partial_stats_true_idx ON t_partial_stats (id) WHERE flag;
BEGIN;
SET LOCAL fasttrun.sample_rows = 100000;  -- детерминируем тест plumbing partial-index relstats
SELECT fasttrun_analyze('t_partial_stats');
 fasttrun_analyze 
------------------
 
(1 row)

SELECT reltuples BETWEEN 50 AND 200 AS partial_small_initial
  FROM fasttrun_relstats('t_partial_stats_true_idx');
 partial_small_initial 
-----------------------
 t
(1 row)

UPDATE t_partial_stats SET flag = true WHERE id <= 50000;
SELECT fasttrun_analyze('t_partial_stats');
 fasttrun_analyze 
------------------
 
(1 row)

SELECT reltuples BETWEEN 45000 AND 55000 AS partial_large_after_analyze
  FROM fasttrun_relstats('t_partial_stats_true_idx');
 partial_large_after_analyze 
-----------------------------
 t
(1 row)

COMMIT;
BEGIN;
SET LOCAL fasttrun.sample_rows = 100000;  -- пересчитываем partial-index relstats ниже порога
SELECT fasttrun_analyze('t_partial_stats');
 fasttrun_analyze 
------------------
 
(1 row)

UPDATE t_partial_stats SET flag = true WHERE id > 50000 AND id <= 51000;
SELECT fasttrun_analyze('t_partial_stats');
 fasttrun_analyze 
------------------
 
(1 row)

SELECT reltuples BETWEEN 50500 AND 51500 AS partial_delta_after_below_threshold
  FROM fasttrun_relstats('t_partial_stats_true_idx');
 partial_delta_after_below_threshold 
-------------------------------------
 t
(1 row)

COMMIT;
DROP TABLE t_partial_stats;
-- ----------------------------------------------------------------------
-- 21b. Горячий delta path должен обновлять relstats обычных индексов
--      независимо от пересбора column stats.  Обычный ANALYZE обновляет
--      pg_class и для heap, и для index relation.
-- ----------------------------------------------------------------------
CREATE TEMP TABLE t_index_delta (id int);
CREATE INDEX t_index_delta_idx ON t_index_delta (id);
INSERT INTO t_index_delta SELECT generate_series(1, 10000);
BEGIN;
SET LOCAL fasttrun.sample_rows = 100000;
SELECT fasttrun_analyze('t_index_delta');
 fasttrun_analyze 
------------------
 
(1 row)

SELECT reltuples = 10000 AS index_delta_initial
  FROM fasttrun_relstats('t_index_delta_idx');
 index_delta_initial 
---------------------
 t
(1 row)

INSERT INTO t_index_delta SELECT generate_series(10001, 11000);
SELECT fasttrun_analyze('t_index_delta');
 fasttrun_analyze 
------------------
 
(1 row)

SELECT reltuples = 11000 AS index_delta_after_insert
  FROM fasttrun_relstats('t_index_delta_idx');
 index_delta_after_insert 
--------------------------
 t
(1 row)

DELETE FROM t_index_delta WHERE id > 10500;
SELECT fasttrun_analyze('t_index_delta');
 fasttrun_analyze 
------------------
 
(1 row)

SELECT reltuples = 10500 AS index_delta_after_delete
  FROM fasttrun_relstats('t_index_delta_idx');
 index_delta_after_delete 
--------------------------
 t
(1 row)

COMMIT;
DROP TABLE t_index_delta;
-- ----------------------------------------------------------------------
-- 21c. Отключение column stats не должно отключать relation-level
--      relstats для обычных индексов: они нужны planner'у отдельно от
--      pg_statistic-shaped tuples.
-- ----------------------------------------------------------------------
CREATE TEMP TABLE t_index_no_colstats (id int);
CREATE INDEX t_index_no_colstats_idx ON t_index_no_colstats (id);
INSERT INTO t_index_no_colstats SELECT generate_series(1, 10000);
BEGIN;
SET LOCAL fasttrun.sample_rows = 0;
SELECT fasttrun_analyze('t_index_no_colstats');
 fasttrun_analyze 
------------------
 
(1 row)

SELECT reltuples = 10000 AS index_no_colstats_updated
  FROM fasttrun_relstats('t_index_no_colstats_idx');
 index_no_colstats_updated 
---------------------------
 t
(1 row)

COMMIT;
DROP TABLE t_index_no_colstats;
-- ----------------------------------------------------------------------
-- 22. Регрессионный тест: ширина столбца (stawidth) собранная нашим
--     reservoir sample должна доходить до планировщика через
--     get_attavgwidth_hook.
--
--     В планировщике есть ДВА независимых пути доступа к статистике
--     колонок:
--       (а) get_relation_stats_hook → возвращает HeapTuple от
--           pg_statistic для функций селективности (eq_sel и т.п.);
--       (б) lsyscache.c:get_attavgwidth → читает stawidth напрямую
--           через get_attavgwidth_hook или syscache.
--
--     Раньше у нас был зарегистрирован только (а), и (б) уходил в
--     get_typavgwidth() с дефолтной шириной типа.  Для text это
--     32 байта независимо от реального содержимого, что ломало
--     costing для hash join / sort / spool на временных таблицах
--     с короткими text-колонками.
--
--     Тут проверяем что после fasttrun_analyze() планировщик видит
--     нашу собранную ширину, а не дефолтную для типа.  Для строки
--     ровно 19 байт ожидаем width <= 25 (Haas-Stokes даёт ~19, а
--     get_typavgwidth() для text даёт 32 — далеко за порогом).
-- ----------------------------------------------------------------------
CREATE TEMP TABLE t_width (id int, name text);
INSERT INTO t_width SELECT g, 'name_padded_to_20_x' FROM generate_series(1, 10000) g;
-- 'name_padded_to_20_x' это 19 ASCII символов, в varlena ~ 20 байт.
BEGIN;
SELECT fasttrun_analyze('t_width');
 fasttrun_analyze 
------------------
 
(1 row)

-- Прямой запрос к плану через EXPLAIN.  Используем функцию-обёртку,
-- которая вытаскивает width из текстового плана, чтобы тест был
-- стабильным и читаемым.
DO $$
DECLARE
    plan_line text;
    width_val int;
BEGIN
    FOR plan_line IN EXPLAIN SELECT name FROM t_width LOOP
        IF plan_line ~ 'width=' THEN
            width_val := substring(plan_line FROM 'width=(\d+)')::int;
            EXIT;
        END IF;
    END LOOP;

    IF width_val IS NULL THEN
        RAISE EXCEPTION 'could not parse width from EXPLAIN output';
    END IF;

    -- Реальная ширина ~20 байт (varlena overhead + 19 ASCII).
    -- Без get_attavgwidth_hook планировщик отдал бы 32.
    IF width_val > 25 THEN
        RAISE EXCEPTION 'width % too high — get_attavgwidth_hook не сработал (ожидали ~20, лимит 25)',
                        width_val;
    END IF;
    IF width_val < 15 THEN
        RAISE EXCEPTION 'width % подозрительно мал — Haas-Stokes/sample broken?',
                        width_val;
    END IF;

    RAISE NOTICE 'fasttrun width for text(20): % bytes (matches sampled value)', width_val;
END;
$$;
NOTICE:  fasttrun width for text(20): 20 bytes (matches sampled value)
COMMIT;
DROP TABLE t_width;
-- ----------------------------------------------------------------------
-- 23. Регрессионный тест: skew equality предикат через std_typanalyze.
--
--     99000 строк со значением v=1 и 1000 строк с уникальными редкими
--     значениями v in 2..1001.  С нашим путём через std_typanalyze
--     (use_typanalyze=on, default) MCV должна поймать частое значение
--     v=1, и план для WHERE v=1 должен быть Seq Scan с rows близким
--     к реальным 99000 (а не bitmap heap scan с грубой оценкой по
--     n_distinct ~ 3000).  Для редкого значения v=500 план должен
--     быть Index Scan с маленьким rows.
--
--     Сравниваем с use_typanalyze=off — там должна быть старая
--     грубая оценка по n_distinct (rows одинаков для обоих v).
-- ----------------------------------------------------------------------
CREATE TEMP TABLE t_skew (id int, v int);
INSERT INTO t_skew SELECT g, 1 FROM generate_series(1, 99000) g;
INSERT INTO t_skew SELECT 99000 + g, g + 1 FROM generate_series(1, 1000) g;
CREATE INDEX ON t_skew (v);
BEGIN;
SELECT fasttrun_analyze('t_skew');
 fasttrun_analyze 
------------------
 
(1 row)

DO $$
DECLARE
    plan_line text;
    rows_freq int;
    rows_rare int;
BEGIN
    FOR plan_line IN EXPLAIN SELECT * FROM t_skew WHERE v = 1 LOOP
        IF plan_line ~ 'rows=' THEN
            rows_freq := substring(plan_line FROM 'rows=(\d+)')::int;
            EXIT;
        END IF;
    END LOOP;

    FOR plan_line IN EXPLAIN SELECT * FROM t_skew WHERE v = 500 LOOP
        IF plan_line ~ 'rows=' THEN
            rows_rare := substring(plan_line FROM 'rows=(\d+)')::int;
            EXIT;
        END IF;
    END LOOP;

    -- MCV должна поймать v=1 и дать оценку >50000
    IF rows_freq < 50000 THEN
        RAISE EXCEPTION 'MCV не сработала для skew v=1: rows=% (ожидали >50000)',
                        rows_freq;
    END IF;
    -- Для редкого v=500 оценка должна быть маленькой (<200)
    IF rows_rare > 200 THEN
        RAISE EXCEPTION 'rare value v=500 over-estimated: rows=% (ожидали <200)',
                        rows_rare;
    END IF;

    RAISE NOTICE 'skew typanalyze: ok (frequent>50k, rare<200)';
END;
$$;
NOTICE:  skew typanalyze: ok (frequent>50k, rare<200)
COMMIT;
-- Контр-тест: при use_typanalyze=off оценки должны быть одинаковы
-- для обоих значений (грубая Haas-Stokes оценка по n_distinct).
BEGIN;
SET LOCAL fasttrun.use_typanalyze = off;
SELECT fasttrun_analyze('t_skew');
 fasttrun_analyze 
------------------
 
(1 row)

DO $$
DECLARE
    plan_line text;
    rows_freq int;
    rows_rare int;
BEGIN
    FOR plan_line IN EXPLAIN SELECT * FROM t_skew WHERE v = 1 LOOP
        IF plan_line ~ 'rows=' THEN
            rows_freq := substring(plan_line FROM 'rows=(\d+)')::int;
            EXIT;
        END IF;
    END LOOP;

    FOR plan_line IN EXPLAIN SELECT * FROM t_skew WHERE v = 500 LOOP
        IF plan_line ~ 'rows=' THEN
            rows_rare := substring(plan_line FROM 'rows=(\d+)')::int;
            EXIT;
        END IF;
    END LOOP;

    -- Без MCV оценки одинаковы — обе по 1/n_distinct
    IF rows_freq <> rows_rare THEN
        RAISE EXCEPTION 'Haas-Stokes даёт разные оценки для v=1 (%) и v=500 (%): не должно быть разницы без MCV',
                        rows_freq, rows_rare;
    END IF;

    RAISE NOTICE 'skew Haas-Stokes: ok (frequent and rare give same estimate)';
END;
$$;
NOTICE:  skew Haas-Stokes: ok (frequent and rare give same estimate)
COMMIT;
DROP TABLE t_skew;
-- ----------------------------------------------------------------------
-- 24. Регрессионный тест: range предикат через std_typanalyze.
--
--     100000 строк v in 1..100000.  WHERE v < 1000 — это селективность
--     ровно 1%.  С histogram planner должен дать оценку ~1000;
--     без histogram уйдёт в DEFAULT_RANGE_INEQ_SEL = 0.5 → ~50000.
-- ----------------------------------------------------------------------
CREATE TEMP TABLE t_range (id int, v int);
INSERT INTO t_range SELECT g, g FROM generate_series(1, 100000) g;
CREATE INDEX ON t_range (v);
BEGIN;
SELECT fasttrun_analyze('t_range');
 fasttrun_analyze 
------------------
 
(1 row)

DO $$
DECLARE
    plan_line text;
    rows_est int;
BEGIN
    FOR plan_line IN EXPLAIN SELECT * FROM t_range WHERE v < 1000 LOOP
        IF plan_line ~ 'rows=' THEN
            rows_est := substring(plan_line FROM 'rows=(\d+)')::int;
            EXIT;
        END IF;
    END LOOP;

    -- Histogram должна дать оценку в пределах 500..2000 (real 999)
    IF rows_est < 500 OR rows_est > 2000 THEN
        RAISE EXCEPTION 'histogram неточна для range v<1000: rows=% (ожидали 500..2000)',
                        rows_est;
    END IF;

    RAISE NOTICE 'range typanalyze: ok (within 500..2000 for real 999)';
END;
$$;
NOTICE:  range typanalyze: ok (within 500..2000 for real 999)
COMMIT;
-- Контр-тест: без typanalyze идёт DEFAULT_RANGE_INEQ_SEL
BEGIN;
SET LOCAL fasttrun.use_typanalyze = off;
SELECT fasttrun_analyze('t_range');
 fasttrun_analyze 
------------------
 
(1 row)

DO $$
DECLARE
    plan_line text;
    rows_est int;
BEGIN
    FOR plan_line IN EXPLAIN SELECT * FROM t_range WHERE v < 1000 LOOP
        IF plan_line ~ 'rows=' THEN
            rows_est := substring(plan_line FROM 'rows=(\d+)')::int;
            EXIT;
        END IF;
    END LOOP;

    -- Без histogram — DEFAULT_RANGE_INEQ_SEL × ndistinct, обычно >30000
    IF rows_est < 10000 THEN
        RAISE EXCEPTION 'Haas-Stokes неожиданно точна для range: rows=%, должно быть много',
                        rows_est;
    END IF;

    RAISE NOTICE 'range Haas-Stokes: ok (overestimates due to default 0.5 selectivity)';
END;
$$;
NOTICE:  range Haas-Stokes: ok (overestimates due to default 0.5 selectivity)
COMMIT;
DROP TABLE t_range;
-- ----------------------------------------------------------------------
-- 25. ABBA cross-validation: статистика собранная нашим path должна
--     дать планировщику близкие оценки тому, что дал бы обычный
--     SQL ANALYZE — на широком спектре типов данных и предикатов.
--
--     Это **прямое доказательство** что наш HeapTuple в кэше
--     корректно доходит до планировщика через get_relation_stats_hook
--     и get_attavgwidth_hook, и что std_typanalyze правильно
--     отрабатывает на всех нужных типах: int, text (MCV/eq),
--     varchar (high-cardinality eq), numeric (histogram/range),
--     timestamptz (histogram/range), boolean (eq).
--
--     Не сравниваем точные числа rows между ANALYZE и нашим путём
--     (sample-based, шумные), а проверяем структурно: тип плана и
--     rows в разумных границах от реального количества.
-- ----------------------------------------------------------------------
CREATE TEMP TABLE t_abba (
    id      int,
    grp     int,
    status  text,
    name    varchar(50),
    amount  numeric(10,2),
    created timestamptz,
    flag    boolean
);
INSERT INTO t_abba
SELECT g,
       g % 1000,
       (CASE WHEN g % 100 < 60 THEN 'active'
             WHEN g % 100 < 80 THEN 'pending'
             WHEN g % 100 < 90 THEN 'done'
             WHEN g % 100 < 95 THEN 'archived'
             ELSE 'new' END),
       'name_' || g,
       (g % 10000)::numeric / 100,
       '2026-01-01'::timestamptz + (g || ' minutes')::interval,
       g % 2 = 0
FROM generate_series(1, 50000) g;
CREATE INDEX ON t_abba (grp);
CREATE INDEX ON t_abba (status);
CREATE INDEX ON t_abba (amount);
BEGIN;
SELECT fasttrun_analyze('t_abba');
 fasttrun_analyze 
------------------
 
(1 row)

DO $$
DECLARE
    plan_line text;
    rows_est  int;
BEGIN
    -- int n_distinct: grp = 42 → ~50 строк (real 50)
    FOR plan_line IN EXPLAIN SELECT * FROM t_abba WHERE grp = 42 LOOP
        IF plan_line ~ 'rows=' THEN
            rows_est := substring(plan_line FROM 'rows=(\d+)')::int;
            EXIT;
        END IF;
    END LOOP;
    IF rows_est < 10 OR rows_est > 200 THEN
        RAISE EXCEPTION 'int n_distinct broken: grp=42 rows=% (real ~50)', rows_est;
    END IF;

    -- text MCV: status='active' (60% строк) → ~30000
    FOR plan_line IN EXPLAIN SELECT * FROM t_abba WHERE status = 'active' LOOP
        IF plan_line ~ 'rows=' THEN
            rows_est := substring(plan_line FROM 'rows=(\d+)')::int;
            EXIT;
        END IF;
    END LOOP;
    IF rows_est < 20000 OR rows_est > 40000 THEN
        RAISE EXCEPTION 'text MCV broken: active rows=% (real ~30000)', rows_est;
    END IF;

    -- text MCV: status='archived' (5% строк) → ~2500
    FOR plan_line IN EXPLAIN SELECT * FROM t_abba WHERE status = 'archived' LOOP
        IF plan_line ~ 'rows=' THEN
            rows_est := substring(plan_line FROM 'rows=(\d+)')::int;
            EXIT;
        END IF;
    END LOOP;
    IF rows_est < 500 OR rows_est > 5000 THEN
        RAISE EXCEPTION 'text MCV broken: archived rows=% (real ~2500)', rows_est;
    END IF;

    -- numeric histogram: amount BETWEEN 10 AND 20 → ~5000 (real ~5000)
    FOR plan_line IN EXPLAIN SELECT * FROM t_abba WHERE amount BETWEEN 10 AND 20 LOOP
        IF plan_line ~ 'rows=' THEN
            rows_est := substring(plan_line FROM 'rows=(\d+)')::int;
            EXIT;
        END IF;
    END LOOP;
    IF rows_est < 2000 OR rows_est > 8000 THEN
        RAISE EXCEPTION 'numeric histogram broken: 10..20 rows=% (real ~5000)', rows_est;
    END IF;

    -- timestamptz histogram: created > '2026-01-15' → ~30000 (последние 70%)
    FOR plan_line IN EXPLAIN SELECT * FROM t_abba WHERE created > '2026-01-15'::timestamptz LOOP
        IF plan_line ~ 'rows=' THEN
            rows_est := substring(plan_line FROM 'rows=(\d+)')::int;
            EXIT;
        END IF;
    END LOOP;
    IF rows_est < 20000 OR rows_est > 40000 THEN
        RAISE EXCEPTION 'timestamptz histogram broken: rows=% (real ~30000)', rows_est;
    END IF;

    -- boolean: flag = true (50%) → ~25000
    FOR plan_line IN EXPLAIN SELECT * FROM t_abba WHERE flag = true LOOP
        IF plan_line ~ 'rows=' THEN
            rows_est := substring(plan_line FROM 'rows=(\d+)')::int;
            EXIT;
        END IF;
    END LOOP;
    IF rows_est < 15000 OR rows_est > 35000 THEN
        RAISE EXCEPTION 'boolean equality broken: flag=true rows=% (real ~25000)', rows_est;
    END IF;

    -- varchar high-cardinality unique: name='name_25000' → 1
    FOR plan_line IN EXPLAIN SELECT * FROM t_abba WHERE name = 'name_25000' LOOP
        IF plan_line ~ 'rows=' THEN
            rows_est := substring(plan_line FROM 'rows=(\d+)')::int;
            EXIT;
        END IF;
    END LOOP;
    IF rows_est < 1 OR rows_est > 10 THEN
        RAISE EXCEPTION 'varchar n_distinct broken: name=name_25000 rows=% (real 1)', rows_est;
    END IF;

    RAISE NOTICE 'ABBA cross-validation: stats reach planner for all 7 types (int, text MCV x2, numeric range, timestamptz range, boolean, varchar)';
END;
$$;
NOTICE:  ABBA cross-validation: stats reach planner for all 7 types (int, text MCV x2, numeric range, timestamptz range, boolean, varchar)
COMMIT;
DROP TABLE t_abba;
-- ----------------------------------------------------------------------
-- 26. fasttrun_inspect_stats() — observability функция для production
--     debugging.  Возвращает наши кешированные statsTuple в shape
--     pg_catalog.pg_statistic.
--
--     Проверяем что:
--       (1) функция возвращает по одной строке на каждую analyzed
--           колонку (3 колонки = 3 строки);
--       (2) staattnum совпадает с реальным;
--       (3) MCV-слот заполнен для skewed колонки status;
--       (4) shape совпадает с pg_catalog.pg_statistic (можно делать
--           SELECT по знакомым полям);
--       (5) на несуществующей таблице — empty result, без ошибки.
-- ----------------------------------------------------------------------
CREATE TEMP TABLE t_inspect (id int, status text);
INSERT INTO t_inspect
SELECT g, (CASE WHEN g % 100 < 60 THEN 'active' ELSE 'pending' END)
FROM generate_series(1, 50000) g;
BEGIN;
SELECT fasttrun_analyze('t_inspect');
 fasttrun_analyze 
------------------
 
(1 row)

-- Должна быть одна строка на колонку (id, status) — обе analyzable
SELECT count(*) = 2 AS two_rows FROM fasttrun_inspect_stats('t_inspect');
 two_rows 
----------
 t
(1 row)

-- staattnum правильный, в порядке возрастания
SELECT array_agg(staattnum ORDER BY staattnum) = ARRAY[1::int2, 2::int2]
       AS attnums_correct
FROM fasttrun_inspect_stats('t_inspect');
 attnums_correct 
-----------------
 t
(1 row)

-- Для status (skewed) должен быть MCV slot с двумя значениями.
-- stakind=1 это STATISTIC_KIND_MCV.
SELECT count(*) = 1 AS has_mcv_for_status
FROM fasttrun_inspect_stats('t_inspect')
WHERE staattnum = 2 AND (stakind1 = 1 OR stakind2 = 1 OR stakind3 = 1);
 has_mcv_for_status 
--------------------
 t
(1 row)

-- Empty result для несуществующей таблицы
SELECT count(*) = 0 AS empty_for_missing
FROM fasttrun_inspect_stats('nonexistent_temp_xxx');
 empty_for_missing 
-------------------
 t
(1 row)

-- Empty result для таблицы без fasttrun-статистики
CREATE TEMP TABLE t_no_stats (id int);
SELECT count(*) = 0 AS empty_for_no_stats_yet
FROM fasttrun_inspect_stats('t_no_stats');
 empty_for_no_stats_yet 
------------------------
 t
(1 row)

DROP TABLE t_no_stats;
COMMIT;
DROP TABLE t_inspect;
-- ----------------------------------------------------------------------
-- 27. fasttrun.sample_rows = -1 (auto) — sample target автоматически
--     совпадает с тем, что попросил бы std_typanalyze (по умолчанию
--     300 × default_statistics_target = 30000 при default DST=100).
--
--     Цели теста:
--       (1) -1 не ломает функционал — fasttrun_analyze не падает,
--           inspect_stats возвращает строки;
--       (2) на той же таблице -1 даёт **точно тот же набор колонок**
--           в кэше, что и default 3000 — отличается только sample
--           size, не shape;
--       (3) shape результата (количество MCV/histogram slots) совпадает
--           с тем, что записал бы regular ANALYZE на той же таблице.
--
--     Сравнение точности (MCV inclusion для редких значений,
--     histogram precision) проходит через bench в fasttrun_bench.sql
--     §14, потому что это timing-зависимое и плохо assert'ится через
--     EXPLAIN на CI.
-- ----------------------------------------------------------------------
CREATE TEMP TABLE t_auto_sample (id int, label text);
INSERT INTO t_auto_sample
SELECT g, 'label_' || (g % 50)
FROM generate_series(1, 100000) g;
BEGIN;
-- Прогон с sample_rows = 3000 (default)
SELECT fasttrun_analyze('t_auto_sample');
 fasttrun_analyze 
------------------
 
(1 row)

SELECT count(*) = 2 AS default_rows_count
FROM fasttrun_inspect_stats('t_auto_sample');
 default_rows_count 
--------------------
 t
(1 row)

COMMIT;
BEGIN;
-- Прогон с sample_rows = -1 (авто)
SET LOCAL fasttrun.sample_rows = -1;
SELECT fasttrun_analyze('t_auto_sample');
 fasttrun_analyze 
------------------
 
(1 row)

-- Та же форма: одна строка на каждую колонку
SELECT count(*) = 2 AS auto_rows_count
FROM fasttrun_inspect_stats('t_auto_sample');
 auto_rows_count 
-----------------
 t
(1 row)

-- Для label (text MCV) хотя бы один MCV-слот должен быть заполнен.
-- При -1 выборка ~30000 строк -- данных достаточно.
SELECT count(*) >= 1 AS has_label_stats
FROM fasttrun_inspect_stats('t_auto_sample')
WHERE staattnum = 2 AND stadistinct > 0;
 has_label_stats 
-----------------
 t
(1 row)

-- План для запроса по label должен быть адекватным
DO $$
DECLARE
    plan_line text;
    rows_est  int;
BEGIN
    FOR plan_line IN EXPLAIN SELECT * FROM t_auto_sample WHERE label = 'label_5' LOOP
        IF plan_line ~ 'rows=' THEN
            rows_est := substring(plan_line FROM 'rows=(\d+)')::int;
            EXIT;
        END IF;
    END LOOP;
    -- 50 уникальных label в 100k строк → реальных ~2000 на label
    -- Допуск: 500..5000
    IF rows_est < 500 OR rows_est > 5000 THEN
        RAISE EXCEPTION 'sample_rows=-1 path: planner estimate off: rows=% (real ~2000)',
                        rows_est;
    END IF;
    RAISE NOTICE 'sample_rows=-1: planner estimate ok for label query';
END;
$$;
NOTICE:  sample_rows=-1: planner estimate ok for label query
COMMIT;
DROP TABLE t_auto_sample;
-- ----------------------------------------------------------------------
-- 28. Опции статистики колонок должны совпадать с обычным ANALYZE:
--     SET STATISTICS 0 отключает stats по колонке, а n_distinct
--     переопределяет вычисленный stadistinct.
-- ----------------------------------------------------------------------
CREATE TEMP TABLE t_attopts (id int, no_stats int, nd int);
INSERT INTO t_attopts SELECT g, g % 10, g FROM generate_series(1, 10000) g;
ALTER TABLE t_attopts ALTER COLUMN no_stats SET STATISTICS 0;
ALTER TABLE t_attopts ALTER COLUMN nd SET (n_distinct = 10);
BEGIN;
SET LOCAL fasttrun.sample_rows = -1;
SELECT fasttrun_analyze('t_attopts');
 fasttrun_analyze 
------------------
 
(1 row)

SELECT count(*) = 2 AS attopts_stats_rows
  FROM fasttrun_inspect_stats('t_attopts');
 attopts_stats_rows 
--------------------
 t
(1 row)

SELECT count(*) = 0 AS attopts_no_stats_skipped
  FROM fasttrun_inspect_stats('t_attopts')
 WHERE staattnum = 2;
 attopts_no_stats_skipped 
--------------------------
 t
(1 row)

SELECT stadistinct = 10 AS attopts_ndistinct_applied
  FROM fasttrun_inspect_stats('t_attopts')
 WHERE staattnum = 3;
 attopts_ndistinct_applied 
---------------------------
 t
(1 row)

COMMIT;
DROP TABLE t_attopts;
-- ----------------------------------------------------------------------
-- 29. Cross-commit staleness: обычный SQL-refill temp-таблицы в ОТДЕЛЬНОЙ
--     транзакции (без вызова fasttrun_*) не должен оставлять stale
--     MCV/n_distinct видимыми планировщику.
--
--     pgstat-счётчики temp-таблицы обнуляются на границе транзакции
--     (и trans-цепочка, и локальный snapshot), в shared pgstat temp не
--     флашится вовсе — то есть счётчик, переживающий commit, недоступен.
--     Единственный переживающий commit сигнал — физический размер, но он
--     bloat-контаминирован (bulk UPDATE / откат подтранзакции удваивает
--     страницы без смены данных). Поэтому это грубый backstop: стата
--     прячется только при изменении размера на порядок (>=3x или <=1/3),
--     что однозначно означает refill мимо fasttrun_analyze. Остаточный
--     случай (refill той же величины, но иным распределением, закоммиченный
--     без вызова fasttrun) не ловится — для temp нет построчного сигнала.
-- ----------------------------------------------------------------------
CREATE TEMP TABLE t_xcommit (c int) ON COMMIT PRESERVE ROWS;
-- 1-строчный зонд с честной статистикой — детерминирует форму join-оценки.
CREATE TEMP TABLE t_xc_probe (c int);
INSERT INTO t_xc_probe VALUES (42);
SELECT fasttrun_analyze('t_xc_probe');
 fasttrun_analyze 
------------------
 
(1 row)

-- Xact A: 1000 строк, все c=5 -> MCV{5:1.0}, n_distinct=1.
INSERT INTO t_xcommit SELECT 5 FROM generate_series(1, 1000);
BEGIN;
SELECT fasttrun_analyze('t_xcommit');
 fasttrun_analyze 
------------------
 
(1 row)

COMMIT;
-- Позитивный контроль: размер не менялся через commit -> стата ОСТАЁТСЯ
-- видимой (soft freshness переживает commit). Оценка c=5 ~ вся таблица.
DO $$
DECLARE ln text; est int := NULL;
BEGIN
  FOR ln IN EXPLAIN SELECT * FROM t_xcommit WHERE c = 5 LOOP
    IF ln ~ 'rows=' THEN est := substring(ln FROM 'rows=(\d+)')::int; EXIT; END IF;
  END LOOP;
  IF est IS NULL OR est < 500 THEN
    RAISE EXCEPTION 'unchanged-across-commit stats wrongly hidden: est=%', est;
  END IF;
END$$;
SELECT 'xcommit_unchanged_visible_ok' AS marker;
            marker            
------------------------------
 xcommit_unchanged_visible_ok
(1 row)

-- Xact B: обычный INSERT 100000 РАЗНЫХ значений, БЕЗ fasttrun_analyze.
-- Размер вырастает в разы; relid не попадает в touched-список.
INSERT INTO t_xcommit SELECT g FROM generate_series(1, 100000) g;
-- Xact C: join probe -> t_xcommit по c. При stale n_distinct=1 планировщик
-- считает join почти декартовым (~100k+). После фикса стата спрятана,
-- оценка коллапсирует к defaults. Дискриминатор с огромным зазором.
DO $$
DECLARE ln text; est bigint := NULL;
BEGIN
  FOR ln IN EXPLAIN SELECT * FROM t_xc_probe p JOIN t_xcommit t ON t.c = p.c LOOP
    IF ln ~ 'Join' OR ln ~ 'Nested Loop' THEN
      est := substring(ln FROM 'rows=(\d+)')::bigint; EXIT;
    END IF;
  END LOOP;
  IF est IS NULL OR est > 10000 THEN
    RAISE EXCEPTION 'stale n_distinct served across commit: join est=%', est;
  END IF;
END$$;
SELECT 'xcommit_stale_hidden_ok' AS marker;
         marker          
-------------------------
 xcommit_stale_hidden_ok
(1 row)

DROP TABLE t_xcommit;
DROP TABLE t_xc_probe;
-- ----------------------------------------------------------------------
-- 30. use_typanalyze=off (Haas-Stokes): чрезмерно широкие varlena НЕ
--     детостятся — иначе полный TOAST-payload материализуется в памяти
--     и на multi-MB значениях × sample_rows раздувает backend до OOM.
--     Зеркалим ядерный WIDTH_THRESHOLD (1024 байта): широкие значения
--     считаются toowide (assumed distinct), а не детостятся и сравниваются.
--     Наблюдаемо: набор ОДИНАКОВЫХ широких значений не схлопывается в
--     n_distinct=1 (что потребовало бы детоста всех) — stadistinct < 0
--     (все distinct), как у обычного ANALYZE.
-- ----------------------------------------------------------------------
CREATE TEMP TABLE t_wide (doc text);
INSERT INTO t_wide SELECT repeat('x', 4000) FROM generate_series(1, 300);
BEGIN;
SET LOCAL fasttrun.use_typanalyze = off;
SELECT fasttrun_collect_stats('t_wide');
 fasttrun_collect_stats 
------------------------
 
(1 row)

SELECT stadistinct < 0 AS wide_not_collapsed
  FROM fasttrun_inspect_stats('t_wide');
 wide_not_collapsed 
--------------------
 t
(1 row)

COMMIT;
DROP TABLE t_wide;
-- ----------------------------------------------------------------------
-- 31. Giant-temp guardrail: выше fasttrun.max_analyze_pages холодный
--     fasttrun_analyze переходит на block-sampling (оценка count по
--     плотности, как core ANALYZE) вместо полного скана всей таблицы.
--     reltuples становится оценкой (±%), column-stats собираются с
--     выборочных блоков. Ниже порога / при 0 — точный полный скан.
-- ----------------------------------------------------------------------
CREATE TEMP TABLE t_giant (id int, grp int);
INSERT INTO t_giant SELECT g, g % 100 FROM generate_series(1, 50000) g;
BEGIN;
-- Порог низкий -> ~220-страничная таблица уходит в block-sampling.
SET LOCAL fasttrun.max_analyze_pages = 5;
SET LOCAL client_min_messages = debug1;
SELECT fasttrun_analyze('t_giant');
DEBUG:  fasttrun: block-sampling analyze scan
DEBUG:  fasttrun: invalidating backend-local cached plans
 fasttrun_analyze 
------------------
 
(1 row)

RESET client_min_messages;
-- reltuples — оценка в разумной полосе вокруг 50000 (±25%).
SELECT reltuples BETWEEN 37500 AND 62500 AS giant_reltuples_estimate
  FROM fasttrun_relstats('t_giant');
 giant_reltuples_estimate 
--------------------------
 t
(1 row)

-- column-stats собраны из выборки: grp (100 значений) -> ~500 строк на
-- значение, вменяемая оценка, не default-селективность.
DO $$
DECLARE ln text; est int := NULL;
BEGIN
  FOR ln IN EXPLAIN SELECT * FROM t_giant WHERE grp = 1 LOOP
    IF ln ~ 'rows=' THEN est := substring(ln FROM 'rows=(\d+)')::int; EXIT; END IF;
  END LOOP;
  IF est IS NULL OR est > 5000 THEN
    RAISE EXCEPTION 'giant block-sample column stats off: grp=1 est=%', est;
  END IF;
END$$;
SELECT 'giant_block_sample_ok' AS marker;
        marker         
-----------------------
 giant_block_sample_ok
(1 row)

COMMIT;
DROP TABLE t_giant;
-- ----------------------------------------------------------------------
-- 31b. Тот же guardrail покрывает delta-refresh (не только cold path):
--      после надпорогового churn пересбор статы на гигантской temp тоже
--      идёт block-sampling, а не полный O(таблицы) скан.
-- ----------------------------------------------------------------------
CREATE TEMP TABLE t_giant_delta (id int, grp int);
INSERT INTO t_giant_delta SELECT g, g % 100 FROM generate_series(1, 50000) g;
BEGIN;
SET LOCAL fasttrun.max_analyze_pages = 5;
SELECT fasttrun_analyze('t_giant_delta');       -- cold (block-sample, debug тихо)
 fasttrun_analyze 
------------------
 
(1 row)

UPDATE t_giant_delta SET grp = grp + 1 WHERE id <= 20000;  -- 40% churn -> refresh
SET LOCAL client_min_messages = debug1;
SELECT fasttrun_analyze('t_giant_delta');       -- delta-refresh -> block-sample
DEBUG:  fasttrun: block-sampling analyze scan
DEBUG:  fasttrun: invalidating backend-local cached plans
 fasttrun_analyze 
------------------
 
(1 row)

RESET client_min_messages;
SELECT reltuples BETWEEN 37500 AND 62500 AS delta_reltuples_estimate
  FROM fasttrun_relstats('t_giant_delta');
 delta_reltuples_estimate 
--------------------------
 t
(1 row)

COMMIT;
DROP TABLE t_giant_delta;
-- ----------------------------------------------------------------------
-- 32. Partial-index relstats при fasttrun.sample_rows = 0.  Без выборки
--     column-stats отключены, но relpages (физический размер) и
--     reltuples partial-индекса всё равно должны обновляться: relpages
--     измеряется напрямую, reltuples берётся как верхняя граница
--     (totalrows) вместо устаревшего заниженного значения.  Проверяем
--     через fasttrun_relstats -- planner-visible срез relstats из
--     session-local кэша.
-- ----------------------------------------------------------------------
CREATE TEMP TABLE t_partial_zero (id int, flag bool);
INSERT INTO t_partial_zero SELECT g, false FROM generate_series(1, 100000) g;
CREATE INDEX t_partial_zero_idx ON t_partial_zero (id) WHERE flag;
SELECT fasttrun_analyze('t_partial_zero');
 fasttrun_analyze 
------------------
 
(1 row)

-- Индекс стартует пустым (предикат не матчит ни одной строки).
SELECT reltuples::bigint = 0 AS partial_zero_start
  FROM fasttrun_relstats('t_partial_zero_idx');
 partial_zero_start 
--------------------
 t
(1 row)

-- Предикат начинает матчить половину строк.
UPDATE t_partial_zero SET flag = true WHERE id <= 50000;
-- Без выборки relpages обновляется (физический замер), reltuples берётся
-- как верхняя граница totalrows, а не остаётся устаревшим нулём.
SET fasttrun.sample_rows = 0;
SELECT fasttrun_analyze('t_partial_zero');
 fasttrun_analyze 
------------------
 
(1 row)

SELECT relpages > 1 AS relpages_refreshed,
       reltuples::bigint = 100000 AS reltuples_upper_bound
  FROM fasttrun_relstats('t_partial_zero_idx');
 relpages_refreshed | reltuples_upper_bound 
--------------------+-----------------------
 t                  | t
(1 row)

RESET fasttrun.sample_rows;
DROP TABLE t_partial_zero;
-- ----------------------------------------------------------------------
-- 33. Повторный partial-index rescan без нового DML.  Один sub-threshold
--     UPDATE не должен заставлять каждый последующий fasttrun_analyze в
--     той же транзакции заново сэмплировать partial-индексы: probe меряет
--     churn от якоря последнего рескана, а не от baseline пересбора
--     column stats (baseline ниже порога намеренно стоит на месте).
--     max_analyze_pages=1 превращает каждый фактический скан в
--     block-sample DEBUG-маркер; 2000 строк < sample_rows делают выборку
--     исчерпывающей, а оценки детерминированными.
-- ----------------------------------------------------------------------
CREATE TEMP TABLE t_partial_repeat (id int, flag bool);
INSERT INTO t_partial_repeat SELECT g, g <= 100 FROM generate_series(1, 2000) g;
CREATE INDEX t_partial_repeat_idx ON t_partial_repeat (id) WHERE flag;
BEGIN;
SET LOCAL fasttrun.max_analyze_pages = 1;   -- любой скан = DEBUG-маркер
SELECT fasttrun_analyze('t_partial_repeat');   -- cold, вне DEBUG-окна
 fasttrun_analyze 
------------------
 
(1 row)

UPDATE t_partial_repeat SET flag = true WHERE id > 100 AND id <= 120;  -- 1% churn
SET LOCAL client_min_messages = debug1;
SELECT fasttrun_analyze('t_partial_repeat');   -- новый churn: рескан + инвалидация
DEBUG:  fasttrun: block-sampling analyze scan
DEBUG:  fasttrun: invalidating backend-local cached plans
 fasttrun_analyze 
------------------
 
(1 row)

SELECT fasttrun_analyze('t_partial_repeat');   -- без нового DML: тихо
 fasttrun_analyze 
------------------
 
(1 row)

SELECT fasttrun_analyze('t_partial_repeat');   -- без нового DML: тихо
 fasttrun_analyze 
------------------
 
(1 row)

RESET client_min_messages;
-- Любой НОВЫЙ churn триггерит рескан снова.
UPDATE t_partial_repeat SET flag = true WHERE id > 120 AND id <= 140;
SET LOCAL client_min_messages = debug1;
SELECT fasttrun_analyze('t_partial_repeat');   -- новый churn: рескан + инвалидация
DEBUG:  fasttrun: block-sampling analyze scan
DEBUG:  fasttrun: invalidating backend-local cached plans
 fasttrun_analyze 
------------------
 
(1 row)

RESET client_min_messages;
COMMIT;
DROP TABLE t_partial_repeat;
-- ----------------------------------------------------------------------
-- 33b. Якорь рескана откатывается вместе с savepoint'ом.  Рескан внутри
--      откаченной подтранзакции не должен подавить рескан churn'а,
--      набранного до savepoint (index relstats тоже откатились); после
--      RELEASE якорь промоутится к родителю, и analyze без нового DML
--      молчит.
-- ----------------------------------------------------------------------
CREATE TEMP TABLE t_partial_sp (id int, flag bool);
INSERT INTO t_partial_sp SELECT g, g <= 100 FROM generate_series(1, 2000) g;
CREATE INDEX t_partial_sp_idx ON t_partial_sp (id) WHERE flag;
BEGIN;
SET LOCAL fasttrun.max_analyze_pages = 1;   -- любой скан = DEBUG-маркер
SELECT fasttrun_analyze('t_partial_sp');    -- cold, вне DEBUG-окна
 fasttrun_analyze 
------------------
 
(1 row)

UPDATE t_partial_sp SET flag = true WHERE id > 100 AND id <= 120;  -- churn ДО savepoint
SET LOCAL client_min_messages = debug1;
SAVEPOINT s;
SELECT fasttrun_analyze('t_partial_sp');    -- рескан внутри savepoint
DEBUG:  fasttrun: block-sampling analyze scan
DEBUG:  fasttrun: invalidating backend-local cached plans
 fasttrun_analyze 
------------------
 
(1 row)

ROLLBACK TO SAVEPOINT s;                    -- якорь сброшен, churn жив
DEBUG:  fasttrun: invalidating backend-local cached plans
SELECT fasttrun_analyze('t_partial_sp');    -- рескан обязан повториться
DEBUG:  fasttrun: block-sampling analyze scan
 fasttrun_analyze 
------------------
 
(1 row)

SELECT fasttrun_analyze('t_partial_sp');    -- без нового DML: тихо
 fasttrun_analyze 
------------------
 
(1 row)

RESET client_min_messages;
UPDATE t_partial_sp SET flag = true WHERE id > 120 AND id <= 140;
SET LOCAL client_min_messages = debug1;
SAVEPOINT s2;
SELECT fasttrun_analyze('t_partial_sp');    -- рескан внутри savepoint
DEBUG:  fasttrun: block-sampling analyze scan
DEBUG:  fasttrun: invalidating backend-local cached plans
 fasttrun_analyze 
------------------
 
(1 row)

RELEASE SAVEPOINT s2;                       -- якорь промоутится к родителю
SELECT fasttrun_analyze('t_partial_sp');    -- без нового DML: тихо
 fasttrun_analyze 
------------------
 
(1 row)

RESET client_min_messages;
COMMIT;
DROP TABLE t_partial_sp;
-- ----------------------------------------------------------------------
-- 34. Обычный ANALYZE со списком колонок передаёт ядру только
--     перечисленные колонки. Для b сохраняется локальная статистика,
--     полный ANALYZE передаёт ядру обе колонки.
-- ----------------------------------------------------------------------
CREATE TEMP TABLE t_handoff (a int, b int);
INSERT INTO t_handoff SELECT g, 1 FROM generate_series(1, 100000) g;
ANALYZE t_handoff;
UPDATE t_handoff SET b = a;
SELECT fasttrun_analyze('t_handoff');
 fasttrun_analyze 
------------------
 
(1 row)

SELECT coalesce(array_agg(staattnum ORDER BY staattnum) =
                ARRAY[1, 2]::smallint[], false) AS handoff_local_both
  FROM fasttrun_inspect_stats('t_handoff');
 handoff_local_both 
--------------------
 t
(1 row)

ANALYZE t_handoff (a);
SELECT coalesce(array_agg(staattnum ORDER BY staattnum) =
                ARRAY[2]::smallint[], false) AS handoff_partial_kept_b
  FROM fasttrun_inspect_stats('t_handoff');
 handoff_partial_kept_b 
------------------------
 t
(1 row)

DO $$
DECLARE ln text; est_a int := NULL; est_b int := NULL;
BEGIN
  FOR ln IN EXPLAIN SELECT * FROM t_handoff WHERE a = 1 LOOP
    IF ln ~ 'on t_handoff' THEN est_a := substring(ln FROM 'rows=(\d+)')::int; EXIT; END IF;
  END LOOP;
  FOR ln IN EXPLAIN SELECT * FROM t_handoff WHERE b = 1 LOOP
    IF ln ~ 'on t_handoff' THEN est_b := substring(ln FROM 'rows=(\d+)')::int; EXIT; END IF;
  END LOOP;
  IF est_a IS NULL OR est_a > 100 OR est_b IS NULL OR est_b > 100 THEN
    RAISE EXCEPTION 'partial ANALYZE ownership mismatch: a=%, b=%', est_a, est_b;
  END IF;
END$$;
SELECT 'partial_analyze_handoff_ok' AS marker;
           marker           
----------------------------
 partial_analyze_handoff_ok
(1 row)

ANALYZE t_handoff;
SELECT count(*) = 0 AS handoff_full_core
  FROM fasttrun_inspect_stats('t_handoff');
 handoff_full_core 
-------------------
 t
(1 row)

-- Откат к точке сохранения должен восстановить локальную статистику
-- обеих колонок.
SELECT fasttrun_analyze('t_handoff');
 fasttrun_analyze 
------------------
 
(1 row)

BEGIN;
SAVEPOINT handoff_sp;
ANALYZE t_handoff (a);
SELECT coalesce(array_agg(staattnum ORDER BY staattnum) =
                ARRAY[2]::smallint[], false) AS handoff_inside_savepoint
  FROM fasttrun_inspect_stats('t_handoff');
 handoff_inside_savepoint 
--------------------------
 t
(1 row)

ROLLBACK TO SAVEPOINT handoff_sp;
SELECT coalesce(array_agg(staattnum ORDER BY staattnum) =
                ARRAY[1, 2]::smallint[], false) AS handoff_after_rollback
  FROM fasttrun_inspect_stats('t_handoff');
 handoff_after_rollback 
------------------------
 t
(1 row)

COMMIT;
BEGIN;
ANALYZE t_handoff;
ROLLBACK;
SELECT coalesce(array_agg(staattnum ORDER BY staattnum) =
                ARRAY[1, 2]::smallint[], false) AS handoff_top_rollback
  FROM fasttrun_inspect_stats('t_handoff');
 handoff_top_rollback 
----------------------
 t
(1 row)

DROP TABLE t_handoff;
-- ----------------------------------------------------------------------
-- 35. VACUUM без ANALYZE не меняет локальную статистику.
-- ----------------------------------------------------------------------
CREATE TEMP TABLE t_vacuum_keep (a int, b text);
INSERT INTO t_vacuum_keep SELECT g, md5(g::text) FROM generate_series(1, 5000) g;
SELECT fasttrun_analyze('t_vacuum_keep');
 fasttrun_analyze 
------------------
 
(1 row)

CREATE TEMP TABLE t_vacuum_snapshot AS
SELECT staattnum, s::text AS snapshot
  FROM fasttrun_inspect_stats('t_vacuum_keep') AS s;
VACUUM t_vacuum_keep;
SELECT count(*) = 2 AND
       coalesce(bool_and(v.snapshot = s::text), false) AS plain_vacuum_preserved
  FROM t_vacuum_snapshot v
  FULL JOIN fasttrun_inspect_stats('t_vacuum_keep') AS s USING (staattnum);
 plain_vacuum_preserved 
------------------------
 t
(1 row)

DROP TABLE t_vacuum_snapshot;
DROP TABLE t_vacuum_keep;
-- ----------------------------------------------------------------------
-- 36. VACUUM (ANALYZE) со списком колонок ведёт себя как ANALYZE;
--     вызов без списка передаёт ядру все колонки.
-- ----------------------------------------------------------------------
CREATE TEMP TABLE t_vacuum_analyze (a int, b int);
INSERT INTO t_vacuum_analyze SELECT g, 1 FROM generate_series(1, 100000) g;
ANALYZE t_vacuum_analyze;
UPDATE t_vacuum_analyze SET b = a;
SELECT fasttrun_analyze('t_vacuum_analyze');
 fasttrun_analyze 
------------------
 
(1 row)

VACUUM (ANALYZE) t_vacuum_analyze (a);
SELECT coalesce(array_agg(staattnum ORDER BY staattnum) =
                ARRAY[2]::smallint[], false) AS vacuum_analyze_partial_kept_b
  FROM fasttrun_inspect_stats('t_vacuum_analyze');
 vacuum_analyze_partial_kept_b 
-------------------------------
 t
(1 row)

DO $$
DECLARE ln text; est int := NULL;
BEGIN
  FOR ln IN EXPLAIN SELECT * FROM t_vacuum_analyze WHERE b = 1 LOOP
    IF ln ~ 'on t_vacuum_analyze' THEN est := substring(ln FROM 'rows=(\d+)')::int; EXIT; END IF;
  END LOOP;
  IF est IS NULL OR est > 100 THEN
    RAISE EXCEPTION 'VACUUM ANALYZE exposed stale b stats: est=%', est;
  END IF;
END$$;
SELECT 'vacuum_analyze_partial_ok' AS marker;
          marker           
---------------------------
 vacuum_analyze_partial_ok
(1 row)

VACUUM (ANALYZE) t_vacuum_analyze;
SELECT count(*) = 0 AS vacuum_analyze_full_core
  FROM fasttrun_inspect_stats('t_vacuum_analyze');
 vacuum_analyze_full_core 
--------------------------
 t
(1 row)

DROP TABLE t_vacuum_analyze;
-- ----------------------------------------------------------------------
-- 37. VACUUM FULL и CLUSTER скрывают старую статистику до нового сбора.
--     CLUSTER и его откат уже проверены в разделе 20a.
-- ----------------------------------------------------------------------
CREATE TEMP TABLE t_vacuum_full (a int, b int);
INSERT INTO t_vacuum_full SELECT g, 1 FROM generate_series(1, 100000) g;
ANALYZE t_vacuum_full;
UPDATE t_vacuum_full SET b = a;
SELECT fasttrun_analyze('t_vacuum_full');
 fasttrun_analyze 
------------------
 
(1 row)

VACUUM FULL t_vacuum_full;
SELECT count(*) = 0 AS vacuum_full_local_neutral
  FROM fasttrun_inspect_stats('t_vacuum_full');
 vacuum_full_local_neutral 
---------------------------
 t
(1 row)

DO $$
DECLARE ln text; est int := NULL;
BEGIN
  FOR ln IN EXPLAIN SELECT * FROM t_vacuum_full WHERE b = 1 LOOP
    IF ln ~ 'on t_vacuum_full' THEN est := substring(ln FROM 'rows=(\d+)')::int; EXIT; END IF;
  END LOOP;
  IF est IS NULL OR est < 100 OR est > 5000 THEN
    RAISE EXCEPTION 'VACUUM FULL did not block stale core stats: est=%', est;
  END IF;
END$$;
SELECT 'vacuum_full_neutral_ok' AS marker;
         marker         
------------------------
 vacuum_full_neutral_ok
(1 row)

DROP TABLE t_vacuum_full;
-- ----------------------------------------------------------------------
-- 38. ANALYZE без списка таблиц обрабатывает только временные таблицы
--     под управлением fasttrun. Откат восстанавливает локальную статистику.
-- ----------------------------------------------------------------------
CREATE TEMP TABLE t_analyze_all_1 (a int, b int);
CREATE TEMP TABLE t_analyze_all_2 (a int, b int);
INSERT INTO t_analyze_all_1 SELECT g, g FROM generate_series(1, 1000) g;
INSERT INTO t_analyze_all_2 SELECT g, g FROM generate_series(1, 1000) g;
SELECT fasttrun_analyze('t_analyze_all_1');
 fasttrun_analyze 
------------------
 
(1 row)

SELECT fasttrun_analyze('t_analyze_all_2');
 fasttrun_analyze 
------------------
 
(1 row)

BEGIN;
ANALYZE;
SELECT count(*) = 0 AS analyze_all_inside
  FROM fasttrun_inspect_stats('t_analyze_all_1');
 analyze_all_inside 
--------------------
 t
(1 row)

ROLLBACK;
SELECT (SELECT count(*) FROM fasttrun_inspect_stats('t_analyze_all_1')) = 2 AND
       (SELECT count(*) FROM fasttrun_inspect_stats('t_analyze_all_2')) = 2
       AS analyze_all_rollback_restored;
 analyze_all_rollback_restored 
-------------------------------
 t
(1 row)

ANALYZE;
SELECT (SELECT count(*) FROM fasttrun_inspect_stats('t_analyze_all_1')) = 0 AND
       (SELECT count(*) FROM fasttrun_inspect_stats('t_analyze_all_2')) = 0
       AS analyze_all_handoff;
 analyze_all_handoff 
---------------------
 t
(1 row)

DROP TABLE t_analyze_all_1;
DROP TABLE t_analyze_all_2;
-- ----------------------------------------------------------------------
-- 39. После ошибки многотабличного VACUUM (ANALYZE) локальная
--     статистика всех затронутых таблиц остаётся скрытой.
-- ----------------------------------------------------------------------
CREATE TEMP TABLE t_vacuum_good (a int, b int);
CREATE TEMP TABLE t_vacuum_bad (a int, b int);
INSERT INTO t_vacuum_good SELECT g, g FROM generate_series(1, 1000) g;
INSERT INTO t_vacuum_bad SELECT g, g FROM generate_series(1, 1000) g;
SELECT fasttrun_analyze('t_vacuum_good');
 fasttrun_analyze 
------------------
 
(1 row)

SELECT fasttrun_analyze('t_vacuum_bad');
 fasttrun_analyze 
------------------
 
(1 row)

VACUUM (ANALYZE) t_vacuum_good, t_vacuum_bad;
SELECT (SELECT count(*) FROM fasttrun_inspect_stats('t_vacuum_good')) = 0 AND
       (SELECT count(*) FROM fasttrun_inspect_stats('t_vacuum_bad')) = 0
       AS vacuum_multi_success_handoff;
 vacuum_multi_success_handoff 
------------------------------
 t
(1 row)

UPDATE t_vacuum_good SET b = 1;
UPDATE t_vacuum_bad SET b = 1;
ANALYZE t_vacuum_good;
ANALYZE t_vacuum_bad;
UPDATE t_vacuum_good SET b = a;
UPDATE t_vacuum_bad SET b = a;
SELECT fasttrun_analyze('t_vacuum_good');
 fasttrun_analyze 
------------------
 
(1 row)

SELECT fasttrun_analyze('t_vacuum_bad');
 fasttrun_analyze 
------------------
 
(1 row)

\set ON_ERROR_STOP 0
VACUUM (ANALYZE) t_vacuum_good, t_vacuum_bad (missing_col);
ERROR:  column "missing_col" of relation "t_vacuum_bad" does not exist
\set ON_ERROR_STOP 1
SELECT (SELECT count(*) FROM fasttrun_inspect_stats('t_vacuum_good')) = 0 AND
       (SELECT count(*) FROM fasttrun_inspect_stats('t_vacuum_bad')) = 0
       AS vacuum_multi_error_fail_closed;
 vacuum_multi_error_fail_closed 
--------------------------------
 t
(1 row)

DO $$
DECLARE ln text; est_good int := NULL; est_bad int := NULL;
BEGIN
  FOR ln IN EXPLAIN SELECT * FROM t_vacuum_good WHERE b = 1 LOOP
    IF ln ~ 'on t_vacuum_good' THEN est_good := substring(ln FROM 'rows=(\d+)')::int; EXIT; END IF;
  END LOOP;
  FOR ln IN EXPLAIN SELECT * FROM t_vacuum_bad WHERE b = 1 LOOP
    IF ln ~ 'on t_vacuum_bad' THEN est_bad := substring(ln FROM 'rows=(\d+)')::int; EXIT; END IF;
  END LOOP;
  IF est_good IS NULL OR est_good > 50 OR est_bad IS NULL OR est_bad > 50 THEN
    RAISE EXCEPTION 'multi-target error exposed stale core: good=%, bad=%', est_good, est_bad;
  END IF;
END$$;
SELECT 'vacuum_multi_error_neutral_ok' AS marker;
            marker             
-------------------------------
 vacuum_multi_error_neutral_ok
(1 row)

DROP TABLE t_vacuum_good;
DROP TABLE t_vacuum_bad;
-- Удаляем исходные таблицы перед отдельной проверкой памяти.
DROP TABLE t_stats;
DROP TABLE t_multi;
DROP TABLE t_stats_persist;
-- ----------------------------------------------------------------------
-- 40. После успешного полного ANALYZE удаляются ненужные локальные
--     записи и контексты памяти.
-- ----------------------------------------------------------------------
CREATE TEMP TABLE t_handoff_prune (a int, b int);
INSERT INTO t_handoff_prune SELECT g, g FROM generate_series(1, 1000) g;
SELECT fasttrun_analyze('t_handoff_prune');
 fasttrun_analyze 
------------------
 
(1 row)

ANALYZE t_handoff_prune;
SELECT count(DISTINCT name) = 0 AS handoff_contexts_pruned
  FROM pg_backend_memory_contexts
 WHERE name IN ('fasttrun analyze cache',
                'fasttrun stats cache',
                'fasttrun stats relid cache');
 handoff_contexts_pruned 
-------------------------
 t
(1 row)

DROP TABLE t_handoff_prune;
-- ----------------------------------------------------------------------
-- 41. В PG18 виртуальные вычисляемые колонки не хранят значение.
--     Как обычный ANALYZE, оба способа сбора их пропускают.
-- ----------------------------------------------------------------------
DO $test$
DECLARE got smallint[];
BEGIN
  IF current_setting('server_version_num')::int >= 180000 THEN
    EXECUTE 'CREATE TEMP TABLE t_virtual_guard ('
         || 'a int, b int GENERATED ALWAYS AS (a * 2) VIRTUAL)';
    EXECUTE 'INSERT INTO t_virtual_guard(a) SELECT generate_series(1,1000)';

    PERFORM set_config('fasttrun.use_typanalyze', 'on', true);
    PERFORM fasttrun_analyze('t_virtual_guard');
    SELECT array_agg(staattnum ORDER BY staattnum) INTO got
      FROM fasttrun_inspect_stats('t_virtual_guard');
    IF got IS DISTINCT FROM ARRAY[1]::smallint[] THEN
      RAISE EXCEPTION 'typanalyze collected virtual column: %', got;
    END IF;

    PERFORM fasttruncate('t_virtual_guard');
    EXECUTE 'INSERT INTO t_virtual_guard(a) SELECT generate_series(1,1000)';
    PERFORM set_config('fasttrun.use_typanalyze', 'off', true);
    PERFORM fasttrun_analyze('t_virtual_guard');
    SELECT array_agg(staattnum ORDER BY staattnum) INTO got
      FROM fasttrun_inspect_stats('t_virtual_guard');
    IF got IS DISTINCT FROM ARRAY[1]::smallint[] THEN
      RAISE EXCEPTION 'Haas-Stokes collected virtual column: %', got;
    END IF;
    EXECUTE 'DROP TABLE t_virtual_guard';
  END IF;
END
$test$;
\echo virtual_generated_guard_ok
virtual_generated_guard_ok
-- ----------------------------------------------------------------------
-- 42. Статистические API отклоняют секционированные таблицы и родителей
--     наследования, как fasttruncate: локальная inh=false статистика
--     родителя спрятала бы ядерную inherited-статистику при
--     appendrel-планировании. Ядерная оценка переживает отклонённые вызовы.
-- ----------------------------------------------------------------------
CREATE TEMP TABLE t_inh_stats_parent (x int);
CREATE TEMP TABLE t_inh_stats_child () INHERITS (t_inh_stats_parent);
INSERT INTO t_inh_stats_child SELECT g % 5 FROM generate_series(1, 100000) g;
ANALYZE t_inh_stats_parent;
DO $$
DECLARE ln text; est int := NULL;
BEGIN
  FOR ln IN EXPLAIN SELECT x FROM t_inh_stats_parent GROUP BY x LOOP
    IF est IS NULL THEN est := substring(ln FROM 'rows=(\d+)')::int; END IF;
  END LOOP;
  IF est IS NULL OR est > 100 THEN
    RAISE EXCEPTION 'inherited group estimate lost before fasttrun calls: est=%', est;
  END IF;
END$$;
SELECT 'inherited_estimate_baseline_ok' AS marker;
             marker             
--------------------------------
 inherited_estimate_baseline_ok
(1 row)

\set ON_ERROR_STOP 0
SELECT fasttrun_analyze('t_inh_stats_parent');
ERROR:  fasttrun_analyze: relation "t_inh_stats_parent" is partitioned or an inheritance parent
HINT:  Use core SQL ANALYZE for inheritance or partition traversal.
SELECT fasttrun_collect_stats('t_inh_stats_parent');
ERROR:  fasttrun_collect_stats: relation "t_inh_stats_parent" is partitioned or an inheritance parent
HINT:  Use core SQL ANALYZE for inheritance or partition traversal.
-- Batch прерывается на родителе (контракт bulk); обычная таблица
-- обрабатывается вызовом без родителя в списке.
CREATE TEMP TABLE t_inh_stats_flat (id int);
INSERT INTO t_inh_stats_flat SELECT generate_series(1, 100);
SELECT fasttrun_analyze_bulk('t_inh_stats_flat', 't_inh_stats_parent');
ERROR:  fasttrun_analyze_bulk: relation "t_inh_stats_parent" is partitioned or an inheritance parent
HINT:  Use core SQL ANALYZE for inheritance or partition traversal.
\set ON_ERROR_STOP 1
SELECT fasttrun_analyze_bulk('t_inh_stats_flat');
 fasttrun_analyze_bulk 
-----------------------
 
(1 row)

SELECT reltuples = 100::real AS flat_processed FROM fasttrun_relstats('t_inh_stats_flat');
 flat_processed 
----------------
 t
(1 row)

-- Ядерная inherited-стата не спрятана отклонёнными вызовами.
DO $$
DECLARE ln text; est int := NULL;
BEGIN
  FOR ln IN EXPLAIN SELECT x FROM t_inh_stats_parent GROUP BY x LOOP
    IF est IS NULL THEN est := substring(ln FROM 'rows=(\d+)')::int; END IF;
  END LOOP;
  IF est IS NULL OR est > 100 THEN
    RAISE EXCEPTION 'fasttrun hid core inherited stats: est=%', est;
  END IF;
END$$;
SELECT 'inherited_estimate_preserved_ok' AS marker;
             marker              
---------------------------------
 inherited_estimate_preserved_ok
(1 row)

DROP TABLE t_inh_stats_parent CASCADE;
NOTICE:  drop cascades to table t_inh_stats_child
DROP TABLE t_inh_stats_flat;
-- ----------------------------------------------------------------------
-- 43. Expression-индексы: ядро читает статистику выражения из
--     pg_statistic по OID индекса (examine_variable/btcostestimate),
--     мимо column-хуков. После fasttruncate + refill эта каталожная
--     стата описывает старые данные — для managed-таблицы она должна
--     скрываться, планировщик берёт дефолтные оценки до ядерного
--     ANALYZE. Контроль: нетронутая fasttrun'ом таблица читает
--     expression-стату из каталога как обычно.
-- ----------------------------------------------------------------------
CREATE TEMP TABLE t_expr_hidden (id int, name text);
INSERT INTO t_expr_hidden SELECT g, 'val_' || g FROM generate_series(1, 10000) g;
CREATE INDEX ON t_expr_hidden (lower(name));
ANALYZE t_expr_hidden;
SELECT fasttruncate('t_expr_hidden');
 fasttruncate 
--------------
 
(1 row)

INSERT INTO t_expr_hidden SELECT g, 'const' FROM generate_series(1, 10000) g;
SELECT fasttrun_analyze('t_expr_hidden');
 fasttrun_analyze 
------------------
 
(1 row)

DO $$
DECLARE ln text; est int := NULL;
BEGIN
  FOR ln IN EXPLAIN SELECT * FROM t_expr_hidden WHERE lower(name) = 'const' LOOP
    IF ln ~ 'on t_expr_hidden' THEN
      est := substring(ln FROM 'rows=(\d+)')::int;
      EXIT;
    END IF;
  END LOOP;
  IF est IS NULL OR est < 20 OR est > 500 THEN
    RAISE EXCEPTION 'stale expression-index stats escaped: est=% (ожидали дефолтную оценку)', est;
  END IF;
END$$;
SELECT 'expression_stats_hidden_ok' AS marker;
           marker           
----------------------------
 expression_stats_hidden_ok
(1 row)

-- Контроль: chain работает — не-managed таблица читает expression-стату.
CREATE TEMP TABLE t_expr_core (id int, name text);
INSERT INTO t_expr_core
  SELECT g, CASE WHEN g <= 9000 THEN 'dup' ELSE 'val_' || g END
  FROM generate_series(1, 10000) g;
CREATE INDEX ON t_expr_core (lower(name));
ANALYZE t_expr_core;
DO $$
DECLARE ln text; est int := NULL;
BEGIN
  FOR ln IN EXPLAIN SELECT * FROM t_expr_core WHERE lower(name) = 'dup' LOOP
    IF ln ~ 'on t_expr_core' THEN
      est := substring(ln FROM 'rows=(\d+)')::int;
      EXIT;
    END IF;
  END LOOP;
  IF est IS NULL OR est < 5000 THEN
    RAISE EXCEPTION 'core expression stats unreadable for unmanaged table: est=%', est;
  END IF;
END$$;
SELECT 'expression_stats_core_readable_ok' AS marker;
              marker               
-----------------------------------
 expression_stats_core_readable_ok
(1 row)

DROP TABLE t_expr_hidden;
DROP TABLE t_expr_core;
-- ----------------------------------------------------------------------
-- 44. Ёмкость: fasttrun_cache_stats() и fasttrun.max_stats_memory.
--     Сверх бюджета таблица без кешированной column-статы остаётся без
--     неё (WARNING один раз на бэкенд на авто-пути, NOTICE на каждый
--     явный сбор), relation-level relstats продолжают работать.
--     Таблицы с уже собранной статой рефрешатся без проверки бюджета,
--     эвикции нет. 0 (default) — без лимита.
-- ----------------------------------------------------------------------
DISCARD TEMP;
\pset format unaligned
-- Пустые кэши читаются как нули.
SELECT * FROM fasttrun_cache_stats();
analyze_entries|column_stats_relid_entries|column_stats_entries|analyze_bytes|column_stats_bytes|total_bytes
0|0|0|0|0|0
(1 row)
SELECT pg_typeof(analyze_entries) = 'bigint'::regtype AS analyze_entries_bigint,
       pg_typeof(column_stats_relid_entries) = 'bigint'::regtype AS relid_entries_bigint,
       pg_typeof(column_stats_entries) = 'bigint'::regtype AS column_entries_bigint,
       pg_typeof(analyze_bytes) = 'bigint'::regtype AS analyze_bytes_bigint,
       pg_typeof(column_stats_bytes) = 'bigint'::regtype AS column_bytes_bigint,
       pg_typeof(total_bytes) = 'bigint'::regtype AS total_bytes_bigint
FROM fasttrun_cache_stats();
analyze_entries_bigint|relid_entries_bigint|column_entries_bigint|analyze_bytes_bigint|column_bytes_bigint|total_bytes_bigint
t|t|t|t|t|t
(1 row)
-- Узкая таблица A: кэш ещё под бюджетом, стата собирается.
CREATE TEMP TABLE t44_a (id int, name text);
INSERT INTO t44_a SELECT g, 'val_' || g FROM generate_series(1, 10000) g;
SELECT fasttrun_analyze('t44_a');
fasttrun_analyze

(1 row)
SELECT count(*) > 0 AS a_stats_cached FROM fasttrun_inspect_stats('t44_a');
a_stats_cached
t
(1 row)
SELECT analyze_entries, column_stats_relid_entries, column_stats_entries,
       analyze_bytes > 0 AS analyze_bytes_positive,
       column_stats_bytes > 0 AS column_bytes_positive,
       total_bytes = analyze_bytes + column_stats_bytes AS total_is_sum
FROM fasttrun_cache_stats();
analyze_entries|column_stats_relid_entries|column_stats_entries|analyze_bytes_positive|column_bytes_positive|total_is_sum
1|1|2|t|t|t
(1 row)
-- Ровно текущий размер разрешён; первая новая таблица может превысить порог.
CREATE TEMP TABLE t44_budget AS
SELECT column_stats_bytes AS bytes FROM fasttrun_cache_stats();
DO $$
DECLARE bytes bigint;
BEGIN
  SELECT b.bytes INTO bytes FROM t44_budget b;
  IF bytes <= 0 OR bytes % 1024 <> 0 THEN
    RAISE EXCEPTION 'column stats bytes are not an exact kB threshold: %', bytes;
  END IF;
  PERFORM set_config('fasttrun.max_stats_memory',
                     (bytes / 1024)::text || 'kB', false);
END$$;
-- Заполнитель с широкими значениями выводит кеш статистики сверх бюджета.
CREATE TEMP TABLE t44_fill (c1 text, c2 text, c3 text, c4 text);
INSERT INTO t44_fill
  SELECT 'a' || g || repeat('x', 200), 'b' || g || repeat('y', 200),
         'c' || g || repeat('z', 200), 'd' || g || repeat('w', 200)
  FROM generate_series(1, 3000) g;
SELECT fasttrun_analyze('t44_fill');
fasttrun_analyze

(1 row)
SELECT count(*) = 4 AS fill_admitted_at_exact_threshold
FROM fasttrun_inspect_stats('t44_fill');
fill_admitted_at_exact_threshold
t
(1 row)
SELECT column_stats_bytes > (SELECT bytes FROM t44_budget) AS fill_pushed_over_budget,
       total_bytes = analyze_bytes + column_stats_bytes AS total_is_sum
FROM fasttrun_cache_stats();
fill_pushed_over_budget|total_is_sum
t|t
(1 row)
-- B сверх бюджета: WARNING, статистики столбцов нет, relstats живут.
CREATE TEMP TABLE t44_b (id int, name text);
INSERT INTO t44_b SELECT g, 'val_' || g FROM generate_series(1, 10000) g;
SELECT fasttrun_analyze('t44_b');
WARNING:  fasttrun: column statistics cache exceeds fasttrun.max_stats_memory, new tables are left without column statistics
DETAIL:  A table without cached column statistics behaves as with fasttrun.auto_collect_stats = off: relation-level statistics keep working, the planner falls back to default selectivity. Tables that already hold cached column statistics keep refreshing; nothing is evicted.
HINT:  Raise fasttrun.max_stats_memory, or recycle the connection to free the cache. fasttrun_cache_stats() reports the current cache size.
fasttrun_analyze

(1 row)
SELECT count(*) = 0 AS b_stats_absent FROM fasttrun_inspect_stats('t44_b');
b_stats_absent
t
(1 row)
SELECT reltuples::int AS b_reltuples FROM fasttrun_relstats('t44_b');
b_reltuples
10000
(1 row)
-- Статистика A остаётся видимой: уникальный столбец -> rows=1.
DO $$
DECLARE ln text; est int := NULL;
BEGIN
  FOR ln IN EXPLAIN SELECT * FROM t44_a WHERE name = 'val_1' LOOP
    IF ln ~ 'on t44_a' THEN
      est := substring(ln FROM 'rows=(\d+)')::int;
      EXIT;
    END IF;
  END LOOP;
  IF est IS NULL OR est > 3 THEN
    RAISE EXCEPTION 'cached stats of table A lost after budget block: est=%', est;
  END IF;
END$$;
SELECT 'a_stats_still_visible_ok' AS marker;
marker
a_stats_still_visible_ok
(1 row)
-- B без статистики столбцов планируется по исходной селективности (~0.5%).
DO $$
DECLARE ln text; est int := NULL;
BEGIN
  FOR ln IN EXPLAIN SELECT * FROM t44_b WHERE name = 'val_1' LOOP
    IF ln ~ 'on t44_b' THEN
      est := substring(ln FROM 'rows=(\d+)')::int;
      EXIT;
    END IF;
  END LOOP;
  IF est IS NULL OR est < 20 OR est > 500 THEN
    RAISE EXCEPTION 'blocked table B got non-default estimate: est=%', est;
  END IF;
END$$;
SELECT 'b_default_estimate_ok' AS marker;
marker
b_default_estimate_ok
(1 row)
-- Второй заблокированный автосбор: WARNING один на бэкенд, повтора нет.
CREATE TEMP TABLE t44_b2 (id int, name text);
INSERT INTO t44_b2 SELECT g, 'val_' || g FROM generate_series(1, 1000) g;
SELECT fasttrun_analyze('t44_b2');
fasttrun_analyze

(1 row)
SELECT count(*) = 0 AS b2_stats_absent FROM fasttrun_inspect_stats('t44_b2');
b2_stats_absent
t
(1 row)
-- Обновление приращением таблицы вне управления: тоже блокируется,
-- тихо (WARNING уже был).
BEGIN;
SELECT fasttrun_analyze('t44_b');
fasttrun_analyze

(1 row)
INSERT INTO t44_b SELECT g, 'zz_' || g FROM generate_series(1, 5000) g;
SELECT fasttrun_analyze('t44_b');
fasttrun_analyze

(1 row)
COMMIT;
SELECT count(*) = 0 AS b_stats_absent_after_delta_refresh
FROM fasttrun_inspect_stats('t44_b');
b_stats_absent_after_delta_refresh
t
(1 row)
-- Явный сбор сверх бюджета: NOTICE на каждый вызов.
SELECT fasttrun_collect_stats('t44_b');
NOTICE:  fasttrun_collect_stats: column statistics for "t44_b" not cached, cache exceeds fasttrun.max_stats_memory
fasttrun_collect_stats

(1 row)
SELECT fasttrun_collect_stats('t44_b');
NOTICE:  fasttrun_collect_stats: column statistics for "t44_b" not cached, cache exceeds fasttrun.max_stats_memory
fasttrun_collect_stats

(1 row)
SELECT count(*) = 0 AS b_stats_still_absent FROM fasttrun_inspect_stats('t44_b');
b_stats_still_absent
t
(1 row)
-- Управляемая таблица A обновляется сверх порога, бюджет не мешает.
INSERT INTO t44_a SELECT g, 'dup' FROM generate_series(1, 10000) g;
SELECT fasttrun_analyze('t44_a');
fasttrun_analyze

(1 row)
DO $$
DECLARE ln text; est int := NULL;
BEGIN
  FOR ln IN EXPLAIN SELECT * FROM t44_a WHERE name = 'dup' LOOP
    IF ln ~ 'on t44_a' THEN
      est := substring(ln FROM 'rows=(\d+)')::int;
      EXIT;
    END IF;
  END LOOP;
  IF est IS NULL OR est < 5000 THEN
    RAISE EXCEPTION 'budget blocked refresh of managed table A: est=%', est;
  END IF;
END$$;
SELECT 'a_managed_refresh_ok' AS marker;
marker
a_managed_refresh_ok
(1 row)
-- Без лимита новая таблица C собирается несмотря на размер кэша.
RESET fasttrun.max_stats_memory;
CREATE TEMP TABLE t44_c (id int, name text);
INSERT INTO t44_c SELECT g, 'val_' || g FROM generate_series(1, 1000) g;
SELECT fasttrun_analyze('t44_c');
fasttrun_analyze

(1 row)
SELECT count(*) > 0 AS c_stats_cached FROM fasttrun_inspect_stats('t44_c');
c_stats_cached
t
(1 row)
SELECT analyze_entries, column_stats_relid_entries, column_stats_entries,
       analyze_bytes > 0 AS analyze_bytes_positive,
       column_stats_bytes > 0 AS column_bytes_positive,
       total_bytes = analyze_bytes + column_stats_bytes AS total_is_sum
FROM fasttrun_cache_stats();
analyze_entries|column_stats_relid_entries|column_stats_entries|analyze_bytes_positive|column_bytes_positive|total_is_sum
5|5|8|t|t|t
(1 row)
DROP TABLE t44_budget;
DROP TABLE t44_a;
DROP TABLE t44_fill;
DROP TABLE t44_b;
DROP TABLE t44_b2;
DROP TABLE t44_c;
-- ----------------------------------------------------------------------
-- 45. UPDATE непричастной колонки не гасит статистику остальных.
--     pgstat считает tuples_updated по отношению целиком, поэтому без учёта
--     реально записанных колонок обогащающий UPDATE ослеплял планировщик на
--     ключах соединения, которых он не касался.
-- ----------------------------------------------------------------------
CREATE TEMP TABLE t_col_churn (id int, grp int, note text);
INSERT INTO t_col_churn SELECT g, g % 100, 'x' FROM generate_series(1, 100000) g;
BEGIN;
SELECT fasttrun_collect_stats('t_col_churn');
fasttrun_collect_stats

(1 row)
UPDATE t_col_churn SET note = 'y';          -- вся таблица, но колонка id не тронута
DO $$
DECLARE ln text; est int := NULL;
BEGIN
  FOR ln IN EXPLAIN SELECT * FROM t_col_churn WHERE id = 1 LOOP
    IF ln ~ 'on t_col_churn' THEN
      est := substring(ln FROM 'rows=(\d+)')::int;
      EXIT;
    END IF;
  END LOOP;
  IF est IS NULL OR est > 10 THEN
    RAISE EXCEPTION 'UPDATE of another column hid the statistics of id: est=%', est;
  END IF;
END$$;
SELECT 'untouched_column_stats_kept' AS marker;
marker
untouched_column_stats_kept
(1 row)
UPDATE t_col_churn SET id = 1;              -- теперь пишем именно в id
DO $$
DECLARE ln text; est int := NULL;
BEGIN
  FOR ln IN EXPLAIN SELECT * FROM t_col_churn WHERE id = 1 LOOP
    IF ln ~ 'on t_col_churn' THEN
      est := substring(ln FROM 'rows=(\d+)')::int;
      EXIT;
    END IF;
  END LOOP;
  IF est IS NULL OR est < 100 THEN
    RAISE EXCEPTION 'UPDATE of id kept its own statistics: est=%', est;
  END IF;
END$$;
SELECT 'touched_column_stats_hidden' AS marker;
marker
touched_column_stats_hidden
(1 row)
COMMIT;
DROP TABLE t_col_churn;
-- ----------------------------------------------------------------------
-- 46. Маска UPDATE достоверна не всегда, и там где она недостоверна,
--     статистика обязана прятаться, как до появления поколоночного учёта.
--     Общий помощник: оценка строк из EXPLAIN.
-- ----------------------------------------------------------------------
CREATE FUNCTION ft_rows_est(q text, pat text) RETURNS int LANGUAGE plpgsql AS $ft$
DECLARE ln text; est int := NULL;
BEGIN
  FOR ln IN EXECUTE 'EXPLAIN ' || q LOOP
    IF ln ~ pat THEN est := substring(ln FROM 'rows=(\d+)')::int; EXIT; END IF;
  END LOOP;
  RETURN est;
END$ft$;
-- 46a. Откат savepoint возвращает образец прошлого периода сбора. Маска была
--      очищена тем пересбором и о старом образце ничего не знает.
CREATE TEMP TABLE t_seq_rollback (id int, note text);
INSERT INTO t_seq_rollback SELECT g, 'x' FROM generate_series(1, 100000) g;
SELECT fasttrun_collect_stats('t_seq_rollback');
fasttrun_collect_stats

(1 row)
BEGIN;
UPDATE t_seq_rollback SET id = 1;
SAVEPOINT s;
SELECT fasttrun_collect_stats('t_seq_rollback');
fasttrun_collect_stats

(1 row)
ROLLBACK TO s;
UPDATE t_seq_rollback SET note = 'y';
SELECT ft_rows_est('SELECT * FROM t_seq_rollback WHERE id = 1', 'on t_seq_rollback')
       >= 100 AS rollback_sample_not_trusted;
rollback_sample_not_trusted
t
(1 row)
COMMIT;
DROP TABLE t_seq_rollback;
-- 46b. То же через RELEASE вложенного savepoint и откат внешнего.
CREATE TEMP TABLE t_seq_release (id int, note text);
INSERT INTO t_seq_release SELECT g, 'x' FROM generate_series(1, 100000) g;
SELECT fasttrun_collect_stats('t_seq_release');
fasttrun_collect_stats

(1 row)
BEGIN;
-- Повреждающий UPDATE ВНЕ отката: после ROLLBACK TO данные остаются
-- испорченными, а восстановленный образец описывает прежнюю уникальность.
UPDATE t_seq_release SET id = 1;
SAVEPOINT outer_sp;
SAVEPOINT inner_sp;
SELECT fasttrun_collect_stats('t_seq_release');
fasttrun_collect_stats

(1 row)
RELEASE inner_sp;
ROLLBACK TO outer_sp;
UPDATE t_seq_release SET note = 'y';
SELECT ft_rows_est('SELECT * FROM t_seq_release WHERE id = 1', 'on t_seq_release')
       >= 100 AS release_then_rollback_not_trusted;
release_then_rollback_not_trusted
t
(1 row)
COMMIT;
DROP TABLE t_seq_release;
-- 46c. BEFORE UPDATE пишет в колонку, которой нет в списке SET.
CREATE TEMP TABLE t_seq_trigger (id int, note text);
INSERT INTO t_seq_trigger SELECT g, 'x' FROM generate_series(1, 100000) g;
CREATE FUNCTION t_seq_trigger_fn() RETURNS trigger LANGUAGE plpgsql AS $tf$
BEGIN NEW.id := 1; RETURN NEW; END $tf$;
CREATE TRIGGER t_seq_trigger_bu BEFORE UPDATE ON t_seq_trigger
  FOR EACH ROW EXECUTE FUNCTION t_seq_trigger_fn();
SELECT fasttrun_collect_stats('t_seq_trigger');
fasttrun_collect_stats

(1 row)
UPDATE t_seq_trigger SET note = 'y';
SELECT ft_rows_est('SELECT * FROM t_seq_trigger WHERE id = 1', 'on t_seq_trigger')
       >= 100 AS before_trigger_not_trusted;
before_trigger_not_trusted
t
(1 row)
DROP TABLE t_seq_trigger;
DROP FUNCTION t_seq_trigger_fn();
-- 46d. Stored generated column пересчитывается вне списка SET.
CREATE TEMP TABLE t_seq_generated (src int, note text,
                                   gen int GENERATED ALWAYS AS (src) STORED);
INSERT INTO t_seq_generated (src, note) SELECT g, 'x' FROM generate_series(1, 100000) g;
SELECT fasttrun_collect_stats('t_seq_generated');
fasttrun_collect_stats

(1 row)
-- до UPDATE gen уникальна, оценка обязана быть маленькой
SELECT ft_rows_est('SELECT * FROM t_seq_generated WHERE gen = 1', 'on t_seq_generated')
       <= 10 AS generated_column_unique_before;
generated_column_unique_before
t
(1 row)
UPDATE t_seq_generated SET src = 1;
-- gen пересчиталась вне списка SET: все 100 000 строк стали одинаковыми
SELECT ft_rows_est('SELECT * FROM t_seq_generated WHERE gen = 1', 'on t_seq_generated')
       >= 100 AS generated_column_not_trusted;
generated_column_not_trusted
t
(1 row)
DROP TABLE t_seq_generated;
-- 46e. UPDATE наследника через родителя: у child RTE нет своей permission
--      information, поэтому какие колонки пишутся — неизвестно. Первый UPDATE
--      специально оставляет непустую маску, чтобы она не сошла за доказательство.
CREATE TEMP TABLE t_seq_parent (id int, note text);
CREATE TEMP TABLE t_seq_child () INHERITS (t_seq_parent);
INSERT INTO t_seq_child SELECT g, 'x' FROM generate_series(1, 100000) g;
SELECT fasttrun_collect_stats('t_seq_child');
fasttrun_collect_stats

(1 row)
UPDATE ONLY t_seq_child SET note = 'y' WHERE false;
UPDATE t_seq_parent SET id = 1;
SELECT ft_rows_est('SELECT * FROM t_seq_child WHERE id = 1', 'on t_seq_child')
       >= 100 AS inherited_update_not_trusted;
inherited_update_not_trusted
t
(1 row)
DROP TABLE t_seq_child;
DROP TABLE t_seq_parent;
-- 46f. Та же связка, что в 45, но с analyze-baseline: проверяется не только
--      ветка скрытия, но и пороговая арифметика.
CREATE TEMP TABLE t_seq_analyze (id int, grp int, note text);
INSERT INTO t_seq_analyze SELECT g, g % 100, 'x' FROM generate_series(1, 100000) g;
SELECT fasttrun_analyze('t_seq_analyze');
fasttrun_analyze

(1 row)
UPDATE t_seq_analyze SET note = 'y';
SELECT ft_rows_est('SELECT * FROM t_seq_analyze WHERE id = 1', 'on t_seq_analyze')
       <= 10 AS untouched_column_kept_with_baseline;
untouched_column_kept_with_baseline
t
(1 row)
UPDATE t_seq_analyze SET id = 1;
SELECT ft_rows_est('SELECT * FROM t_seq_analyze WHERE id = 1', 'on t_seq_analyze')
       >= 100 AS touched_column_hidden_with_baseline;
touched_column_hidden_with_baseline
t
(1 row)
DROP TABLE t_seq_analyze;
-- 46g. Триггер, созданный ПОСЛЕ пересбора: на момент сбора отношение выглядело
--      безопасным, поэтому флаг достоверности перечитывается на каждом плане.
CREATE TEMP TABLE t_seq_late_trigger (id int, note text);
INSERT INTO t_seq_late_trigger SELECT g, 'x' FROM generate_series(1, 100000) g;
SELECT fasttrun_collect_stats('t_seq_late_trigger');
fasttrun_collect_stats

(1 row)
CREATE FUNCTION t_seq_late_trigger_fn() RETURNS trigger LANGUAGE plpgsql AS $lt$
BEGIN NEW.id := 1; RETURN NEW; END $lt$;
CREATE TRIGGER t_seq_late_trigger_bu BEFORE UPDATE ON t_seq_late_trigger
  FOR EACH ROW EXECUTE FUNCTION t_seq_late_trigger_fn();
UPDATE t_seq_late_trigger SET note = 'y';
SELECT ft_rows_est('SELECT * FROM t_seq_late_trigger WHERE id = 1', 'on t_seq_late_trigger')
       >= 100 AS late_trigger_not_trusted;
late_trigger_not_trusted
t
(1 row)
DROP TABLE t_seq_late_trigger;
DROP FUNCTION t_seq_late_trigger_fn();
-- 46h. Пересбор из выражения уже начатого UPDATE: маска, оставленная этим же
--      оператором, снимается, а дописывать строки он будет уже после выборки.
CREATE TEMP TABLE t_seq_active (id int, note text);
INSERT INTO t_seq_active SELECT g, 'x' FROM generate_series(1, 100000) g;
SELECT fasttrun_collect_stats('t_seq_active');
fasttrun_collect_stats

(1 row)
BEGIN;
UPDATE t_seq_active SET id = (SELECT 1 FROM fasttrun_collect_stats('t_seq_active'));
UPDATE t_seq_active SET note = 'y' WHERE false;
SELECT ft_rows_est('SELECT * FROM t_seq_active WHERE id = 1', 'on t_seq_active')
       >= 100 AS collect_inside_update_not_trusted;
collect_inside_update_not_trusted
t
(1 row)
ROLLBACK;
DROP TABLE t_seq_active;
-- 46i. Позитивная проверка клейма: повторный пересбор без DML между ними
--      переклеймляет все образцы, и UPDATE соседней колонки их не гасит.
CREATE TEMP TABLE t_seq_recollect (id int, note text);
INSERT INTO t_seq_recollect SELECT g, 'x' FROM generate_series(1, 100000) g;
SELECT fasttrun_collect_stats('t_seq_recollect');
fasttrun_collect_stats

(1 row)
SELECT fasttrun_collect_stats('t_seq_recollect');
fasttrun_collect_stats

(1 row)
UPDATE t_seq_recollect SET note = 'y';
SELECT ft_rows_est('SELECT * FROM t_seq_recollect WHERE id = 1', 'on t_seq_recollect')
       <= 10 AS recollected_sample_still_trusted;
recollected_sample_still_trusted
t
(1 row)
DROP TABLE t_seq_recollect;
-- 46j. Пересбор, пропускающий ранее собранную колонку: json берёт только
--      полный сборщик, облегчённому нужен btree-компаратор.
CREATE TEMP TABLE t_seq_skip (id int, j json);
INSERT INTO t_seq_skip SELECT g, '{"a":1}'::json FROM generate_series(1, 100000) g;
BEGIN;
SET LOCAL fasttrun.use_typanalyze = on;
SELECT fasttrun_collect_stats('t_seq_skip');
fasttrun_collect_stats

(1 row)
UPDATE t_seq_skip SET j = NULL;
SET LOCAL fasttrun.use_typanalyze = off;
SELECT fasttrun_collect_stats('t_seq_skip');
fasttrun_collect_stats

(1 row)
UPDATE t_seq_skip SET id = id;
SELECT ft_rows_est('SELECT * FROM t_seq_skip WHERE j IS NULL', 'on t_seq_skip')
       >= 100 AS skipped_column_not_trusted;
skipped_column_not_trusted
t
(1 row)
COMMIT;
DROP TABLE t_seq_skip;
-- 46k. Пороговая арифметика: у почти уникальной колонки допуск 5%, поэтому
--      UPDATE на 2% статистику сохраняет, а накопленный сверх порога — гасит.
CREATE TEMP TABLE t_seq_threshold (id int, note text);
INSERT INTO t_seq_threshold SELECT g, 'x' FROM generate_series(1, 100000) g;
SELECT fasttrun_analyze('t_seq_threshold');
fasttrun_analyze

(1 row)
UPDATE t_seq_threshold SET id = id WHERE id <= 2000;
SELECT ft_rows_est('SELECT * FROM t_seq_threshold WHERE id = 1', 'on t_seq_threshold')
       <= 10 AS below_threshold_kept;
below_threshold_kept
t
(1 row)
UPDATE t_seq_threshold SET id = id WHERE id <= 30000;
SELECT ft_rows_est('SELECT * FROM t_seq_threshold WHERE id = 1', 'on t_seq_threshold')
       >= 100 AS above_threshold_hidden;
above_threshold_hidden
t
(1 row)
DROP TABLE t_seq_threshold;
-- 46l. Два пересбора внутри одного действующего UPDATE. Каждый снимает маску,
--      оставленную этим же оператором, а строки он допишет уже после выборки.
CREATE TEMP TABLE t_seq_two_collects (id int, note text);
INSERT INTO t_seq_two_collects SELECT g, 'x' FROM generate_series(1, 100000) g;
SELECT fasttrun_collect_stats('t_seq_two_collects');
fasttrun_collect_stats

(1 row)
BEGIN;
UPDATE t_seq_two_collects SET id = (SELECT 1 FROM fasttrun_collect_stats('t_seq_two_collects'))
  WHERE (SELECT true FROM fasttrun_collect_stats('t_seq_two_collects'));
UPDATE t_seq_two_collects SET note = 'y' WHERE false;
SELECT ft_rows_est('SELECT * FROM t_seq_two_collects WHERE id = 1', 'on t_seq_two_collects')
       >= 100 AS two_collects_inside_update_not_trusted;
two_collects_inside_update_not_trusted
t
(1 row)
ROLLBACK;
DROP TABLE t_seq_two_collects;
-- 46m. Первый пересбор отношения, за которым расширение ещё не следит, изнутри
--      действующего UPDATE. Учёт начатых операторов ведётся и для таких
--      отношений, иначе самый первый образец сходит за достоверный.
CREATE TEMP TABLE t_seq_first_collect (id int, note text);
INSERT INTO t_seq_first_collect SELECT g, 'x' FROM generate_series(1, 100000) g;
BEGIN;
UPDATE t_seq_first_collect SET id = (SELECT 1 FROM fasttrun_collect_stats('t_seq_first_collect'));
UPDATE t_seq_first_collect SET note = 'y' WHERE false;
SELECT ft_rows_est('SELECT * FROM t_seq_first_collect WHERE id = 1', 'on t_seq_first_collect')
       >= 100 AS first_collect_inside_update_not_trusted;
first_collect_inside_update_not_trusted
t
(1 row)
ROLLBACK;
DROP TABLE t_seq_first_collect;
-- 46n. Пересбор наследника изнутри UPDATE через родителя: цель оператора —
--      таблица-наследник, и её начатый UPDATE обязан считаться так же.
CREATE TEMP TABLE t_seq_inh_parent (id int, note text);
CREATE TEMP TABLE t_seq_inh_child () INHERITS (t_seq_inh_parent);
INSERT INTO t_seq_inh_child SELECT g, 'x' FROM generate_series(1, 100000) g;
SELECT fasttrun_collect_stats('t_seq_inh_child');
fasttrun_collect_stats

(1 row)
BEGIN;
UPDATE t_seq_inh_parent SET id = (SELECT 1 FROM fasttrun_collect_stats('t_seq_inh_child'));
UPDATE ONLY t_seq_inh_child SET note = 'y' WHERE false;
SELECT ft_rows_est('SELECT * FROM t_seq_inh_child WHERE id = 1', 'on t_seq_inh_child')
       >= 100 AS collect_inside_inherited_update_not_trusted;
collect_inside_inherited_update_not_trusted
t
(1 row)
ROLLBACK;
DROP TABLE t_seq_inh_child;
DROP TABLE t_seq_inh_parent;
-- 46o. Поздний триггер и завершённая транзакция. Признак снимает сам оператор
--      CREATE TRIGGER, заблаговременно: после COMMIT счётчиков уже нет, и
--      доказать по ним ничего нельзя.
CREATE TEMP TABLE t_seq_commit_trigger (id int, note text);
INSERT INTO t_seq_commit_trigger SELECT g, 'x' FROM generate_series(1, 100000) g;
SELECT fasttrun_analyze('t_seq_commit_trigger');
fasttrun_analyze

(1 row)
CREATE FUNCTION t_seq_commit_trigger_fn() RETURNS trigger LANGUAGE plpgsql AS $ct$
BEGIN NEW.id := 1; RETURN NEW; END $ct$;
CREATE TRIGGER t_seq_commit_trigger_bu BEFORE UPDATE ON t_seq_commit_trigger
  FOR EACH ROW EXECUTE FUNCTION t_seq_commit_trigger_fn();
BEGIN;
UPDATE t_seq_commit_trigger SET note = 'y';
COMMIT;
SELECT ft_rows_est('SELECT * FROM t_seq_commit_trigger WHERE id = 1', 'on t_seq_commit_trigger')
       >= 100 AS late_trigger_after_commit_not_trusted;
late_trigger_after_commit_not_trusted
t
(1 row)
DROP TABLE t_seq_commit_trigger;
DROP FUNCTION t_seq_commit_trigger_fn();
-- 46p. Рабочий цикл целиком, три раза подряд: учёт начатых операторов не должен
--      отбирать выигрыш у обычной последовательности «очистка — набор — анализ —
--      UPDATE служебной колонки — запрос по ключу».
CREATE TEMP TABLE t_seq_cycle (id int, grp int, f_units int, note text);
DO $cy$
DECLARE i int; est int;
BEGIN
  FOR i IN 1..3 LOOP
    PERFORM fasttruncate('t_seq_cycle');
    INSERT INTO t_seq_cycle SELECT g, g % 100, 0, repeat('x', 40)
      FROM generate_series(1, 100000) g;
    PERFORM fasttrun_analyze('t_seq_cycle');
    UPDATE t_seq_cycle SET f_units = 7;
    est := ft_rows_est('SELECT * FROM t_seq_cycle WHERE id = 1', 'on t_seq_cycle');
    IF est > 10 THEN
      RAISE EXCEPTION 'цикл %: оценка % вместо единиц', i, est;
    END IF;
  END LOOP;
  RAISE NOTICE 'work cycle estimate survived three rounds';
END$cy$;
NOTICE:  work cycle estimate survived three rounds
DROP TABLE t_seq_cycle;
-- 46q. Маска столбцов лежит в собственном контексте расширения и переживает
--      транзакцию. Отношение, покидающее кэш, обязано её освобождать: иначе
--      каждый рабочий цикл оставляет за собой битовую карту, а у длинного
--      сеанса таких циклов много. Вторая собранная таблица держит контекст,
--      чтобы измерялся рост, а не создание контекста заново.
CREATE TEMP TABLE t_seq_mask_anchor (id int);
INSERT INTO t_seq_mask_anchor SELECT g FROM generate_series(1, 1000) g;
SELECT fasttrun_collect_stats('t_seq_mask_anchor') IS NOT NULL AS mask_anchor_collected;
mask_anchor_collected
t
(1 row)
SELECT 'CREATE TEMP TABLE t_seq_mask_wide (' || string_agg(format('c%s int', i), ', ') || ')'
  FROM generate_series(1, 1600) i \gexec
CREATE TEMP TABLE t_seq_mask_wide (c1 int, c2 int, c3 int, c4 int, c5 int, c6 int, c7 int, c8 int, c9 int, c10 int, c11 int, c12 int, c13 int, c14 int, c15 int, c16 int, c17 int, c18 int, c19 int, c20 int, c21 int, c22 int, c23 int, c24 int, c25 int, c26 int, c27 int, c28 int, c29 int, c30 int, c31 int, c32 int, c33 int, c34 int, c35 int, c36 int, c37 int, c38 int, c39 int, c40 int, c41 int, c42 int, c43 int, c44 int, c45 int, c46 int, c47 int, c48 int, c49 int, c50 int, c51 int, c52 int, c53 int, c54 int, c55 int, c56 int, c57 int, c58 int, c59 int, c60 int, c61 int, c62 int, c63 int, c64 int, c65 int, c66 int, c67 int, c68 int, c69 int, c70 int, c71 int, c72 int, c73 int, c74 int, c75 int, c76 int, c77 int, c78 int, c79 int, c80 int, c81 int, c82 int, c83 int, c84 int, c85 int, c86 int, c87 int, c88 int, c89 int, c90 int, c91 int, c92 int, c93 int, c94 int, c95 int, c96 int, c97 int, c98 int, c99 int, c100 int, c101 int, c102 int, c103 int, c104 int, c105 int, c106 int, c107 int, c108 int, c109 int, c110 int, c111 int, c112 int, c113 int, c114 int, c115 int, c116 int, c117 int, c118 int, c119 int, c120 int, c121 int, c122 int, c123 int, c124 int, c125 int, c126 int, c127 int, c128 int, c129 int, c130 int, c131 int, c132 int, c133 int, c134 int, c135 int, c136 int, c137 int, c138 int, c139 int, c140 int, c141 int, c142 int, c143 int, c144 int, c145 int, c146 int, c147 int, c148 int, c149 int, c150 int, c151 int, c152 int, c153 int, c154 int, c155 int, c156 int, c157 int, c158 int, c159 int, c160 int, c161 int, c162 int, c163 int, c164 int, c165 int, c166 int, c167 int, c168 int, c169 int, c170 int, c171 int, c172 int, c173 int, c174 int, c175 int, c176 int, c177 int, c178 int, c179 int, c180 int, c181 int, c182 int, c183 int, c184 int, c185 int, c186 int, c187 int, c188 int, c189 int, c190 int, c191 int, c192 int, c193 int, c194 int, c195 int, c196 int, c197 int, c198 int, c199 int, c200 int, c201 int, c202 int, c203 int, c204 int, c205 int, c206 int, c207 int, c208 int, c209 int, c210 int, c211 int, c212 int, c213 int, c214 int, c215 int, c216 int, c217 int, c218 int, c219 int, c220 int, c221 int, c222 int, c223 int, c224 int, c225 int, c226 int, c227 int, c228 int, c229 int, c230 int, c231 int, c232 int, c233 int, c234 int, c235 int, c236 int, c237 int, c238 int, c239 int, c240 int, c241 int, c242 int, c243 int, c244 int, c245 int, c246 int, c247 int, c248 int, c249 int, c250 int, c251 int, c252 int, c253 int, c254 int, c255 int, c256 int, c257 int, c258 int, c259 int, c260 int, c261 int, c262 int, c263 int, c264 int, c265 int, c266 int, c267 int, c268 int, c269 int, c270 int, c271 int, c272 int, c273 int, c274 int, c275 int, c276 int, c277 int, c278 int, c279 int, c280 int, c281 int, c282 int, c283 int, c284 int, c285 int, c286 int, c287 int, c288 int, c289 int, c290 int, c291 int, c292 int, c293 int, c294 int, c295 int, c296 int, c297 int, c298 int, c299 int, c300 int, c301 int, c302 int, c303 int, c304 int, c305 int, c306 int, c307 int, c308 int, c309 int, c310 int, c311 int, c312 int, c313 int, c314 int, c315 int, c316 int, c317 int, c318 int, c319 int, c320 int, c321 int, c322 int, c323 int, c324 int, c325 int, c326 int, c327 int, c328 int, c329 int, c330 int, c331 int, c332 int, c333 int, c334 int, c335 int, c336 int, c337 int, c338 int, c339 int, c340 int, c341 int, c342 int, c343 int, c344 int, c345 int, c346 int, c347 int, c348 int, c349 int, c350 int, c351 int, c352 int, c353 int, c354 int, c355 int, c356 int, c357 int, c358 int, c359 int, c360 int, c361 int, c362 int, c363 int, c364 int, c365 int, c366 int, c367 int, c368 int, c369 int, c370 int, c371 int, c372 int, c373 int, c374 int, c375 int, c376 int, c377 int, c378 int, c379 int, c380 int, c381 int, c382 int, c383 int, c384 int, c385 int, c386 int, c387 int, c388 int, c389 int, c390 int, c391 int, c392 int, c393 int, c394 int, c395 int, c396 int, c397 int, c398 int, c399 int, c400 int, c401 int, c402 int, c403 int, c404 int, c405 int, c406 int, c407 int, c408 int, c409 int, c410 int, c411 int, c412 int, c413 int, c414 int, c415 int, c416 int, c417 int, c418 int, c419 int, c420 int, c421 int, c422 int, c423 int, c424 int, c425 int, c426 int, c427 int, c428 int, c429 int, c430 int, c431 int, c432 int, c433 int, c434 int, c435 int, c436 int, c437 int, c438 int, c439 int, c440 int, c441 int, c442 int, c443 int, c444 int, c445 int, c446 int, c447 int, c448 int, c449 int, c450 int, c451 int, c452 int, c453 int, c454 int, c455 int, c456 int, c457 int, c458 int, c459 int, c460 int, c461 int, c462 int, c463 int, c464 int, c465 int, c466 int, c467 int, c468 int, c469 int, c470 int, c471 int, c472 int, c473 int, c474 int, c475 int, c476 int, c477 int, c478 int, c479 int, c480 int, c481 int, c482 int, c483 int, c484 int, c485 int, c486 int, c487 int, c488 int, c489 int, c490 int, c491 int, c492 int, c493 int, c494 int, c495 int, c496 int, c497 int, c498 int, c499 int, c500 int, c501 int, c502 int, c503 int, c504 int, c505 int, c506 int, c507 int, c508 int, c509 int, c510 int, c511 int, c512 int, c513 int, c514 int, c515 int, c516 int, c517 int, c518 int, c519 int, c520 int, c521 int, c522 int, c523 int, c524 int, c525 int, c526 int, c527 int, c528 int, c529 int, c530 int, c531 int, c532 int, c533 int, c534 int, c535 int, c536 int, c537 int, c538 int, c539 int, c540 int, c541 int, c542 int, c543 int, c544 int, c545 int, c546 int, c547 int, c548 int, c549 int, c550 int, c551 int, c552 int, c553 int, c554 int, c555 int, c556 int, c557 int, c558 int, c559 int, c560 int, c561 int, c562 int, c563 int, c564 int, c565 int, c566 int, c567 int, c568 int, c569 int, c570 int, c571 int, c572 int, c573 int, c574 int, c575 int, c576 int, c577 int, c578 int, c579 int, c580 int, c581 int, c582 int, c583 int, c584 int, c585 int, c586 int, c587 int, c588 int, c589 int, c590 int, c591 int, c592 int, c593 int, c594 int, c595 int, c596 int, c597 int, c598 int, c599 int, c600 int, c601 int, c602 int, c603 int, c604 int, c605 int, c606 int, c607 int, c608 int, c609 int, c610 int, c611 int, c612 int, c613 int, c614 int, c615 int, c616 int, c617 int, c618 int, c619 int, c620 int, c621 int, c622 int, c623 int, c624 int, c625 int, c626 int, c627 int, c628 int, c629 int, c630 int, c631 int, c632 int, c633 int, c634 int, c635 int, c636 int, c637 int, c638 int, c639 int, c640 int, c641 int, c642 int, c643 int, c644 int, c645 int, c646 int, c647 int, c648 int, c649 int, c650 int, c651 int, c652 int, c653 int, c654 int, c655 int, c656 int, c657 int, c658 int, c659 int, c660 int, c661 int, c662 int, c663 int, c664 int, c665 int, c666 int, c667 int, c668 int, c669 int, c670 int, c671 int, c672 int, c673 int, c674 int, c675 int, c676 int, c677 int, c678 int, c679 int, c680 int, c681 int, c682 int, c683 int, c684 int, c685 int, c686 int, c687 int, c688 int, c689 int, c690 int, c691 int, c692 int, c693 int, c694 int, c695 int, c696 int, c697 int, c698 int, c699 int, c700 int, c701 int, c702 int, c703 int, c704 int, c705 int, c706 int, c707 int, c708 int, c709 int, c710 int, c711 int, c712 int, c713 int, c714 int, c715 int, c716 int, c717 int, c718 int, c719 int, c720 int, c721 int, c722 int, c723 int, c724 int, c725 int, c726 int, c727 int, c728 int, c729 int, c730 int, c731 int, c732 int, c733 int, c734 int, c735 int, c736 int, c737 int, c738 int, c739 int, c740 int, c741 int, c742 int, c743 int, c744 int, c745 int, c746 int, c747 int, c748 int, c749 int, c750 int, c751 int, c752 int, c753 int, c754 int, c755 int, c756 int, c757 int, c758 int, c759 int, c760 int, c761 int, c762 int, c763 int, c764 int, c765 int, c766 int, c767 int, c768 int, c769 int, c770 int, c771 int, c772 int, c773 int, c774 int, c775 int, c776 int, c777 int, c778 int, c779 int, c780 int, c781 int, c782 int, c783 int, c784 int, c785 int, c786 int, c787 int, c788 int, c789 int, c790 int, c791 int, c792 int, c793 int, c794 int, c795 int, c796 int, c797 int, c798 int, c799 int, c800 int, c801 int, c802 int, c803 int, c804 int, c805 int, c806 int, c807 int, c808 int, c809 int, c810 int, c811 int, c812 int, c813 int, c814 int, c815 int, c816 int, c817 int, c818 int, c819 int, c820 int, c821 int, c822 int, c823 int, c824 int, c825 int, c826 int, c827 int, c828 int, c829 int, c830 int, c831 int, c832 int, c833 int, c834 int, c835 int, c836 int, c837 int, c838 int, c839 int, c840 int, c841 int, c842 int, c843 int, c844 int, c845 int, c846 int, c847 int, c848 int, c849 int, c850 int, c851 int, c852 int, c853 int, c854 int, c855 int, c856 int, c857 int, c858 int, c859 int, c860 int, c861 int, c862 int, c863 int, c864 int, c865 int, c866 int, c867 int, c868 int, c869 int, c870 int, c871 int, c872 int, c873 int, c874 int, c875 int, c876 int, c877 int, c878 int, c879 int, c880 int, c881 int, c882 int, c883 int, c884 int, c885 int, c886 int, c887 int, c888 int, c889 int, c890 int, c891 int, c892 int, c893 int, c894 int, c895 int, c896 int, c897 int, c898 int, c899 int, c900 int, c901 int, c902 int, c903 int, c904 int, c905 int, c906 int, c907 int, c908 int, c909 int, c910 int, c911 int, c912 int, c913 int, c914 int, c915 int, c916 int, c917 int, c918 int, c919 int, c920 int, c921 int, c922 int, c923 int, c924 int, c925 int, c926 int, c927 int, c928 int, c929 int, c930 int, c931 int, c932 int, c933 int, c934 int, c935 int, c936 int, c937 int, c938 int, c939 int, c940 int, c941 int, c942 int, c943 int, c944 int, c945 int, c946 int, c947 int, c948 int, c949 int, c950 int, c951 int, c952 int, c953 int, c954 int, c955 int, c956 int, c957 int, c958 int, c959 int, c960 int, c961 int, c962 int, c963 int, c964 int, c965 int, c966 int, c967 int, c968 int, c969 int, c970 int, c971 int, c972 int, c973 int, c974 int, c975 int, c976 int, c977 int, c978 int, c979 int, c980 int, c981 int, c982 int, c983 int, c984 int, c985 int, c986 int, c987 int, c988 int, c989 int, c990 int, c991 int, c992 int, c993 int, c994 int, c995 int, c996 int, c997 int, c998 int, c999 int, c1000 int, c1001 int, c1002 int, c1003 int, c1004 int, c1005 int, c1006 int, c1007 int, c1008 int, c1009 int, c1010 int, c1011 int, c1012 int, c1013 int, c1014 int, c1015 int, c1016 int, c1017 int, c1018 int, c1019 int, c1020 int, c1021 int, c1022 int, c1023 int, c1024 int, c1025 int, c1026 int, c1027 int, c1028 int, c1029 int, c1030 int, c1031 int, c1032 int, c1033 int, c1034 int, c1035 int, c1036 int, c1037 int, c1038 int, c1039 int, c1040 int, c1041 int, c1042 int, c1043 int, c1044 int, c1045 int, c1046 int, c1047 int, c1048 int, c1049 int, c1050 int, c1051 int, c1052 int, c1053 int, c1054 int, c1055 int, c1056 int, c1057 int, c1058 int, c1059 int, c1060 int, c1061 int, c1062 int, c1063 int, c1064 int, c1065 int, c1066 int, c1067 int, c1068 int, c1069 int, c1070 int, c1071 int, c1072 int, c1073 int, c1074 int, c1075 int, c1076 int, c1077 int, c1078 int, c1079 int, c1080 int, c1081 int, c1082 int, c1083 int, c1084 int, c1085 int, c1086 int, c1087 int, c1088 int, c1089 int, c1090 int, c1091 int, c1092 int, c1093 int, c1094 int, c1095 int, c1096 int, c1097 int, c1098 int, c1099 int, c1100 int, c1101 int, c1102 int, c1103 int, c1104 int, c1105 int, c1106 int, c1107 int, c1108 int, c1109 int, c1110 int, c1111 int, c1112 int, c1113 int, c1114 int, c1115 int, c1116 int, c1117 int, c1118 int, c1119 int, c1120 int, c1121 int, c1122 int, c1123 int, c1124 int, c1125 int, c1126 int, c1127 int, c1128 int, c1129 int, c1130 int, c1131 int, c1132 int, c1133 int, c1134 int, c1135 int, c1136 int, c1137 int, c1138 int, c1139 int, c1140 int, c1141 int, c1142 int, c1143 int, c1144 int, c1145 int, c1146 int, c1147 int, c1148 int, c1149 int, c1150 int, c1151 int, c1152 int, c1153 int, c1154 int, c1155 int, c1156 int, c1157 int, c1158 int, c1159 int, c1160 int, c1161 int, c1162 int, c1163 int, c1164 int, c1165 int, c1166 int, c1167 int, c1168 int, c1169 int, c1170 int, c1171 int, c1172 int, c1173 int, c1174 int, c1175 int, c1176 int, c1177 int, c1178 int, c1179 int, c1180 int, c1181 int, c1182 int, c1183 int, c1184 int, c1185 int, c1186 int, c1187 int, c1188 int, c1189 int, c1190 int, c1191 int, c1192 int, c1193 int, c1194 int, c1195 int, c1196 int, c1197 int, c1198 int, c1199 int, c1200 int, c1201 int, c1202 int, c1203 int, c1204 int, c1205 int, c1206 int, c1207 int, c1208 int, c1209 int, c1210 int, c1211 int, c1212 int, c1213 int, c1214 int, c1215 int, c1216 int, c1217 int, c1218 int, c1219 int, c1220 int, c1221 int, c1222 int, c1223 int, c1224 int, c1225 int, c1226 int, c1227 int, c1228 int, c1229 int, c1230 int, c1231 int, c1232 int, c1233 int, c1234 int, c1235 int, c1236 int, c1237 int, c1238 int, c1239 int, c1240 int, c1241 int, c1242 int, c1243 int, c1244 int, c1245 int, c1246 int, c1247 int, c1248 int, c1249 int, c1250 int, c1251 int, c1252 int, c1253 int, c1254 int, c1255 int, c1256 int, c1257 int, c1258 int, c1259 int, c1260 int, c1261 int, c1262 int, c1263 int, c1264 int, c1265 int, c1266 int, c1267 int, c1268 int, c1269 int, c1270 int, c1271 int, c1272 int, c1273 int, c1274 int, c1275 int, c1276 int, c1277 int, c1278 int, c1279 int, c1280 int, c1281 int, c1282 int, c1283 int, c1284 int, c1285 int, c1286 int, c1287 int, c1288 int, c1289 int, c1290 int, c1291 int, c1292 int, c1293 int, c1294 int, c1295 int, c1296 int, c1297 int, c1298 int, c1299 int, c1300 int, c1301 int, c1302 int, c1303 int, c1304 int, c1305 int, c1306 int, c1307 int, c1308 int, c1309 int, c1310 int, c1311 int, c1312 int, c1313 int, c1314 int, c1315 int, c1316 int, c1317 int, c1318 int, c1319 int, c1320 int, c1321 int, c1322 int, c1323 int, c1324 int, c1325 int, c1326 int, c1327 int, c1328 int, c1329 int, c1330 int, c1331 int, c1332 int, c1333 int, c1334 int, c1335 int, c1336 int, c1337 int, c1338 int, c1339 int, c1340 int, c1341 int, c1342 int, c1343 int, c1344 int, c1345 int, c1346 int, c1347 int, c1348 int, c1349 int, c1350 int, c1351 int, c1352 int, c1353 int, c1354 int, c1355 int, c1356 int, c1357 int, c1358 int, c1359 int, c1360 int, c1361 int, c1362 int, c1363 int, c1364 int, c1365 int, c1366 int, c1367 int, c1368 int, c1369 int, c1370 int, c1371 int, c1372 int, c1373 int, c1374 int, c1375 int, c1376 int, c1377 int, c1378 int, c1379 int, c1380 int, c1381 int, c1382 int, c1383 int, c1384 int, c1385 int, c1386 int, c1387 int, c1388 int, c1389 int, c1390 int, c1391 int, c1392 int, c1393 int, c1394 int, c1395 int, c1396 int, c1397 int, c1398 int, c1399 int, c1400 int, c1401 int, c1402 int, c1403 int, c1404 int, c1405 int, c1406 int, c1407 int, c1408 int, c1409 int, c1410 int, c1411 int, c1412 int, c1413 int, c1414 int, c1415 int, c1416 int, c1417 int, c1418 int, c1419 int, c1420 int, c1421 int, c1422 int, c1423 int, c1424 int, c1425 int, c1426 int, c1427 int, c1428 int, c1429 int, c1430 int, c1431 int, c1432 int, c1433 int, c1434 int, c1435 int, c1436 int, c1437 int, c1438 int, c1439 int, c1440 int, c1441 int, c1442 int, c1443 int, c1444 int, c1445 int, c1446 int, c1447 int, c1448 int, c1449 int, c1450 int, c1451 int, c1452 int, c1453 int, c1454 int, c1455 int, c1456 int, c1457 int, c1458 int, c1459 int, c1460 int, c1461 int, c1462 int, c1463 int, c1464 int, c1465 int, c1466 int, c1467 int, c1468 int, c1469 int, c1470 int, c1471 int, c1472 int, c1473 int, c1474 int, c1475 int, c1476 int, c1477 int, c1478 int, c1479 int, c1480 int, c1481 int, c1482 int, c1483 int, c1484 int, c1485 int, c1486 int, c1487 int, c1488 int, c1489 int, c1490 int, c1491 int, c1492 int, c1493 int, c1494 int, c1495 int, c1496 int, c1497 int, c1498 int, c1499 int, c1500 int, c1501 int, c1502 int, c1503 int, c1504 int, c1505 int, c1506 int, c1507 int, c1508 int, c1509 int, c1510 int, c1511 int, c1512 int, c1513 int, c1514 int, c1515 int, c1516 int, c1517 int, c1518 int, c1519 int, c1520 int, c1521 int, c1522 int, c1523 int, c1524 int, c1525 int, c1526 int, c1527 int, c1528 int, c1529 int, c1530 int, c1531 int, c1532 int, c1533 int, c1534 int, c1535 int, c1536 int, c1537 int, c1538 int, c1539 int, c1540 int, c1541 int, c1542 int, c1543 int, c1544 int, c1545 int, c1546 int, c1547 int, c1548 int, c1549 int, c1550 int, c1551 int, c1552 int, c1553 int, c1554 int, c1555 int, c1556 int, c1557 int, c1558 int, c1559 int, c1560 int, c1561 int, c1562 int, c1563 int, c1564 int, c1565 int, c1566 int, c1567 int, c1568 int, c1569 int, c1570 int, c1571 int, c1572 int, c1573 int, c1574 int, c1575 int, c1576 int, c1577 int, c1578 int, c1579 int, c1580 int, c1581 int, c1582 int, c1583 int, c1584 int, c1585 int, c1586 int, c1587 int, c1588 int, c1589 int, c1590 int, c1591 int, c1592 int, c1593 int, c1594 int, c1595 int, c1596 int, c1597 int, c1598 int, c1599 int, c1600 int)
INSERT INTO t_seq_mask_wide (c1, c1600) SELECT g, g FROM generate_series(1, 10) g;
-- один прогревающий цикл: дальше размер контекста уже установившийся
SELECT fasttrun_collect_stats('t_seq_mask_wide') IS NOT NULL AS mask_wide_collected;
mask_wide_collected
t
(1 row)
UPDATE t_seq_mask_wide SET c1600 = 1 WHERE false;
ANALYZE t_seq_mask_wide;
SELECT sum(used_bytes) AS mask_bytes_before FROM pg_backend_memory_contexts
 WHERE name = 'fasttrun stats cache' \gset
/* отношение покидает кэш только на COMMIT: до него передача ядру лишь меняет
   правило, а запись остаётся на месте, и маску снял бы очередной пересбор */
CREATE PROCEDURE t_seq_mask_cycles(n int) LANGUAGE plpgsql AS $mk$
DECLARE i int;
BEGIN
  FOR i IN 1..n LOOP
    PERFORM fasttrun_collect_stats('t_seq_mask_wide');
    UPDATE t_seq_mask_wide SET c1600 = 1 WHERE false;
    ANALYZE t_seq_mask_wide;
    COMMIT;
  END LOOP;
END$mk$;
CALL t_seq_mask_cycles(128);
-- потерянная маска колонки 1600 весит 264 байта, 128 циклов дали бы 33 КиБ
SELECT sum(used_bytes) - :mask_bytes_before < 8192 AS mask_freed_when_relation_leaves_cache
  FROM pg_backend_memory_contexts WHERE name = 'fasttrun stats cache';
mask_freed_when_relation_leaves_cache
t
(1 row)
DROP PROCEDURE t_seq_mask_cycles(int);
DROP TABLE t_seq_mask_wide;
DROP TABLE t_seq_mask_anchor;
-- 46r. Порог у почти уникальной колонки — ровно 5% строк, и доля считается
--      накопленно от последнего пересбора, а не по одному оператору.
--      Счётчики привязаны к транзакции, поэтому накопление живёт внутри неё.
CREATE TEMP TABLE t_seq_edge (id int, note text);
INSERT INTO t_seq_edge SELECT g, 'x' FROM generate_series(1, 100000) g;
SELECT fasttrun_analyze('t_seq_edge');
fasttrun_analyze

(1 row)
BEGIN;
UPDATE t_seq_edge SET id = id WHERE id <= 4900;
SELECT ft_rows_est('SELECT * FROM t_seq_edge WHERE id = 1', 'on t_seq_edge')
       <= 10 AS just_below_threshold_kept;
just_below_threshold_kept
t
(1 row)
UPDATE t_seq_edge SET id = id WHERE id > 4900 AND id <= 5000;
SELECT ft_rows_est('SELECT * FROM t_seq_edge WHERE id = 1', 'on t_seq_edge')
       >= 100 AS exactly_at_threshold_hidden;
exactly_at_threshold_hidden
t
(1 row)
UPDATE t_seq_edge SET id = id WHERE id > 5000 AND id <= 5100;
SELECT ft_rows_est('SELECT * FROM t_seq_edge WHERE id = 1', 'on t_seq_edge')
       >= 100 AS just_above_threshold_hidden;
just_above_threshold_hidden
t
(1 row)
COMMIT;
DROP TABLE t_seq_edge;
-- 46s. INSERT ... ON CONFLICT DO UPDATE — отдельный вход в учёт колонок:
--      названная в DO UPDATE гаснет, соседняя обязана уцелеть.
CREATE TEMP TABLE t_seq_upsert (id int PRIMARY KEY, grp int, note text);
INSERT INTO t_seq_upsert SELECT g, g % 10, 'x' FROM generate_series(1, 100000) g;
SELECT fasttrun_analyze('t_seq_upsert');
fasttrun_analyze

(1 row)
INSERT INTO t_seq_upsert SELECT g, 1, 'z' FROM generate_series(1, 100000) g
  ON CONFLICT (id) DO UPDATE SET grp = excluded.grp;
SELECT ft_rows_est('SELECT * FROM t_seq_upsert WHERE grp = 1', 'on t_seq_upsert')
       <= 2000 AS upsert_named_column_hidden;
upsert_named_column_hidden
t
(1 row)
SELECT ft_rows_est('SELECT * FROM t_seq_upsert WHERE note = ''x''', 'on t_seq_upsert')
       >= 100000 AS upsert_other_column_kept;
upsert_other_column_kept
t
(1 row)
DROP TABLE t_seq_upsert;
-- 46t. MERGE ... WHEN MATCHED THEN UPDATE — такой же отдельный вход.
CREATE TEMP TABLE t_seq_merge (id int, grp int, note text);
INSERT INTO t_seq_merge SELECT g, g % 10, 'x' FROM generate_series(1, 100000) g;
SELECT fasttrun_analyze('t_seq_merge');
fasttrun_analyze

(1 row)
CREATE TEMP TABLE t_seq_merge_src (id int);
INSERT INTO t_seq_merge_src SELECT g FROM generate_series(1, 100000) g;
SELECT ft_rows_est('SELECT * FROM t_seq_merge WHERE grp = 1', 'on t_seq_merge')
       >= 5000 AS merge_named_column_before;
merge_named_column_before
t
(1 row)
MERGE INTO t_seq_merge USING t_seq_merge_src s ON t_seq_merge.id = s.id
  WHEN MATCHED THEN UPDATE SET grp = 1;
SELECT ft_rows_est('SELECT * FROM t_seq_merge WHERE grp = 1', 'on t_seq_merge')
       <= 2000 AS merge_named_column_hidden;
merge_named_column_hidden
t
(1 row)
DROP TABLE t_seq_merge;
DROP TABLE t_seq_merge_src;
-- 46u. Доверие к списку колонок снимается и в планировщике. Откат убирает сам
--      триггер, но доверие не возвращает: потеря идёт в безопасную сторону и
--      держится только до следующего пересбора.
CREATE TEMP TABLE t_seq_plan_clear (id int, note text);
INSERT INTO t_seq_plan_clear SELECT g, 'x' FROM generate_series(1, 100000) g;
SELECT fasttrun_collect_stats('t_seq_plan_clear');
fasttrun_collect_stats

(1 row)
CREATE FUNCTION t_seq_plan_clear_fn() RETURNS trigger LANGUAGE plpgsql AS $pc$
BEGIN NEW.id := 1; RETURN NEW; END $pc$;
BEGIN;
SAVEPOINT sp;
CREATE TRIGGER t_seq_plan_clear_bu BEFORE UPDATE ON t_seq_plan_clear
  FOR EACH ROW EXECUTE FUNCTION t_seq_plan_clear_fn();
SELECT ft_rows_est('SELECT * FROM t_seq_plan_clear WHERE id = 1', 'on t_seq_plan_clear')
       <= 10 AS trigger_alone_hides_nothing;
trigger_alone_hides_nothing
t
(1 row)
ROLLBACK TO sp;
UPDATE t_seq_plan_clear SET note = 'y';
SELECT ft_rows_est('SELECT * FROM t_seq_plan_clear WHERE id = 1', 'on t_seq_plan_clear')
       >= 100 AS planner_clearing_survives_rollback;
planner_clearing_survives_rollback
t
(1 row)
SELECT fasttrun_collect_stats('t_seq_plan_clear');
fasttrun_collect_stats

(1 row)
UPDATE t_seq_plan_clear SET note = 'z';
SELECT ft_rows_est('SELECT * FROM t_seq_plan_clear WHERE id = 1', 'on t_seq_plan_clear')
       <= 10 AS recollect_restores_exact_mask;
recollect_restores_exact_mask
t
(1 row)
COMMIT;
DROP TABLE t_seq_plan_clear;
DROP FUNCTION t_seq_plan_clear_fn();
-- 46v. Оператор, упавший внутри блока EXCEPTION, до конечного хука не доходит.
--      Его запись обязана уйти вместе с подтранзакцией, иначе все дальнейшие
--      пересборы этого отношения до конца транзакции идут по осторожному пути.
CREATE TEMP TABLE t_seq_failed_stmt (id int, note text);
INSERT INTO t_seq_failed_stmt SELECT g, 'x' FROM generate_series(1, 100000) g;
BEGIN;
DO $fs$
BEGIN
  /* делитель зависит от строки, поэтому ошибка происходит уже в исполнении:
     свёртка констант сняла бы оператор до старта и проверять было бы нечего */
  UPDATE t_seq_failed_stmt SET id = 1 / (id - id);
EXCEPTION WHEN division_by_zero THEN NULL;
END$fs$;
SELECT fasttrun_collect_stats('t_seq_failed_stmt');
fasttrun_collect_stats

(1 row)
UPDATE t_seq_failed_stmt SET note = 'y';
SELECT ft_rows_est('SELECT * FROM t_seq_failed_stmt WHERE id = 1', 'on t_seq_failed_stmt')
       <= 10 AS failed_statement_leaves_no_trace;
failed_statement_leaves_no_trace
t
(1 row)
COMMIT;
DROP TABLE t_seq_failed_stmt;
-- 46w. Обратная сторона: подтранзакция, отменённая внутри действующего UPDATE,
--      не должна уносить запись самого этого UPDATE.
CREATE TEMP TABLE t_seq_nested_abort (id int, note text);
INSERT INTO t_seq_nested_abort SELECT g, 'x' FROM generate_series(1, 100000) g;
SELECT fasttrun_collect_stats('t_seq_nested_abort');
fasttrun_collect_stats

(1 row)
CREATE FUNCTION t_seq_nested_abort_fn(t text) RETURNS int LANGUAGE plpgsql AS $na$
BEGIN
  BEGIN
    PERFORM 1 / 0;
  EXCEPTION WHEN division_by_zero THEN NULL;
  END;
  PERFORM fasttrun_collect_stats(t);
  RETURN 1;
END$na$;
BEGIN;
UPDATE t_seq_nested_abort SET id = (SELECT t_seq_nested_abort_fn('t_seq_nested_abort'));
UPDATE t_seq_nested_abort SET note = 'y' WHERE false;
SELECT ft_rows_est('SELECT * FROM t_seq_nested_abort WHERE id = 1', 'on t_seq_nested_abort')
       >= 100 AS nested_abort_keeps_outer_statement;
nested_abort_keeps_outer_statement
t
(1 row)
ROLLBACK;
DROP TABLE t_seq_nested_abort;
DROP FUNCTION t_seq_nested_abort_fn(text);
-- 46x. Пересбор из выходной части запроса, у которого modifying CTE уже
--      переписал таблицу. Скан идёт по снимку начала команды и новых версий не
--      видит, а счётчики рядом уже включают эти записи, поэтому сравнивать
--      образец не с чем: он не отдаётся до следующего чистого пересбора.
CREATE TEMP TABLE t_seq_cte (id int, note int);
INSERT INTO t_seq_cte SELECT g, 0 FROM generate_series(1, 100000) g;
SELECT fasttrun_collect_stats('t_seq_cte');
fasttrun_collect_stats

(1 row)
BEGIN;
WITH u AS (UPDATE t_seq_cte SET id = 1 RETURNING id)
SELECT count(*) > 0 AS cte_rewrote_everything,
       fasttrun_collect_stats('t_seq_cte') IS NOT DISTINCT FROM NULL AS cte_collect_ran
  FROM u;
cte_rewrote_everything|cte_collect_ran
t|f
(1 row)
SELECT ft_rows_est('SELECT * FROM t_seq_cte WHERE id = 1', 'on t_seq_cte')
       >= 100 AS collect_under_modifying_cte_not_served;
collect_under_modifying_cte_not_served
t
(1 row)
ROLLBACK;
DROP TABLE t_seq_cte;
-- 46y. Обратная сторона учёта по подтранзакциям: вложенный UPDATE того же
--      отношения упал и был перехвачен, внешний завершился штатно. Записи о
--      начатых операторах не остаётся, поэтому следующий пересбор снова точен.
CREATE TEMP TABLE t_seq_nested_err (id int, note int);
INSERT INTO t_seq_nested_err SELECT g, 0 FROM generate_series(1, 100000) g;
SELECT fasttrun_collect_stats('t_seq_nested_err');
fasttrun_collect_stats

(1 row)
CREATE FUNCTION t_seq_nested_err_fn() RETURNS int LANGUAGE plpgsql AS $ne$
BEGIN
  BEGIN
    UPDATE t_seq_nested_err SET note = 1 / (id - id);
  EXCEPTION WHEN division_by_zero THEN NULL;
  END;
  RETURN 7;
END$ne$;
BEGIN;
UPDATE t_seq_nested_err SET note = (SELECT t_seq_nested_err_fn());
SELECT fasttrun_collect_stats('t_seq_nested_err');
fasttrun_collect_stats

(1 row)
UPDATE t_seq_nested_err SET note = 8;
SELECT ft_rows_est('SELECT * FROM t_seq_nested_err WHERE id = 1', 'on t_seq_nested_err')
       <= 10 AS nested_error_leaves_no_residue;
nested_error_leaves_no_residue
t
(1 row)
COMMIT;
DROP TABLE t_seq_nested_err;
DROP FUNCTION t_seq_nested_err_fn();
-- 46z. Реестр начатых операторов конечен. Оператор, у которого целей больше,
--      чем слотов, переводит весь реестр в осторожный ответ до конца
--      транзакции, а её граница возвращает обычную работу.
CREATE TEMP TABLE t_seq_overflow (id int, note int);
INSERT INTO t_seq_overflow SELECT g, 0 FROM generate_series(1, 100000) g;
SELECT fasttrun_collect_stats('t_seq_overflow');
fasttrun_collect_stats

(1 row)
CREATE TEMP TABLE t_seq_many_parent (id int);
DO $ov$
DECLARE i int;
BEGIN
  FOR i IN 1..20 LOOP
    EXECUTE format('CREATE TEMP TABLE t_seq_many_c%s () INHERITS (t_seq_many_parent)', i);
  END LOOP;
END$ov$;
BEGIN;
UPDATE t_seq_many_parent SET id = 1;
SELECT fasttrun_collect_stats('t_seq_overflow');
fasttrun_collect_stats

(1 row)
UPDATE t_seq_overflow SET note = 1;
SELECT ft_rows_est('SELECT * FROM t_seq_overflow WHERE id = 1', 'on t_seq_overflow')
       >= 100 AS overflow_forces_conservative;
overflow_forces_conservative
t
(1 row)
COMMIT;
SELECT fasttrun_collect_stats('t_seq_overflow');
fasttrun_collect_stats

(1 row)
UPDATE t_seq_overflow SET note = 2;
SELECT ft_rows_est('SELECT * FROM t_seq_overflow WHERE id = 1', 'on t_seq_overflow')
       <= 10 AS overflow_cleared_at_xact_end;
overflow_cleared_at_xact_end
t
(1 row)
DO $ov$
DECLARE i int;
BEGIN
  FOR i IN 1..20 LOOP
    EXECUTE format('DROP TABLE t_seq_many_c%s', i);
  END LOOP;
END$ov$;
DROP TABLE t_seq_many_parent;
DROP TABLE t_seq_overflow;
-- 46aa. MERGE: колонка, которую не называет ни одна ветка, обязана уцелеть.
CREATE TEMP TABLE t_seq_merge_keep (id int, grp int, note text);
INSERT INTO t_seq_merge_keep SELECT g, g % 10, 'x' FROM generate_series(1, 100000) g;
SELECT fasttrun_analyze('t_seq_merge_keep');
fasttrun_analyze

(1 row)
CREATE TEMP TABLE t_seq_merge_keep_src (id int);
INSERT INTO t_seq_merge_keep_src SELECT g FROM generate_series(1, 100000) g;
MERGE INTO t_seq_merge_keep USING t_seq_merge_keep_src s ON t_seq_merge_keep.id = s.id
  WHEN MATCHED THEN UPDATE SET grp = 1;
SELECT ft_rows_est('SELECT * FROM t_seq_merge_keep WHERE id = 1', 'on t_seq_merge_keep')
       <= 10 AS merge_untouched_column_kept;
merge_untouched_column_kept
t
(1 row)
DROP TABLE t_seq_merge_keep;
DROP TABLE t_seq_merge_keep_src;
-- 46ab. Учёт по колонкам решает «называли или нет», а не «сколько строк по
--       этой колонке». Пока колонку не называли, чужие UPDATE её не старят;
--       как только назвали хоть раз, ей засчитывается весь оборот таблицы за
--       период, включая соседние UPDATE. Граница грубая и в безопасную сторону.
CREATE TEMP TABLE t_seq_edge_mix (id int, note text);
INSERT INTO t_seq_edge_mix SELECT g, 'x' FROM generate_series(1, 100000) g;
SELECT fasttrun_analyze('t_seq_edge_mix');
fasttrun_analyze

(1 row)
BEGIN;
UPDATE t_seq_edge_mix SET note = 'y';
SELECT ft_rows_est('SELECT * FROM t_seq_edge_mix WHERE id = 1', 'on t_seq_edge_mix')
       <= 10 AS big_neighbour_update_alone_kept;
big_neighbour_update_alone_kept
t
(1 row)
UPDATE t_seq_edge_mix SET id = id WHERE id <= 100;
SELECT ft_rows_est('SELECT * FROM t_seq_edge_mix WHERE id = 1', 'on t_seq_edge_mix')
       >= 100 AS own_tiny_update_charges_whole_period;
own_tiny_update_charges_whole_period
t
(1 row)
COMMIT;
SELECT fasttrun_analyze('t_seq_edge_mix');
fasttrun_analyze

(1 row)
UPDATE t_seq_edge_mix SET id = id WHERE id <= 100;
SELECT ft_rows_est('SELECT * FROM t_seq_edge_mix WHERE id = 1', 'on t_seq_edge_mix')
       <= 10 AS own_tiny_update_alone_kept;
own_tiny_update_alone_kept
t
(1 row)
DROP TABLE t_seq_edge_mix;
-- 46ac. Запрет принадлежит образцу, а не периоду сбора. Откат savepoint
--       возвращает образец прошлого периода вместе с его запретом; сам UPDATE
--       остался вне отката, поэтому данные так и остались переписанными.
CREATE TEMP TABLE t_seq_undo (id int, note int);
INSERT INTO t_seq_undo SELECT g, 0 FROM generate_series(1, 100000) g;
BEGIN;
/* Запрещённый образец: пересбор идёт из выходной части запроса, чей CTE уже
   переписал таблицу. Счётчики рядом с образцом включают эти записи, поэтому
   позже сравнивать будет не с чем -- разница оборота окажется нулевой. */
WITH w AS (UPDATE t_seq_undo SET id = 1 RETURNING id)
SELECT count(*) > 0 AS cte_rewrote, fasttrun_collect_stats('t_seq_undo') FROM w;
cte_rewrote|fasttrun_collect_stats
t|
(1 row)
/* Чистый пересбор внутри savepoint: писателя нет, период новый и безопасный. */
SAVEPOINT s;
SELECT fasttrun_collect_stats('t_seq_undo');
fasttrun_collect_stats

(1 row)
/* Откат возвращает запрещённый образец прошлого периода. Пометка периода тут
   уже снята, и удержать образец может только его собственная. */
ROLLBACK TO s;
SELECT ft_rows_est('SELECT * FROM t_seq_undo WHERE id = 1', 'on t_seq_undo')
       >= 100 AS restored_unsafe_sample_stays_forbidden;
restored_unsafe_sample_stays_forbidden
t
(1 row)
ROLLBACK;
DROP TABLE t_seq_undo;
-- 46ad. Тот же запрет переживает пересбор, который эту колонку пропустил:
--       облегчённому сборщику нужен btree-компаратор, а json его не имеет.
CREATE TEMP TABLE t_seq_skip_unsafe (id int, j json);
INSERT INTO t_seq_skip_unsafe SELECT g, '{"a":1}'::json FROM generate_series(1, 100000) g;
BEGIN;
/* Запрещённый образец json снимается тем же способом -- изнутри запроса, чей
   CTE уже обнулил колонку. */
SET LOCAL fasttrun.use_typanalyze = on;
WITH w AS (UPDATE t_seq_skip_unsafe SET j = NULL RETURNING id)
SELECT count(*) > 0 AS cte_nulled_json, fasttrun_collect_stats('t_seq_skip_unsafe')
  FROM w;
cte_nulled_json|fasttrun_collect_stats
t|
(1 row)
/* Облегчённому сборщику нужен btree-компаратор, а у json его нет: новый период
   эту колонку пропускает, и запрещённый образец остаётся на месте. */
SET LOCAL fasttrun.use_typanalyze = off;
SELECT fasttrun_collect_stats('t_seq_skip_unsafe');
fasttrun_collect_stats

(1 row)
SELECT ft_rows_est('SELECT * FROM t_seq_skip_unsafe WHERE j IS NULL', 'on t_seq_skip_unsafe')
       >= 100 AS skipped_unsafe_sample_stays_forbidden;
skipped_unsafe_sample_stays_forbidden
t
(1 row)
ROLLBACK;
DROP TABLE t_seq_skip_unsafe;
-- 46ae. INSERT и DELETE из modifying CTE меняют таблицу так же незаметно для
--       выборки, идущей по снимку начала команды, поэтому в учёт начатых
--       операторов входят все цели DML, а не только пишущие колонки.
CREATE TEMP TABLE t_seq_cte_ins (id int);
INSERT INTO t_seq_cte_ins SELECT g FROM generate_series(1, 100000) g;
SELECT fasttrun_collect_stats('t_seq_cte_ins');
fasttrun_collect_stats

(1 row)
BEGIN;
WITH w AS (INSERT INTO t_seq_cte_ins SELECT 1 FROM generate_series(1, 100000) RETURNING id)
SELECT count(*) > 0 AS cte_inserted, fasttrun_collect_stats('t_seq_cte_ins') FROM w;
cte_inserted|fasttrun_collect_stats
t|
(1 row)
SELECT ft_rows_est('SELECT * FROM t_seq_cte_ins WHERE id = 1', 'on t_seq_cte_ins')
       >= 100 AS collect_under_modifying_insert_not_served;
collect_under_modifying_insert_not_served
t
(1 row)
ROLLBACK;
DROP TABLE t_seq_cte_ins;
CREATE TEMP TABLE t_seq_cte_del (id int);
INSERT INTO t_seq_cte_del SELECT g FROM generate_series(1, 100000) g;
SELECT fasttrun_collect_stats('t_seq_cte_del');
fasttrun_collect_stats

(1 row)
BEGIN;
WITH w AS (DELETE FROM t_seq_cte_del WHERE id > 1 RETURNING id)
SELECT count(*) > 0 AS cte_deleted, fasttrun_collect_stats('t_seq_cte_del') FROM w;
cte_deleted|fasttrun_collect_stats
t|
(1 row)
SELECT ft_rows_est('SELECT * FROM t_seq_cte_del WHERE id > 1', 'on t_seq_cte_del')
       >= 30000 AS collect_under_modifying_delete_not_served;
collect_under_modifying_delete_not_served
t
(1 row)
ROLLBACK;
DROP TABLE t_seq_cte_del;
-- 46af. Писатель может успеть завершиться, а выборка всё равно останется на
--       прежнем снимке: UPDATE внутри функции закончился, реестр пуст, но
--       внешний снимок его строк не видит. Ловится по возрасту снимка.
CREATE TEMP TABLE t_seq_spi (id int, note int);
INSERT INTO t_seq_spi SELECT g, 0 FROM generate_series(1, 100000) g;
SELECT fasttrun_collect_stats('t_seq_spi');
fasttrun_collect_stats

(1 row)
CREATE FUNCTION t_seq_spi_fn() RETURNS int LANGUAGE plpgsql AS $sf$
BEGIN
  UPDATE t_seq_spi SET id = 1;
  RETURN 1;
END$sf$;
BEGIN;
WITH w AS MATERIALIZED (SELECT t_seq_spi_fn() AS n)
SELECT fasttrun_collect_stats('t_seq_spi') FROM w WHERE n = 1;
fasttrun_collect_stats

(1 row)
SELECT ft_rows_est('SELECT * FROM t_seq_spi WHERE id = 1', 'on t_seq_spi')
       >= 100 AS collect_after_finished_writer_not_served;
collect_after_finished_writer_not_served
t
(1 row)
ROLLBACK;
DROP TABLE t_seq_spi;
DROP FUNCTION t_seq_spi_fn();
-- 46ag. Обратная сторона: обычный первый анализ в той же транзакции, где
--       таблицу создали и наполнили, писателем не считается. Оператор INSERT
--       завершён, снимок анализа взят после него, и статистика обязана жить.
BEGIN;
CREATE TEMP TABLE t_seq_plain_first (id int, note int);
INSERT INTO t_seq_plain_first SELECT g, 0 FROM generate_series(1, 100000) g;
SELECT fasttrun_analyze('t_seq_plain_first');
fasttrun_analyze

(1 row)
SELECT ft_rows_est('SELECT * FROM t_seq_plain_first WHERE id = 1', 'on t_seq_plain_first')
       <= 10 AS first_analyze_in_same_xact_kept;
first_analyze_in_same_xact_kept
t
(1 row)
UPDATE t_seq_plain_first SET note = 7;
SELECT ft_rows_est('SELECT * FROM t_seq_plain_first WHERE id = 1', 'on t_seq_plain_first')
       <= 10 AS first_analyze_survives_neighbour_update;
first_analyze_survives_neighbour_update
t
(1 row)
COMMIT;
DROP TABLE t_seq_plain_first;
-- 46ah. COPY пишет строки мимо исполнителя, поэтому его цель отмечается как
--       идущий писатель отдельно: выборка внутри выражения COPY идёт по снимку
--       той же команды и уже вставленных строк не видит, а счётчики их держат.
CREATE TEMP TABLE t_seq_copy (id int);
INSERT INTO t_seq_copy SELECT generate_series(1, 100000);
SELECT fasttrun_analyze('t_seq_copy');
fasttrun_analyze

(1 row)
BEGIN;
COPY t_seq_copy FROM STDIN
  WHERE CASE WHEN id = 2 THEN fasttrun_collect_stats('t_seq_copy') IS NULL
             ELSE true END;
SELECT ft_rows_est('SELECT * FROM t_seq_copy WHERE id = 1', 'on t_seq_copy')
       >= 100 AS collect_inside_copy_not_served;
collect_inside_copy_not_served
t
(1 row)
ROLLBACK;
DROP TABLE t_seq_copy;
-- 46ai. Обратная сторона: посторонний оператор, сдвинувший номер команды, не
--       имеет права гасить статистику таблицы, которую никто не трогал.
CREATE TEMP TABLE t_seq_untouched (id int);
CREATE TEMP TABLE t_seq_other (n int);
INSERT INTO t_seq_untouched SELECT generate_series(1, 100000);
SELECT fasttrun_analyze('t_seq_untouched');
fasttrun_analyze

(1 row)
CREATE FUNCTION t_seq_other_noop() RETURNS int LANGUAGE plpgsql AS $on$
BEGIN
  UPDATE t_seq_other SET n = n WHERE false;
  RETURN 1;
END$on$;
BEGIN;
WITH w AS MATERIALIZED (SELECT t_seq_other_noop() AS n)
SELECT fasttrun_collect_stats('t_seq_untouched') FROM w WHERE n = 1;
fasttrun_collect_stats

(1 row)
SELECT ft_rows_est('SELECT * FROM t_seq_untouched WHERE id = 1', 'on t_seq_untouched')
       <= 10 AS foreign_writer_keeps_untouched_relation;
foreign_writer_keeps_untouched_relation
t
(1 row)
COMMIT;
SELECT ft_rows_est('SELECT * FROM t_seq_untouched WHERE id = 1', 'on t_seq_untouched')
       <= 10 AS foreign_writer_keeps_after_commit;
foreign_writer_keeps_after_commit
t
(1 row)
DROP TABLE t_seq_untouched;
DROP TABLE t_seq_other;
DROP FUNCTION t_seq_other_noop();
DROP FUNCTION ft_rows_est(text, text);
\pset format aligned
DROP EXTENSION fasttrun;
ALTER DATABASE :DBNAME RESET session_preload_libraries;
