--
-- fasttrun_plan_cache_survive — regression-тест для реального production path
-- со stale SPI / PL/pgSQL plan cache.
--
-- Суть сценария:
--   * static nested UPDATE внутри PL/pgSQL/SPI планируется на первом вызове;
--   * затем этот cached plan переиспользуется в том же backend'е;
--   * после fasttruncate + refill + fasttrun_analyze следующий вызов
--     не должен продолжать жить на stale cached plan.
--
-- Важно: тест специально НЕ проверяет точный join type.  Upstream PG и PGPro
-- могут выбрать разные свежие планы.  Контракт здесь другой:
--   1. второй вызов завершается без statement_timeout;
--   2. fasttruncate реально сбрасывает temp tables между итерациями;
--   3. nested UPDATE обновляет все строки после refill.
--
CREATE EXTENSION fasttrun;
CREATE TEMP TABLE t_balance_out
(
    id int,
    f_charges int,
    f_sale_categories int,
    payload text
);
CREATE TEMP TABLE t_rsd_details
(
    f_charges int,
    f_sale_categories int
);
CREATE OR REPLACE FUNCTION f_inner() RETURNS void
LANGUAGE plpgsql
AS $fn$
BEGIN
    UPDATE t_balance_out AS bo
       SET f_sale_categories = t.f_sale_categories
      FROM (
            SELECT DISTINCT
                   t.f_charges,
                   t.f_sale_categories
              FROM t_rsd_details AS t
           ) AS t
     WHERE t.f_charges = bo.f_charges;
END;
$fn$;
CREATE OR REPLACE FUNCTION f_outer(_n_bo int, _n_rd int) RETURNS void
LANGUAGE plpgsql
AS $fn$
BEGIN
    PERFORM public.fasttruncate('t_balance_out');
    PERFORM public.fasttruncate('t_rsd_details');

    INSERT INTO t_balance_out
    SELECT g, g, NULL, repeat('x', 50)
      FROM generate_series(1, _n_bo) AS g;

    INSERT INTO t_rsd_details
    SELECT g, g % 7
      FROM generate_series(1, _n_rd) AS g;

    PERFORM public.fasttrun_analyze('t_balance_out');
    PERFORM public.fasttrun_analyze('t_rsd_details');

    PERFORM f_inner();
END;
$fn$;
-- Статический SPI statement без параметров держится в generic cached plan.
-- Явно фиксируем этот контракт на уровне сессии.
SET plan_cache_mode = force_generic_plan;
-- Прогреваем SPI cache на маленькой первой итерации: если local invalidation
-- не сработает, stale plan родится именно здесь.
DO $$
BEGIN
    PERFORM f_outer(1, 1);
END
$$;
SELECT count(*) = 1 AS seed_rows_ok,
       count(*) FILTER (WHERE f_sale_categories = id % 7) = 1 AS seed_values_ok
  FROM t_balance_out;
 seed_rows_ok | seed_values_ok 
--------------+----------------
 t            | t
(1 row)

SELECT reltuples = 1 AS seed_stats_ok
  FROM fasttrun_relstats('t_balance_out');
 seed_stats_ok 
---------------
 t
(1 row)

-- Вторая итерация должна и завершиться, и увидеть свежий план.  На PGPro
-- baseline зависает здесь со stale nested-loop SPI plan; timeout нужен ещё
-- и для того, чтобы installcheck не висел бесконечно.
SET statement_timeout = '10s';
DO $$
BEGIN
    PERFORM f_outer(200000, 200000);
EXCEPTION
    WHEN query_canceled THEN
        RAISE EXCEPTION
            'stale SPI cached plan after fasttruncate: f_outer(200000,200000) hit statement_timeout';
END
$$;
RESET statement_timeout;
SELECT count(*) = 200000 AS second_rows_ok,
       count(*) FILTER (WHERE f_sale_categories = id % 7) = 200000 AS second_values_ok
  FROM t_balance_out;
 second_rows_ok | second_values_ok 
----------------+------------------
 t              | t
(1 row)

SELECT reltuples = 200000 AS second_stats_ok
  FROM fasttrun_relstats('t_balance_out');
 second_stats_ok 
-----------------
 t
(1 row)

-- ----------------------------------------------------------------------
-- 2. Путь без fasttruncate: generic cached plan, созданный до
--    fasttrun_analyze, должен инвалидироваться самим вызовом, который
--    публикует статистику.  Это покрывает вызывающих, которые не используют
--    fasttruncate в том же цикле, но всё равно заменяют ANALYZE на
--    fasttrun_analyze.
-- ----------------------------------------------------------------------
CREATE TEMP TABLE t_analyze_cached_plan (id int, grp int);
INSERT INTO t_analyze_cached_plan
SELECT g, g FROM generate_series(1, 100000) g;
CREATE INDEX ON t_analyze_cached_plan (grp);
BEGIN;
SET LOCAL plan_cache_mode = force_generic_plan;
PREPARE q_analyze_only AS
SELECT * FROM t_analyze_cached_plan WHERE grp = 50000;
-- Generic plan создан до fasttrun_analyze: defaults, cached stats ещё нет.
EXPLAIN (COSTS OFF) EXECUTE q_analyze_only;
                        QUERY PLAN                        
----------------------------------------------------------
 Bitmap Heap Scan on t_analyze_cached_plan
   Recheck Cond: (grp = 50000)
   ->  Bitmap Index Scan on t_analyze_cached_plan_grp_idx
         Index Cond: (grp = 50000)
(4 rows)

SELECT fasttrun_analyze('t_analyze_cached_plan');
 fasttrun_analyze 
------------------
 
(1 row)

-- Тот же prepared statement должен перепланироваться и увидеть свежие stats.
EXPLAIN (COSTS OFF) EXECUTE q_analyze_only;
                               QUERY PLAN                                
-------------------------------------------------------------------------
 Index Scan using t_analyze_cached_plan_grp_idx on t_analyze_cached_plan
   Index Cond: (grp = 50000)
(2 rows)

DEALLOCATE q_analyze_only;
COMMIT;
-- ----------------------------------------------------------------------
-- 3. Below-threshold DML без пересбора stats: если generic plan создан
--    после UPDATE ниже порога, когда cached column stats выглядят stale,
--    следующий fasttrun_analyze должен инвалидировать этот plan даже когда
--    relpages/reltuples не изменились.  Перепланированный запрос должен
--    увидеть fallback к defaults, а не старые stats как "свежие".
-- ----------------------------------------------------------------------
CREATE TEMP TABLE t_analyze_freshness_plan (id int, grp int);
INSERT INTO t_analyze_freshness_plan
SELECT g, g FROM generate_series(1, 100000) g;
CREATE INDEX ON t_analyze_freshness_plan (grp);
BEGIN;
SET LOCAL plan_cache_mode = force_generic_plan;
SELECT fasttrun_analyze('t_analyze_freshness_plan');
 fasttrun_analyze 
------------------
 
(1 row)

UPDATE t_analyze_freshness_plan SET id = id WHERE id < 10;
PREPARE q_freshness_only AS
SELECT * FROM t_analyze_freshness_plan WHERE grp = 50000;
-- План создан в окне, когда freshness check отвергает cached stats.
EXPLAIN (COSTS OFF) EXECUTE q_freshness_only;
                         QUERY PLAN                          
-------------------------------------------------------------
 Bitmap Heap Scan on t_analyze_freshness_plan
   Recheck Cond: (grp = 50000)
   ->  Bitmap Index Scan on t_analyze_freshness_plan_grp_idx
         Index Cond: (grp = 50000)
(4 rows)

SELECT fasttrun_analyze('t_analyze_freshness_plan');
 fasttrun_analyze 
------------------
 
(1 row)

-- Тот же prepared statement должен перепланироваться после смены
-- planner-visible состояния stats.
EXPLAIN (COSTS OFF) EXECUTE q_freshness_only;
                         QUERY PLAN                          
-------------------------------------------------------------
 Bitmap Heap Scan on t_analyze_freshness_plan
   Recheck Cond: (grp = 50000)
   ->  Bitmap Index Scan on t_analyze_freshness_plan_grp_idx
         Index Cond: (grp = 50000)
(4 rows)

DEALLOCATE q_freshness_only;
COMMIT;
-- ----------------------------------------------------------------------
-- 4. ROLLBACK TO SAVEPOINT должен инвалидировать generic plan, который
--    родился внутри откатанной подтранзакции и видел subxact-local stats.
--    SQL PREPARE живёт в session memory, поэтому сам rollback не обязан
--    уничтожить prepared statement; fasttrun должен сам послать локальную
--    invalidation при восстановлении stats cache/baseline.
-- ----------------------------------------------------------------------
CREATE TEMP TABLE t_savepoint_cached_plan (id int, grp int);
INSERT INTO t_savepoint_cached_plan
SELECT g, g FROM generate_series(1, 100000) g;
CREATE INDEX ON t_savepoint_cached_plan (grp);
BEGIN;
SET LOCAL plan_cache_mode = force_generic_plan;
SELECT fasttrun_analyze('t_savepoint_cached_plan');
 fasttrun_analyze 
------------------
 
(1 row)

SAVEPOINT sp_plan;
UPDATE t_savepoint_cached_plan SET grp = 1;
SELECT fasttrun_analyze('t_savepoint_cached_plan');
 fasttrun_analyze 
------------------
 
(1 row)

PREPARE q_savepoint_rollback AS
SELECT * FROM t_savepoint_cached_plan WHERE grp = 1;
-- План создан внутри savepoint на распределении, которое будет откатано.
EXPLAIN (COSTS OFF) EXECUTE q_savepoint_rollback;
             QUERY PLAN              
-------------------------------------
 Seq Scan on t_savepoint_cached_plan
   Filter: (grp = 1)
(2 rows)

ROLLBACK TO SAVEPOINT sp_plan;
-- После rollback тот же prepared statement должен быть перепланирован.
EXPLAIN (COSTS OFF) EXECUTE q_savepoint_rollback;
                                 QUERY PLAN                                  
-----------------------------------------------------------------------------
 Index Scan using t_savepoint_cached_plan_grp_idx on t_savepoint_cached_plan
   Index Cond: (grp = 1)
(2 rows)

DEALLOCATE q_savepoint_rollback;
COMMIT;
-- ----------------------------------------------------------------------
-- 5. Standalone fasttrun_collect_stats тоже публикует planner-visible
--    stats и должен инвалидировать generic plans, созданные до ручного
--    сбора статистики.
-- ----------------------------------------------------------------------
CREATE TEMP TABLE t_collect_cached_plan (id int, grp int);
INSERT INTO t_collect_cached_plan
SELECT g, g FROM generate_series(1, 100000) g;
CREATE INDEX ON t_collect_cached_plan (grp);
BEGIN;
SET LOCAL plan_cache_mode = force_generic_plan;
SET LOCAL fasttrun.auto_collect_stats = off;
SELECT fasttrun_analyze('t_collect_cached_plan');
 fasttrun_analyze 
------------------
 
(1 row)

PREPARE q_collect_only AS
SELECT * FROM t_collect_cached_plan WHERE grp = 50000;
-- Generic plan создан до standalone collect_stats: column stats ещё нет.
EXPLAIN (COSTS OFF) EXECUTE q_collect_only;
                        QUERY PLAN                        
----------------------------------------------------------
 Bitmap Heap Scan on t_collect_cached_plan
   Recheck Cond: (grp = 50000)
   ->  Bitmap Index Scan on t_collect_cached_plan_grp_idx
         Index Cond: (grp = 50000)
(4 rows)

SELECT fasttrun_collect_stats('t_collect_cached_plan');
 fasttrun_collect_stats 
------------------------
 
(1 row)

-- collect_stats должен инвалидировать plan cache без помощи fasttruncate.
EXPLAIN (COSTS OFF) EXECUTE q_collect_only;
                               QUERY PLAN                                
-------------------------------------------------------------------------
 Index Scan using t_collect_cached_plan_grp_idx on t_collect_cached_plan
   Index Cond: (grp = 50000)
(2 rows)

DEALLOCATE q_collect_only;
COMMIT;
DROP FUNCTION f_outer(int, int);
DROP FUNCTION f_inner();
DROP TABLE t_rsd_details;
DROP TABLE t_balance_out;
DROP TABLE t_analyze_cached_plan;
DROP TABLE t_analyze_freshness_plan;
DROP TABLE t_savepoint_cached_plan;
DROP TABLE t_collect_cached_plan;
DROP EXTENSION fasttrun;
